AID,Year,Title,Abstract,Authors,DOI,Link
http://arxiv.org/abs/2109.00960v1,2021,Infrared Image Super-Resolution via Heterogeneous Convolutional WGAN,"  Image super-resolution is important in many fields, such as surveillance and
remote sensing. However, infrared (IR) images normally have low resolution
since the optical equipment is relatively expensive. Recently, deep learning
methods have dominated image super-resolution and achieved remarkable
performance on visible images; however, IR images have received less attention.
IR images have fewer patterns, and hence, it is difficult for deep neural
networks (DNNs) to learn diverse features from IR images. In this paper, we
present a framework that employs heterogeneous convolution and adversarial
training, namely, heterogeneous kernel-based super-resolution Wasserstein GAN
(HetSRWGAN), for IR image super-resolution. The HetSRWGAN algorithm is a
lightweight GAN architecture that applies a plug-and-play heterogeneous
kernel-based residual block. Moreover, a novel loss function that employs image
gradients is adopted, which can be applied to an arbitrary model. The proposed
HetSRWGAN achieves consistently better performance in both qualitative and
quantitative evaluations. According to the experimental results, the whole
training process is more stable.
",Yongsong Huang; Zetao Jiang; Qingzhong Wang; Qi Jiang; Guoming Pang,10.1007/978-3-030-89363-7_35,http://arxiv.org/abs/2109.00960v1
http://arxiv.org/abs/2107.06536v1,2021,"Multi-Attention Generative Adversarial Network for Remote Sensing Image
  Super-Resolution","  Image super-resolution (SR) methods can generate remote sensing images with
high spatial resolution without increasing the cost, thereby providing a
feasible way to acquire high-resolution remote sensing images, which are
difficult to obtain due to the high cost of acquisition equipment and complex
weather. Clearly, image super-resolution is a severe ill-posed problem.
Fortunately, with the development of deep learning, the powerful fitting
ability of deep neural networks has solved this problem to some extent. In this
paper, we propose a network based on the generative adversarial network (GAN)
to generate high resolution remote sensing images, named the multi-attention
generative adversarial network (MA-GAN). We first designed a GAN-based
framework for the image SR task. The core to accomplishing the SR task is the
image generator with post-upsampling that we designed. The main body of the
generator contains two blocks; one is the pyramidal convolution in the
residual-dense block (PCRDB), and the other is the attention-based upsample
(AUP) block. The attentioned pyramidal convolution (AttPConv) in the PCRDB
block is a module that combines multi-scale convolution and channel attention
to automatically learn and adjust the scaling of the residuals for better
results. The AUP block is a module that combines pixel attention (PA) to
perform arbitrary multiples of upsampling. These two blocks work together to
help generate better quality images. For the loss function, we design a loss
function based on pixel loss and introduce both adversarial loss and feature
loss to guide the generator learning. We have compared our method with several
state-of-the-art methods on a remote sensing scene image dataset, and the
experimental results consistently demonstrate the effectiveness of the proposed
MA-GAN.
",Meng Xu; Zhihao Wang; Jiasong Zhu; Xiuping Jia; Sen Jia,10.48550/arXiv.2107.06536,http://arxiv.org/abs/2107.06536v1
http://arxiv.org/abs/1812.09375v1,2018,"Multi-Frame Super-Resolution Reconstruction with Applications to Medical
  Imaging","  The optical resolution of a digital camera is one of its most crucial
parameters with broad relevance for consumer electronics, surveillance systems,
remote sensing, or medical imaging. However, resolution is physically limited
by the optics and sensor characteristics. In addition, practical and economic
reasons often stipulate the use of out-dated or low-cost hardware.
Super-resolution is a class of retrospective techniques that aims at
high-resolution imagery by means of software. Multi-frame algorithms approach
this task by fusing multiple low-resolution frames to reconstruct
high-resolution images. This work covers novel super-resolution methods along
with new applications in medical imaging.
",Thomas Köhler,10.48550/arXiv.1812.09375,http://arxiv.org/abs/1812.09375v1
http://arxiv.org/abs/1907.06490v2,2019,"DeepSUM: Deep neural network for Super-resolution of Unregistered
  Multitemporal images","  Recently, convolutional neural networks (CNN) have been successfully applied
to many remote sensing problems. However, deep learning techniques for
multi-image super-resolution from multitemporal unregistered imagery have
received little attention so far. This work proposes a novel CNN-based
technique that exploits both spatial and temporal correlations to combine
multiple images. This novel framework integrates the spatial registration task
directly inside the CNN, and allows to exploit the representation learning
capabilities of the network to enhance registration accuracy. The entire
super-resolution process relies on a single CNN with three main stages: shared
2D convolutions to extract high-dimensional features from the input images; a
subnetwork proposing registration filters derived from the high-dimensional
feature representations; 3D convolutions for slow fusion of the features from
multiple images. The whole network can be trained end-to-end to recover a
single high resolution image from multiple unregistered low resolution images.
The method presented in this paper is the winner of the PROBA-V
super-resolution challenge issued by the European Space Agency.
",Andrea Bordone Molini; Diego Valsesia; Giulia Fracastoro; Enrico Magli,10.1109/TGRS.2019.2959248,http://arxiv.org/abs/1907.06490v2
http://arxiv.org/abs/1911.07934v3,2019,Training Set Effect on Super Resolution for Automated Target Recognition,"  Single Image Super Resolution (SISR) is the process of mapping a
low-resolution image to a high resolution image. This inherently has
applications in remote sensing as a way to increase the spatial resolution in
satellite imagery. This suggests a possible improvement to automated target
recognition in image classification and object detection. We explore the effect
that different training sets have on SISR with the network, Super Resolution
Generative Adversarial Network (SRGAN). We train 5 SRGANs on different land-use
classes (e.g. agriculture, cities, ports) and test them on the same unseen
dataset. We attempt to find the qualitative and quantitative differences in
SISR, binary classification, and object detection performance. We find that
curated training sets that contain objects in the test ontology perform better
on both computer vision tasks while having a complex distribution of images
allows object detection models to perform better. However, Super Resolution
(SR) might not be beneficial to certain problems and will see a diminishing
amount of returns for datasets that are closer to being solved.
",Matthew Ciolino; David Noever; Josh Kalin,10.48550/arXiv.1911.07934,http://arxiv.org/abs/1911.07934v3
http://arxiv.org/abs/2211.11592v2,2022,Guided Depth Super-Resolution by Deep Anisotropic Diffusion,"  Performing super-resolution of a depth image using the guidance from an RGB
image is a problem that concerns several fields, such as robotics, medical
imaging, and remote sensing. While deep learning methods have achieved good
results in this problem, recent work highlighted the value of combining modern
methods with more formal frameworks. In this work, we propose a novel approach
which combines guided anisotropic diffusion with a deep convolutional network
and advances the state of the art for guided depth super-resolution. The edge
transferring/enhancing properties of the diffusion are boosted by the
contextual reasoning capabilities of modern networks, and a strict adjustment
step guarantees perfect adherence to the source image. We achieve unprecedented
results in three commonly used benchmarks for guided depth super-resolution.
The performance gain compared to other methods is the largest at larger scales,
such as x32 scaling. Code for the proposed method will be made available to
promote reproducibility of our results.
",Nando Metzger; Rodrigo Caye Daudt; Konrad Schindler,10.48550/arXiv.2211.11592,http://arxiv.org/abs/2211.11592v2
http://arxiv.org/abs/1903.00440v1,2019,Deep Learning for Multiple-Image Super-Resolution,"  Super-resolution reconstruction (SRR) is a process aimed at enhancing spatial
resolution of images, either from a single observation, based on the learned
relation between low and high resolution, or from multiple images presenting
the same scene. SRR is particularly valuable, if it is infeasible to acquire
images at desired resolution, but many images of the same scene are available
at lower resolution---this is inherent to a variety of remote sensing
scenarios. Recently, we have witnessed substantial improvement in single-image
SRR attributed to the use of deep neural networks for learning the relation
between low and high resolution. Importantly, deep learning has not been
exploited for multiple-image SRR, which benefits from information fusion and in
general allows for achieving higher reconstruction accuracy. In this letter, we
introduce a new method which combines the advantages of multiple-image fusion
with learning the low-to-high resolution mapping using deep networks. The
reported experimental results indicate that our algorithm outperforms the
state-of-the-art SRR methods, including these that operate from a single image,
as well as those that perform multiple-image fusion.
",Michal Kawulok; Pawel Benecki; Szymon Piechaczek; Krzysztof Hrynczenko; Daniel Kostrzewa; Jakub Nalepa,10.1109/LGRS.2019.2940483,http://arxiv.org/abs/1903.00440v1
http://arxiv.org/abs/2007.15417v1,2020,"Very Deep Super-Resolution of Remotely Sensed Images with Mean Square
  Error and Var-norm Estimators as Loss Functions","  In this work, very deep super-resolution (VDSR) method is presented for
improving the spatial resolution of remotely sensed (RS) images for scale
factor 4. The VDSR net is re-trained with Sentinel-2 images and with drone aero
orthophoto images, thus becomes RS-VDSR and Aero-VDSR, respectively. A novel
loss function, the Var-norm estimator, is proposed in the regression layer of
the convolutional neural network during re-training and prediction. According
to numerical and optical comparisons, the proposed nets RS-VDSR and Aero-VDSR
can outperform VDSR during prediction with RS images. RS-VDSR outperforms VDSR
up to 3.16 dB in terms of PSNR in Sentinel-2 images.
",Antigoni Panagiotopoulou; Lazaros Grammatikopoulos; Eleni Charou; Emmanuel Bratsolis; Nicholas Madamopoulos; John Petrogonas,10.48550/arXiv.2007.15417,http://arxiv.org/abs/2007.15417v1
http://arxiv.org/abs/2011.09701v2,2020,"Spectral Response Function Guided Deep Optimization-driven Network for
  Spectral Super-resolution","  Hyperspectral images are crucial for many research works. Spectral
super-resolution (SSR) is a method used to obtain high spatial resolution (HR)
hyperspectral images from HR multispectral images. Traditional SSR methods
include model-driven algorithms and deep learning. By unfolding a variational
method, this paper proposes an optimization-driven convolutional neural network
(CNN) with a deep spatial-spectral prior, resulting in physically interpretable
networks. Unlike the fully data-driven CNN, auxiliary spectral response
function (SRF) is utilized to guide CNNs to group the bands with spectral
relevance. In addition, the channel attention module (CAM) and reformulated
spectral angle mapper loss function are applied to achieve an effective
reconstruction model. Finally, experiments on two types of datasets, including
natural and remote sensing images, demonstrate the spectral enhancement effect
of the proposed method. And the classification results on the remote sensing
dataset also verified the validity of the information enhanced by the proposed
method.
",Jiang He; Jie Li; Qiangqiang Yuan; Huanfeng Shen; Liangpei Zhang,10.48550/arXiv.2011.09701,http://arxiv.org/abs/2011.09701v2
http://arxiv.org/abs/2204.01736v1,2022,"Tracking Urbanization in Developing Regions with Remote Sensing
  Spatial-Temporal Super-Resolution","  Automated tracking of urban development in areas where construction
information is not available became possible with recent advancements in
machine learning and remote sensing. Unfortunately, these solutions perform
best on high-resolution imagery, which is expensive to acquire and infrequently
available, making it difficult to scale over long time spans and across large
geographies. In this work, we propose a pipeline that leverages a single
high-resolution image and a time series of publicly available low-resolution
images to generate accurate high-resolution time series for object tracking in
urban construction. Our method achieves significant improvement in comparison
to baselines using single image super-resolution, and can assist in extending
the accessibility and scalability of building construction tracking across the
developing world.
",Yutong He; William Zhang; Chenlin Meng; Marshall Burke; David B. Lobell; Stefano Ermon,10.48550/arXiv.2204.01736,http://arxiv.org/abs/2204.01736v1
http://arxiv.org/abs/1805.01759v1,2018,"A fast and accurate basis pursuit denoising algorithm with application
  to super-resolving tomographic SAR","  $L_1$ regularization is used for finding sparse solutions to an
underdetermined linear system. As sparse signals are widely expected in remote
sensing, this type of regularization scheme and its extensions have been widely
employed in many remote sensing problems, such as image fusion, target
detection, image super-resolution, and others and have led to promising
results. However, solving such sparse reconstruction problems is
computationally expensive and has limitations in its practical use. In this
paper, we proposed a novel efficient algorithm for solving the complex-valued
$L_1$ regularized least squares problem. Taking the high-dimensional
tomographic synthetic aperture radar (TomoSAR) as a practical example, we
carried out extensive experiments, both with simulation data and real data, to
demonstrate that the proposed approach can retain the accuracy of second order
methods while dramatically speeding up the processing by one or two orders.
Although we have chosen TomoSAR as the example, the proposed method can be
generally applied to any spectral estimation problems.
",Yilei Shi; Xiao Xiang Zhu; Wotao Yin; Richard Bamler,10.48550/arXiv.1805.01759,http://arxiv.org/abs/1805.01759v1
http://arxiv.org/abs/2002.00580v2,2020,"Super-resolution of multispectral satellite images using convolutional
  neural networks","  Super-resolution aims at increasing image resolution by algorithmic means and
has progressed over the recent years due to advances in the fields of computer
vision and deep learning. Convolutional Neural Networks based on a variety of
architectures have been applied to the problem, e.g. autoencoders and residual
networks. While most research focuses on the processing of photographs
consisting only of RGB color channels, little work can be found concentrating
on multi-band, analytic satellite imagery. Satellite images often include a
panchromatic band, which has higher spatial resolution but lower spectral
resolution than the other bands. In the field of remote sensing, there is a
long tradition of applying pan-sharpening to satellite images, i.e. bringing
the multispectral bands to the higher spatial resolution by merging them with
the panchromatic band. To our knowledge there are so far no approaches to
super-resolution which take advantage of the panchromatic band. In this paper
we propose a method to train state-of-the-art CNNs using pairs of
lower-resolution multispectral and high-resolution pan-sharpened image tiles in
order to create super-resolved analytic images. The derived quality metrics
show that the method improves information content of the processed images. We
compare the results created by four CNN architectures, with RedNet30 performing
best.
",M. U. Müller; N. Ekhtiari; R. M. Almeida; C. Rieke,10.5194/isprs-annals-V-1-2020-33-2020,http://arxiv.org/abs/2002.00580v2
http://arxiv.org/abs/2005.10374v4,2020,"Stochastic Super-Resolution for Downscaling Time-Evolving Atmospheric
  Fields with a Generative Adversarial Network","  Generative adversarial networks (GANs) have been recently adopted for
super-resolution, an application closely related to what is referred to as
""downscaling"" in the atmospheric sciences: improving the spatial resolution of
low-resolution images. The ability of conditional GANs to generate an ensemble
of solutions for a given input lends itself naturally to stochastic
downscaling, but the stochastic nature of GANs is not usually considered in
super-resolution applications. Here, we introduce a recurrent, stochastic
super-resolution GAN that can generate ensembles of time-evolving
high-resolution atmospheric fields for an input consisting of a low-resolution
sequence of images of the same field. We test the GAN using two datasets, one
consisting of radar-measured precipitation from Switzerland, the other of cloud
optical thickness derived from the Geostationary Earth Observing Satellite 16
(GOES-16). We find that the GAN can generate realistic, temporally consistent
super-resolution sequences for both datasets. The statistical properties of the
generated ensemble are analyzed using rank statistics, a method adapted from
ensemble weather forecasting; these analyses indicate that the GAN produces
close to the correct amount of variability in its outputs. As the GAN generator
is fully convolutional, it can be applied after training to input images larger
than the images used to train it. It is also able to generate time series much
longer than the training sequences, as demonstrated by applying the generator
to a three-month dataset of the precipitation radar data. The source code to
our GAN is available at https://github.com/jleinonen/downscaling-rnn-gan.
",Jussi Leinonen; Daniele Nerini; Alexis Berne,10.1109/TGRS.2020.3032790,http://arxiv.org/abs/2005.10374v4
http://arxiv.org/abs/2001.06342v1,2020,"DeepSUM++: Non-local Deep Neural Network for Super-Resolution of
  Unregistered Multitemporal Images","  Deep learning methods for super-resolution of a remote sensing scene from
multiple unregistered low-resolution images have recently gained attention
thanks to a challenge proposed by the European Space Agency. This paper
presents an evolution of the winner of the challenge, showing how incorporating
non-local information in a convolutional neural network allows to exploit
self-similar patterns that provide enhanced regularization of the
super-resolution problem. Experiments on the dataset of the challenge show
improved performance over the state-of-the-art, which does not exploit
non-local information.
",Andrea Bordone Molini; Diego Valsesia; Giulia Fracastoro; Enrico Magli,10.48550/arXiv.2001.06342,http://arxiv.org/abs/2001.06342v1
http://arxiv.org/abs/2004.08522v1,2020,"Super-Resolution-based Snake Model -- An Unsupervised Method for
  Large-Scale Building Extraction using Airborne LiDAR Data and Optical Image","  Automatic extraction of buildings in urban and residential scenes has become
a subject of growing interest in the domain of photogrammetry and remote
sensing, particularly since mid-1990s. Active contour model, colloquially known
as snake model, has been studied to extract buildings from aerial and satellite
imagery. However, this task is still very challenging due to the complexity of
building size, shape, and its surrounding environment. This complexity leads to
a major obstacle for carrying out a reliable large-scale building extraction,
since the involved prior information and assumptions on building such as shape,
size, and color cannot be generalized over large areas. This paper presents an
efficient snake model to overcome such challenge, called Super-Resolution-based
Snake Model (SRSM). The SRSM operates on high-resolution LiDAR-based elevation
images -- called z-images -- generated by a super-resolution process applied to
LiDAR data. The involved balloon force model is also improved to shrink or
inflate adaptively, instead of inflating the snake continuously. This method is
applicable for a large scale such as city scale and even larger, while having a
high level of automation and not requiring any prior knowledge nor training
data from the urban scenes (hence unsupervised). It achieves high overall
accuracy when tested on various datasets. For instance, the proposed SRSM
yields an average area-based Quality of 86.57% and object-based Quality of
81.60% on the ISPRS Vaihingen benchmark datasets. Compared to other methods
using this benchmark dataset, this level of accuracy is highly desirable even
for a supervised method. Similarly desirable outcomes are obtained when
carrying out the proposed SRSM on the whole City of Quebec (total area of 656
km2), yielding an area-based Quality of 62.37% and an object-based Quality of
63.21%.
",Thanh Huy Nguyen; Sylvie Daniel; Didier Gueriot; Christophe Sintes; Jean-Marc Le Caillec,10.3390/rs12111702,http://arxiv.org/abs/2004.08522v1
http://arxiv.org/abs/2210.02745v2,2022,MuS2: A Real-World Benchmark for Sentinel-2 Multi-Image Super-Resolution,"  Insufficient image spatial resolution is a serious limitation in many
practical scenarios, especially when acquiring images at a finer scale is
infeasible or brings higher costs. This is inherent to remote sensing,
including Sentinel-2 satellite images that are available free of charge at a
high revisit frequency, but whose spatial resolution is limited to 10 m ground
sampling distance. The resolution can be increased with super-resolution
algorithms, in particular when performed from multiple images captured at
subsequent revisits of a satellite, taking advantage of information fusion that
leads to enhanced reconstruction accuracy. One of the obstacles in multi-image
super-resolution consists in the scarcity of real-world benchmarks - commonly,
simulated data are exploited which do not fully reflect the operating
conditions. In this paper, we introduce a new MuS2 benchmark for
super-resolving multiple Sentinel-2 images, with WorldView-2 imagery used as
the high-resolution reference. Within MuS2, we publish the first end-to-end
evaluation procedure for this problem which we expect to help the researchers
in advancing the state of the art in multi-image super-resolution.
",Pawel Kowaleczko; Tomasz Tarasiewicz; Maciej Ziaja; Daniel Kostrzewa; Jakub Nalepa; Przemyslaw Rokita; Michal Kawulok,10.48550/arXiv.2210.02745,http://arxiv.org/abs/2210.02745v2
http://arxiv.org/abs/2210.07598v1,2022,"Lightweight Stepless Super-Resolution of Remote Sensing Images via
  Saliency-Aware Dynamic Routing Strategy","  Deep learning-based algorithms have greatly improved the performance of
remote sensing image (RSI) super-resolution (SR). However, increasing network
depth and parameters cause a huge burden of computing and storage. Directly
reducing the depth or width of existing models results in a large performance
drop. We observe that the SR difficulty of different regions in an RSI varies
greatly, and existing methods use the same deep network to process all regions
in an image, resulting in a waste of computing resources. In addition, existing
SR methods generally predefine integer scale factors and cannot perform
stepless SR, i.e., a single model can deal with any potential scale factor.
Retraining the model on each scale factor wastes considerable computing
resources and model storage space. To address the above problems, we propose a
saliency-aware dynamic routing network (SalDRN) for lightweight and stepless SR
of RSIs. First, we introduce visual saliency as an indicator of region-level SR
difficulty and integrate a lightweight saliency detector into the SalDRN to
capture pixel-level visual characteristics. Then, we devise a saliency-aware
dynamic routing strategy that employs path selection switches to adaptively
select feature extraction paths of appropriate depth according to the SR
difficulty of sub-image patches. Finally, we propose a novel lightweight
stepless upsampling module whose core is an implicit feature function for
realizing mapping from low-resolution feature space to high-resolution feature
space. Comprehensive experiments verify that the SalDRN can achieve a good
trade-off between performance and complexity. The code is available at
\url{https://github.com/hanlinwu/SalDRN}.
",Hanlin Wu; Ning Ni; Libao Zhang,10.1109/TGRS.2023.3236624,http://arxiv.org/abs/2210.07598v1
