AID,Year,Title,Abstract,Authors,Link,DOI
http://arxiv.org/abs/1804.06244v2,2018,cellSTORM - Cost-effective Super-Resolution on a Cellphone using dSTORM,"  Expensive scientific camera hardware is amongst the main cost factors in
modern, high-performance microscopes. Recent technological advantages have,
however, yielded consumer-grade camera devices that can provide surprisingly
good performance. The camera sensors of smartphones in particular have
benefited of this development. Combined with computing power and due to their
ubiquity, smartphones provide a fantastic opportunity for ""imaging on a
budget"". Here we show that a consumer cellphone is capable even of optical
super-resolution imaging by (direct) Stochastic Optical Reconstruction
Microscopy (dSTORM), achieving optical resolution better than 80 nm. In
addition to the use of standard reconstruction algorithms, we investigated an
approach by a trained image-to-image generative adversarial network (GAN). This
not only serves as a versatile technique to reconstruct video sequences under
conditions where traditional algorithms provide sub-optimal localization
performance, but also allows processing directly on the smartphone. We believe
that ""cellSTORM"" paves the way for affordable super-resolution microscopy
suitable for research and education, expanding access to cutting edge research
to a large community.
",Benedict Diederich; Patrick Then; Alexander Jügler; Ronny Förster; Rainer Heintzmann,http://arxiv.org/abs/1804.06244v2,10.1371/journal.pone.0209827
http://arxiv.org/abs/1810.06611v1,2018,Deep learning-based super-resolution in coherent imaging systems,"  We present a deep learning framework based on a generative adversarial
network (GAN) to perform super-resolution in coherent imaging systems. We
demonstrate that this framework can enhance the resolution of both pixel
size-limited and diffraction-limited coherent imaging systems. We
experimentally validated the capabilities of this deep learning-based coherent
imaging approach by super-resolving complex images acquired using a lensfree
on-chip holographic microscope, the resolution of which was pixel size-limited.
Using the same GAN-based approach, we also improved the resolution of a
lens-based holographic imaging system that was limited in resolution by the
numerical aperture of its objective lens. This deep learning-based
super-resolution framework can be broadly applied to enhance the
space-bandwidth product of coherent imaging systems using image data and
convolutional neural networks, and provides a rapid, non-iterative method for
solving inverse image reconstruction or enhancement problems in optics.
",Tairan Liu; Kevin de Haan; Yair Rivenson; Zhensong Wei; Xin Zeng; Yibo Zhang; Aydogan Ozcan,http://arxiv.org/abs/1810.06611v1,10.1038/s41598-019-40554-1
http://arxiv.org/abs/1812.04240v2,2018,Unsupervised Degradation Learning for Single Image Super-Resolution,"  Deep Convolution Neural Networks (CNN) have achieved significant performance
on single image super-resolution (SR) recently. However, existing CNN-based
methods use artificially synthetic low-resolution (LR) and high-resolution (HR)
image pairs to train networks, which cannot handle real-world cases since the
degradation from HR to LR is much more complex than manually designed. To solve
this problem, we propose a real-world LR images guided bi-cycle network for
single image super-resolution, in which the bidirectional structural
consistency is exploited to train both the degradation and SR reconstruction
networks in an unsupervised way. Specifically, we propose a degradation network
to model the real-world degradation process from HR to LR via generative
adversarial networks, and these generated realistic LR images paired with
real-world HR images are exploited for training the SR reconstruction network,
forming the first cycle. Then in the second reverse cycle, consistency of
real-world LR images are exploited to further stabilize the training of SR
reconstruction and degradation networks. Extensive experiments on both
synthetic and real-world images demonstrate that the proposed algorithm
performs favorably against state-of-the-art single image SR methods.
",Tianyu Zhao; Wenqi Ren; Changqing Zhang; Dongwei Ren; Qinghua Hu,http://arxiv.org/abs/1812.04240v2,10.48550/arXiv.1812.04240
http://arxiv.org/abs/1901.06199v1,2019,"Generative Adversarial Classifier for Handwriting Characters
  Super-Resolution","  Generative Adversarial Networks (GAN) receive great attentions recently due
to its excellent performance in image generation, transformation, and
super-resolution. However, GAN has rarely been studied and trained for
classification, leading that the generated images may not be appropriate for
classification. In this paper, we propose a novel Generative Adversarial
Classifier (GAC) particularly for low-resolution Handwriting Character
Recognition. Specifically, involving additionally a classifier in the training
process of normal GANs, GAC is calibrated for learning suitable structures and
restored characters images that benefits the classification. Experimental
results show that our proposed method can achieve remarkable performance in
handwriting characters 8x super-resolution, approximately 10% and 20% higher
than the present state-of-the-art methods respectively on benchmark data
CASIA-HWDB1.1 and MNIST.
",Zhuang Qian; Kaizhu Huang; Qiufeng Wang; Jimin Xiao; Rui Zhang,http://arxiv.org/abs/1901.06199v1,10.48550/arXiv.1901.06199
http://arxiv.org/abs/2010.04634v1,2020,Attaining Real-Time Super-Resolution for Microscopic Images Using GAN,"  In the last few years, several deep learning models, especially Generative
Adversarial Networks have received a lot of attention for the task of Single
Image Super-Resolution (SISR). These methods focus on building an end-to-end
framework, which produce a high resolution(SR) image from a given low
resolution(LR) image in a single step to achieve state-of-the-art performance.
This paper focuses on improving an existing deep-learning based method to
perform Super-Resolution Microscopy in real-time using a standard GPU. For
this, we first propose a tiling strategy, which takes advantage of parallelism
provided by a GPU to speed up the network training process. Further, we suggest
simple changes to the architecture of the generator and the discriminator of
SRGAN. Subsequently, We compare the quality and the running time for the
outputs produced by our model, opening its applications in different areas like
low-end benchtop and even mobile microscopy. Finally, we explore the
possibility of the trained network to produce High-Resolution HR outputs for
different domains.
",Vibhu Bhatia; Yatender Kumar,http://arxiv.org/abs/2010.04634v1,10.48550/arXiv.2010.04634
http://arxiv.org/abs/2012.01233v1,2020,"Investigating two super-resolution methods for downscaling
  precipitation: ESRGAN and CAR","  In an effort to provide optimal inputs to downstream modeling systems (e.g.,
a hydrodynamics model that simulates the water circulation of a lake), we
hereby strive to enhance resolution of precipitation fields from a weather
model by up to 9x. We test two super-resolution models: the enhanced
super-resolution generative adversarial networks (ESRGAN) proposed in 2017, and
the content adaptive resampler (CAR) proposed in 2020. Both models outperform
simple bicubic interpolation, with the ESRGAN exceeding expectations for
accuracy. We make several proposals for extending the work to ensure it can be
a useful tool for quantifying the impact of climate change on local ecosystems
while removing reliance on energy-intensive, high-resolution weather model
simulations.
",Campbell D. Watson; Chulin Wang; Timothy Lynar; Komminist Weldemariam,http://arxiv.org/abs/2012.01233v1,10.48550/arXiv.2012.01233
http://arxiv.org/abs/2103.15295v3,2021,Best-Buddy GANs for Highly Detailed Image Super-Resolution,"  We consider the single image super-resolution (SISR) problem, where a
high-resolution (HR) image is generated based on a low-resolution (LR) input.
Recently, generative adversarial networks (GANs) become popular to hallucinate
details. Most methods along this line rely on a predefined single-LR-single-HR
mapping, which is not flexible enough for the SISR task. Also, GAN-generated
fake details may often undermine the realism of the whole image. We address
these issues by proposing best-buddy GANs (Beby-GAN) for rich-detail SISR.
Relaxing the immutable one-to-one constraint, we allow the estimated patches to
dynamically seek the best supervision during training, which is beneficial to
producing more reasonable details. Besides, we propose a region-aware
adversarial learning strategy that directs our model to focus on generating
details for textured areas adaptively. Extensive experiments justify the
effectiveness of our method. An ultra-high-resolution 4K dataset is also
constructed to facilitate future super-resolution research.
",Wenbo Li; Kun Zhou; Lu Qi; Liying Lu; Nianjuan Jiang; Jiangbo Lu; Jiaya Jia,http://arxiv.org/abs/2103.15295v3,10.48550/arXiv.2103.15295
http://arxiv.org/abs/2106.05545v1,2021,"Super-Resolution Image Reconstruction Based on Self-Calibrated
  Convolutional GAN","  With the effective application of deep learning in computer vision,
breakthroughs have been made in the research of super-resolution images
reconstruction. However, many researches have pointed out that the
insufficiency of the neural network extraction on image features may bring the
deteriorating of newly reconstructed image. On the other hand, the generated
pictures are sometimes too artificial because of over-smoothing. In order to
solve the above problems, we propose a novel self-calibrated convolutional
generative adversarial networks. The generator consists of feature extraction
and image reconstruction. Feature extraction uses self-calibrated convolutions,
which contains four portions, and each portion has specific functions. It can
not only expand the range of receptive fields, but also obtain long-range
spatial and inter-channel dependencies. Then image reconstruction is performed,
and finally a super-resolution image is reconstructed. We have conducted
thorough experiments on different datasets including set5, set14 and BSD100
under the SSIM evaluation method. The experimental results prove the
effectiveness of the proposed network.
",Yibo Guo; Haidi Wang; Yiming Fan; Shunyao Li; Mingliang Xu,http://arxiv.org/abs/2106.05545v1,10.48550/arXiv.2106.05545
http://arxiv.org/abs/2106.08147v1,2021,Perceptually-inspired super-resolution of compressed videos,"  Spatial resolution adaptation is a technique which has often been employed in
video compression to enhance coding efficiency. This approach encodes a lower
resolution version of the input video and reconstructs the original resolution
during decoding. Instead of using conventional up-sampling filters, recent work
has employed advanced super-resolution methods based on convolutional neural
networks (CNNs) to further improve reconstruction quality. These approaches are
usually trained to minimise pixel-based losses such as Mean-Squared Error
(MSE), despite the fact that this type of loss metric does not correlate well
with subjective opinions. In this paper, a perceptually-inspired
super-resolution approach (M-SRGAN) is proposed for spatial up-sampling of
compressed video using a modified CNN model, which has been trained using a
generative adversarial network (GAN) on compressed content with perceptual loss
functions. The proposed method was integrated with HEVC HM 16.20, and has been
evaluated on the JVET Common Test Conditions (UHD test sequences) using the
Random Access configuration. The results show evident perceptual quality
improvement over the original HM 16.20, with an average bitrate saving of 35.6%
(Bj{\o}ntegaard Delta measurement) based on a perceptual quality metric, VMAF.
",Di Ma; Mariana Afonso; Fan Zhang; David R. Bull,http://arxiv.org/abs/2106.08147v1,10.1117/12.2530688
http://arxiv.org/abs/2109.14994v1,2021,"An investigation of pre-upsampling generative modelling and Generative
  Adversarial Networks in audio super resolution","  There have been several successful deep learning models that perform audio
super-resolution. Many of these approaches involve using preprocessed feature
extraction which requires a lot of domain-specific signal processing knowledge
to implement. Convolutional Neural Networks (CNNs) improved upon this framework
by automatically learning filters. An example of a convolutional approach is
AudioUNet, which takes inspiration from novel methods of upsampling images. Our
paper compares the pre-upsampling AudioUNet to a new generative model that
upsamples the signal before using deep learning to transform it into a more
believable signal. Based on the EDSR network for image super-resolution, the
newly proposed model outperforms UNet with a 20% increase in log spectral
distance and a mean opinion score of 4.06 compared to 3.82 for the two times
upsampling case. AudioEDSR also has 87% fewer parameters than AudioUNet. How
incorporating AudioUNet into a Wasserstein GAN (with gradient penalty)
(WGAN-GP) structure can affect training is also explored. Finally the effects
artifacting has on the current state of the art is analysed and solutions to
this problem are proposed. The methods used in this paper have broad
applications to telephony, audio recognition and audio generation tasks.
",James King; Ramon Viñas Torné; Alexander Campbell; Pietro Liò,http://arxiv.org/abs/2109.14994v1,10.48550/arXiv.2109.14994
http://arxiv.org/abs/2201.09314v1,2022,Perceptual cGAN for MRI Super-resolution,"  Capturing high-resolution magnetic resonance (MR) images is a time consuming
process, which makes it unsuitable for medical emergencies and pediatric
patients. Low-resolution MR imaging, by contrast, is faster than its
high-resolution counterpart, but it compromises on fine details necessary for a
more precise diagnosis. Super-resolution (SR), when applied to low-resolution
MR images, can help increase their utility by synthetically generating
high-resolution images with little additional time. In this paper, we present a
SR technique for MR images that is based on generative adversarial networks
(GANs), which have proven to be quite useful in generating sharp-looking
details in SR. We introduce a conditional GAN with perceptual loss, which is
conditioned upon the input low-resolution image, which improves the performance
for isotropic and anisotropic MRI super-resolution.
",Sahar Almahfouz Nasser; Saqib Shamsi; Valay Bundele; Bhavesh Garg; Amit Sethi,http://arxiv.org/abs/2201.09314v1,10.48550/arXiv.2201.09314
http://arxiv.org/abs/2203.09445v2,2022,Image Super-Resolution With Deep Variational Autoencoders,"  Image super-resolution (SR) techniques are used to generate a high-resolution
image from a low-resolution image. Until now, deep generative models such as
autoregressive models and Generative Adversarial Networks (GANs) have proven to
be effective at modelling high-resolution images. VAE-based models have often
been criticised for their feeble generative performance, but with new
advancements such as VDVAE, there is now strong evidence that deep VAEs have
the potential to outperform current state-of-the-art models for high-resolution
image generation. In this paper, we introduce VDVAE-SR, a new model that aims
to exploit the most recent deep VAE methodologies to improve upon the results
of similar models. VDVAE-SR tackles image super-resolution using transfer
learning on pretrained VDVAEs. The presented model is competitive with other
state-of-the-art models, having comparable results on image quality metrics.
",Darius Chira; Ilian Haralampiev; Ole Winther; Andrea Dittadi; Valentin Liévin,http://arxiv.org/abs/2203.09445v2,10.48550/arXiv.2203.09445
http://arxiv.org/abs/2206.13740v1,2022,"GAN-based Super-Resolution and Segmentation of Retinal Layers in Optical
  coherence tomography Scans","  In this paper, we design a Generative Adversarial Network (GAN)-based
solution for super-resolution and segmentation of optical coherence tomography
(OCT) scans of the retinal layers. OCT has been identified as a non-invasive
and inexpensive modality of imaging to discover potential biomarkers for the
diagnosis and progress determination of neurodegenerative diseases, such as
Alzheimer's Disease (AD). Current hypotheses presume the thickness of the
retinal layers, which are analyzable within OCT scans, can be effective
biomarkers. As a logical first step, this work concentrates on the challenging
task of retinal layer segmentation and also super-resolution for higher clarity
and accuracy. We propose a GAN-based segmentation model and evaluate
incorporating popular networks, namely, U-Net and ResNet, in the GAN
architecture with additional blocks of transposed convolution and sub-pixel
convolution for the task of upscaling OCT images from low to high resolution by
a factor of four. We also incorporate the Dice loss as an additional
reconstruction loss term to improve the performance of this joint optimization
task. Our best model configuration empirically achieved the Dice coefficient of
0.867 and mIOU of 0.765.
",Paria Jeihouni; Omid Dehzangi; Annahita Amireskandari; Ali Rezai; Nasser M. Nasrabadi,http://arxiv.org/abs/2206.13740v1,10.48550/arXiv.2206.13740
http://arxiv.org/abs/2208.03008v1,2022,Rethinking Degradation: Radiograph Super-Resolution via AID-SRGAN,"  In this paper, we present a medical AttentIon Denoising Super Resolution
Generative Adversarial Network (AID-SRGAN) for diographic image
super-resolution. First, we present a medical practical degradation model that
considers various degradation factors beyond downsampling. To the best of our
knowledge, this is the first composite degradation model proposed for
radiographic images. Furthermore, we propose AID-SRGAN, which can
simultaneously denoise and generate high-resolution (HR) radiographs. In this
model, we introduce an attention mechanism into the denoising module to make it
more robust to complicated degradation. Finally, the SR module reconstructs the
HR radiographs using the ""clean"" low-resolution (LR) radiographs. In addition,
we propose a separate-joint training approach to train the model, and extensive
experiments are conducted to show that the proposed method is superior to its
counterparts. e.g., our proposed method achieves $31.90$ of PSNR with a scale
factor of $4 \times$, which is $7.05 \%$ higher than that obtained by recent
work, SPSR [16]. Our dataset and code will be made available at:
https://github.com/yongsongH/AIDSRGAN-MICCAI2022.
",Yongsong Huang; Qingzhong Wang; Shinichiro Omachi,http://arxiv.org/abs/2208.03008v1,10.1007/978-3-031-21014-3_5
http://arxiv.org/abs/2209.03355v1,2022,"Generative Adversarial Super-Resolution at the Edge with Knowledge
  Distillation","  Single-Image Super-Resolution can support robotic tasks in environments where
a reliable visual stream is required to monitor the mission, handle
teleoperation or study relevant visual details. In this work, we propose an
efficient Generative Adversarial Network model for real-time Super-Resolution.
We adopt a tailored architecture of the original SRGAN and model quantization
to boost the execution on CPU and Edge TPU devices, achieving up to 200 fps
inference. We further optimize our model by distilling its knowledge to a
smaller version of the network and obtain remarkable improvements compared to
the standard training approach. Our experiments show that our fast and
lightweight model preserves considerably satisfying image quality compared to
heavier state-of-the-art models. Finally, we conduct experiments on image
transmission with bandwidth degradation to highlight the advantages of the
proposed system for mobile robotic applications.
",Simone Angarano; Francesco Salvetti; Mauro Martini; Marcello Chiaberge,http://arxiv.org/abs/2209.03355v1,10.48550/arXiv.2209.03355
http://arxiv.org/abs/2107.06536v1,2021,"Multi-Attention Generative Adversarial Network for Remote Sensing Image
  Super-Resolution","  Image super-resolution (SR) methods can generate remote sensing images with
high spatial resolution without increasing the cost, thereby providing a
feasible way to acquire high-resolution remote sensing images, which are
difficult to obtain due to the high cost of acquisition equipment and complex
weather. Clearly, image super-resolution is a severe ill-posed problem.
Fortunately, with the development of deep learning, the powerful fitting
ability of deep neural networks has solved this problem to some extent. In this
paper, we propose a network based on the generative adversarial network (GAN)
to generate high resolution remote sensing images, named the multi-attention
generative adversarial network (MA-GAN). We first designed a GAN-based
framework for the image SR task. The core to accomplishing the SR task is the
image generator with post-upsampling that we designed. The main body of the
generator contains two blocks; one is the pyramidal convolution in the
residual-dense block (PCRDB), and the other is the attention-based upsample
(AUP) block. The attentioned pyramidal convolution (AttPConv) in the PCRDB
block is a module that combines multi-scale convolution and channel attention
to automatically learn and adjust the scaling of the residuals for better
results. The AUP block is a module that combines pixel attention (PA) to
perform arbitrary multiples of upsampling. These two blocks work together to
help generate better quality images. For the loss function, we design a loss
function based on pixel loss and introduce both adversarial loss and feature
loss to guide the generator learning. We have compared our method with several
state-of-the-art methods on a remote sensing scene image dataset, and the
experimental results consistently demonstrate the effectiveness of the proposed
MA-GAN.
",Meng Xu; Zhihao Wang; Jiasong Zhu; Xiuping Jia; Sen Jia,http://arxiv.org/abs/2107.06536v1,10.48550/arXiv.2107.06536
http://arxiv.org/abs/1811.00344v2,2018,"Analyzing Perception-Distortion Tradeoff using Enhanced Perceptual
  Super-resolution Network","  Convolutional neural network (CNN) based methods have recently achieved great
success for image super-resolution (SR). However, most deep CNN based SR models
attempt to improve distortion measures (e.g. PSNR, SSIM, IFC, VIF) while
resulting in poor quantified perceptual quality (e.g. human opinion score,
no-reference quality measures such as NIQE). Few works have attempted to
improve the perceptual quality at the cost of performance reduction in
distortion measures. A very recent study has revealed that distortion and
perceptual quality are at odds with each other and there is always a trade-off
between the two. Often the restoration algorithms that are superior in terms of
perceptual quality, are inferior in terms of distortion measures. Our work
attempts to analyze the trade-off between distortion and perceptual quality for
the problem of single image SR. To this end, we use the well-known SR
architecture-enhanced deep super-resolution (EDSR) network and show that it can
be adapted to achieve better perceptual quality for a specific range of the
distortion measure. While the original network of EDSR was trained to minimize
the error defined based on per-pixel accuracy alone, we train our network using
a generative adversarial network framework with EDSR as the generator module.
Our proposed network, called enhanced perceptual super-resolution network
(EPSR), is trained with a combination of mean squared error loss, perceptual
loss, and adversarial loss. Our experiments reveal that EPSR achieves the
state-of-the-art trade-off between distortion and perceptual quality while the
existing methods perform well in either of these measures alone.
",Subeesh Vasu; Nimisha Thekke Madam; Rajagopalan A. N,http://arxiv.org/abs/1811.00344v2,10.48550/arXiv.1811.00344
http://arxiv.org/abs/2011.02427v2,2020,Super-Resolution of Real-World Faces,"  Real low-resolution (LR) face images contain degradations which are too
varied and complex to be captured by known downsampling kernels and
signal-independent noises. So, in order to successfully super-resolve real
faces, a method needs to be robust to a wide range of noise, blur, compression
artifacts etc. Some of the recent works attempt to model these degradations
from a dataset of real images using a Generative Adversarial Network (GAN).
They generate synthetically degraded LR images and use them with corresponding
real high-resolution(HR) image to train a super-resolution (SR) network using a
combination of a pixel-wise loss and an adversarial loss. In this paper, we
propose a two module super-resolution network where the feature extractor
module extracts robust features from the LR image, and the SR module generates
an HR estimate using only these robust features. We train a degradation GAN to
convert bicubically downsampled clean images to real degraded images, and
interpolate between the obtained degraded LR image and its clean LR
counterpart. This interpolated LR image is then used along with it's
corresponding HR counterpart to train the super-resolution network from end to
end. Entropy Regularized Wasserstein Divergence is used to force the encoded
features learnt from the clean and degraded images to closely resemble those
extracted from the interpolated image to ensure robustness.
",Saurabh Goswami;  Aakanksha; Rajagopalan A. N,http://arxiv.org/abs/2011.02427v2,10.48550/arXiv.2011.02427
