AID,Year,Title,Abstract,Authors,Link,DOI
http://arxiv.org/abs/1907.10213v1,2019,"Image Super-Resolution Using a Wavelet-based Generative Adversarial
  Network","  In this paper, we consider the problem of super-resolution recons-truction.
This is a hot topic because super-resolution reconstruction has a wide range of
applications in the medical field, remote sensing monitoring, and criminal
investigation. Compared with traditional algorithms, the current
super-resolution reconstruction algorithm based on deep learning greatly
improves the clarity of reconstructed pictures. Existing work like
Super-Resolution Using a Generative Adversarial Network (SRGAN) can effectively
restore the texture details of the image. However, experimentally verified that
the texture details of the image recovered by the SRGAN are not robust. In
order to get super-resolution reconstructed images with richer high-frequency
details, we improve the network structure and propose a super-resolution
reconstruction algorithm combining wavelet transform and Generative Adversarial
Network. The proposed algorithm can efficiently reconstruct high-resolution
images with rich global information and local texture details. We have trained
our model by PyTorch framework and VOC2012 dataset, and tested it by Set5,
Set14, BSD100 and Urban100 test datasets.
",Qi Zhang; Huafeng Wang; Sichen Yang,http://arxiv.org/abs/1907.10213v1,10.48550/arXiv.1907.10213
http://arxiv.org/abs/2001.08073v2,2020,"ESRGAN+ : Further Improving Enhanced Super-Resolution Generative
  Adversarial Network","  Enhanced Super-Resolution Generative Adversarial Network (ESRGAN) is a
perceptual-driven approach for single image super resolution that is able to
produce photorealistic images. Despite the visual quality of these generated
images, there is still room for improvement. In this fashion, the model is
extended to further improve the perceptual quality of the images. We have
designed a novel block to replace the one used by the original ESRGAN.
Moreover, we introduce noise inputs to the generator network in order to
exploit stochastic variation. The resulting images present more realistic
textures. The code is available at https://github.com/ncarraz/ESRGANplus .
",Nathanaël Carraz Rakotonirina; Andry Rasoanaivo,http://arxiv.org/abs/2001.08073v2,10.1109/ICASSP40776.2020.9054071
http://arxiv.org/abs/1809.04783v2,2018,"Generative adversarial network-based image super-resolution using
  perceptual content losses","  In this paper, we propose a deep generative adversarial network for
super-resolution considering the trade-off between perception and distortion.
Based on good performance of a recently developed model for super-resolution,
i.e., deep residual network using enhanced upscale modules (EUSR), the proposed
model is trained to improve perceptual performance with only slight increase of
distortion. For this purpose, together with the conventional content loss,
i.e., reconstruction loss such as L1 or L2, we consider additional losses in
the training phase, which are the discrete cosine transform coefficients loss
and differential content loss. These consider perceptual part in the content
loss, i.e., consideration of proper high frequency components is helpful for
the trade-off problem in super-resolution. The experimental results show that
our proposed model has good performance for both perception and distortion, and
is effective in perceptual super-resolution applications.
",Manri Cheon; Jun-Hyuk Kim; Jun-Ho Choi; Jong-Seok Lee,http://arxiv.org/abs/1809.04783v2,10.48550/arXiv.1809.04783
http://arxiv.org/abs/2109.08770v2,2021,WiSoSuper: Benchmarking Super-Resolution Methods on Wind and Solar Data,"  The transition to green energy grids depends on detailed wind and solar
forecasts to optimize the siting and scheduling of renewable energy generation.
Operational forecasts from numerical weather prediction models, however, only
have a spatial resolution of 10 to 20-km, which leads to sub-optimal usage and
development of renewable energy farms. Weather scientists have been developing
super-resolution methods to increase the resolution, but often rely on simple
interpolation techniques or computationally expensive differential
equation-based models. Recently, machine learning-based models, specifically
the physics-informed resolution-enhancing generative adversarial network
(PhIREGAN), have outperformed traditional downscaling methods. We provide a
thorough and extensible benchmark of leading deep learning-based
super-resolution techniques, including the enhanced super-resolution generative
adversarial network (ESRGAN) and an enhanced deep super-resolution (EDSR)
network, on wind and solar data. We accompany the benchmark with a novel
public, processed, and machine learning-ready dataset for benchmarking
super-resolution methods on wind and solar data.
",Rupa Kurinchi-Vendhan; Björn Lütjens; Ritwik Gupta; Lucien Werner; Dava Newman,http://arxiv.org/abs/2109.08770v2,10.48550/arXiv.2109.08770
http://arxiv.org/abs/2004.13674v1,2020,"Residual Channel Attention Generative Adversarial Network for Image
  Super-Resolution and Noise Reduction","  Image super-resolution is one of the important computer vision techniques
aiming to reconstruct high-resolution images from corresponding low-resolution
ones. Most recently, deep learning-based approaches have been demonstrated for
image super-resolution. However, as the deep networks go deeper, they become
more difficult to train and more difficult to restore the finer texture
details, especially under real-world settings. In this paper, we propose a
Residual Channel Attention-Generative Adversarial Network(RCA-GAN) to solve
these problems. Specifically, a novel residual channel attention block is
proposed to form RCA-GAN, which consists of a set of residual blocks with
shortcut connections, and a channel attention mechanism to model the
interdependence and interaction of the feature representations among different
channels. Besides, a generative adversarial network (GAN) is employed to
further produce realistic and highly detailed results. Benefiting from these
improvements, the proposed RCA-GAN yields consistently better visual quality
with more detailed and natural textures than baseline models; and achieves
comparable or better performance compared with the state-of-the-art methods for
real-world image super-resolution.
",Jie Cai; Zibo Meng; Chiu Man Ho,http://arxiv.org/abs/2004.13674v1,10.48550/arXiv.2004.13674
http://arxiv.org/abs/1903.11821v1,2019,"SRDGAN: learning the noise prior for Super Resolution with Dual
  Generative Adversarial Networks","  Single Image Super Resolution (SISR) is the task of producing a high
resolution (HR) image from a given low-resolution (LR) image. It is a well
researched problem with extensive commercial applications such as digital
camera, video compression, medical imaging and so on. Most super resolution
works focus on the features learning architecture, which can recover the
texture details as close as possible. However, these works suffer from the
following challenges: (1) The low-resolution (LR) training images are
artificially synthesized using HR images with bicubic downsampling, which have
much richer-information than real demosaic-upscaled mobile images. The mismatch
between training and inference mobile data heavily blocks the improvement of
practical super resolution algorithms. (2) These methods cannot effectively
handle the blind distortions during super resolution in practical applications.
In this work, an end-to-end novel framework, including high-to-low network and
low-to-high network, is proposed to solve the above problems with dual
Generative Adversarial Networks (GAN). First, the above mismatch problems are
well explored with the high-to-low network, where clear high-resolution image
and the corresponding realistic low-resolution image pairs can be generated.
Moreover, a large-scale General Mobile Super Resolution Dataset, GMSR, is
proposed, which can be utilized for training or as a fair comparison benchmark
for super resolution methods. Second, an effective low-to-high network (super
resolution network) is proposed in the framework. Benefiting from the GMSR
dataset and novel training strategies, the super resolution model can
effectively handle detail recovery and denoising at the same time.
",Jingwei Guan; Cheng Pan; Songnan Li; Dahai Yu,http://arxiv.org/abs/1903.11821v1,10.48550/arXiv.1903.11821
http://arxiv.org/abs/1911.10773v2,2019,"Fine-grained Attention and Feature-sharing Generative Adversarial
  Networks for Single Image Super-Resolution","  The traditional super-resolution methods that aim to minimize the mean square
error usually produce the images with over-smoothed and blurry edges, due to
the lose of high-frequency details. In this paper, we propose two novel
techniques in the generative adversarial networks to produce photo-realistic
images for image super-resolution. Firstly, instead of producing a single score
to discriminate images between real and fake, we propose a variant, called
Fine-grained Attention Generative Adversarial Network for image
super-resolution (FASRGAN), to discriminate each pixel between real and fake.
FASRGAN adopts a Unet-like network as the discriminator with two outputs: an
image score and an image score map. The score map has the same spatial size as
the HR/SR images, serving as the fine-grained attention to represent the degree
of reconstruction difficulty for each pixel. Secondly, instead of using
different networks for the generator and the discriminator in the SR problem,
we use a feature-sharing network (Fs-SRGAN) for both the generator and the
discriminator. By network sharing, certain information is shared between the
generator and the discriminator, which in turn can improve the ability of
producing high-quality images. Quantitative and visual comparisons with the
state-of-the-art methods on the benchmark datasets demonstrate the superiority
of our methods. The application of super-resolution images to object
recognition further proves that the proposed methods endow the power to
reconstruction capabilities and the excellent super-resolution effects.
",Yitong Yan; Chuangchuang Liu; Changyou Chen; Xianfang Sun; Longcun Jin; Xiang Zhou,http://arxiv.org/abs/1911.10773v2,10.48550/arXiv.1911.10773
http://arxiv.org/abs/2211.00577v5,2022,"Fine-tuned Generative Adversarial Network-based Model for Medical Images
  Super-Resolution","  In medical image analysis, low-resolution images negatively affect the
performance of medical image interpretation and may cause misdiagnosis. Single
image super-resolution (SISR) methods can improve the resolution and quality of
medical images. Currently, Generative Adversarial Networks (GAN) based
super-resolution models have shown very good performance. Real-Enhanced
Super-Resolution Generative Adversarial Network (Real-ESRGAN) is one of the
practical GAN-based models which is widely used in the field of general image
super-resolution. One of the challenges in the field of medical image
super-resolution is that, unlike natural images, medical images do not have
high spatial resolution. To solve this problem, we can use transfer learning
technique and fine-tune the model that has been trained on external datasets
(often natural datasets). In our proposed approach, the pre-trained generator
and discriminator networks of the Real-ESRGAN model are fine-tuned using
medical image datasets. In this paper, we worked on chest X-ray and retinal
images and used the STARE dataset of retinal images and Tuberculosis Chest
X-rays (Shenzhen) dataset for fine-tuning. The proposed model produces more
accurate and natural textures, and its outputs have better details and
resolution compared to the original Real-ESRGAN outputs.
",Alireza Aghelan; Modjtaba Rouhani,http://arxiv.org/abs/2211.00577v5,10.48550/arXiv.2211.00577
http://arxiv.org/abs/2205.08659v1,2022,Semantically Accurate Super-Resolution Generative Adversarial Networks,"  This work addresses the problems of semantic segmentation and image
super-resolution by jointly considering the performance of both in training a
Generative Adversarial Network (GAN). We propose a novel architecture and
domain-specific feature loss, allowing super-resolution to operate as a
pre-processing step to increase the performance of downstream computer vision
tasks, specifically semantic segmentation. We demonstrate this approach using
Nearmap's aerial imagery dataset which covers hundreds of urban areas at 5-7 cm
per pixel resolution. We show the proposed approach improves perceived image
quality as well as quantitative segmentation accuracy across all prediction
classes, yielding an average accuracy improvement of 11.8% and 108% at 4x and
32x super-resolution, compared with state-of-the art single-network methods.
This work demonstrates that jointly considering image-based and task-specific
losses can improve the performance of both, and advances the state-of-the-art
in semantic-aware super-resolution of aerial imagery.
",Tristan Frizza; Donald G. Dansereau; Nagita Mehr Seresht; Michael Bewley,http://arxiv.org/abs/2205.08659v1,10.48550/arXiv.2205.08659
http://arxiv.org/abs/1707.00737v1,2017,"High-Quality Face Image SR Using Conditional Generative Adversarial
  Networks","  We propose a novel single face image super-resolution method, which named
Face Conditional Generative Adversarial Network(FCGAN), based on boundary
equilibrium generative adversarial networks. Without taking any facial prior
information, our method can generate a high-resolution face image from a
low-resolution one. Compared with existing studies, both our training and
testing phases are end-to-end pipeline with little pre/post-processing. To
enhance the convergence speed and strengthen feature propagation, skip-layer
connection is further employed in the generative and discriminative networks.
Extensive experiments demonstrate that our model achieves competitive
performance compared with state-of-the-art models.
",Huang Bin; Chen Weihai; Wu Xingming; Lin Chun-Liang,http://arxiv.org/abs/1707.00737v1,10.48550/arXiv.1707.00737
http://arxiv.org/abs/1908.06382v2,2019,"RankSRGAN: Generative Adversarial Networks with Ranker for Image
  Super-Resolution","  Generative Adversarial Networks (GAN) have demonstrated the potential to
recover realistic details for single image super-resolution (SISR). To further
improve the visual quality of super-resolved results, PIRM2018-SR Challenge
employed perceptual metrics to assess the perceptual quality, such as PI, NIQE,
and Ma. However, existing methods cannot directly optimize these
indifferentiable perceptual metrics, which are shown to be highly correlated
with human ratings. To address the problem, we propose Super-Resolution
Generative Adversarial Networks with Ranker (RankSRGAN) to optimize generator
in the direction of perceptual metrics. Specifically, we first train a Ranker
which can learn the behavior of perceptual metrics and then introduce a novel
rank-content loss to optimize the perceptual quality. The most appealing part
is that the proposed method can combine the strengths of different SR methods
to generate better results. Extensive experiments show that RankSRGAN achieves
visually pleasing results and reaches state-of-the-art performance in
perceptual metrics. Project page:
https://wenlongzhang0724.github.io/Projects/RankSRGAN
",Wenlong Zhang; Yihao Liu; Chao Dong; Yu Qiao,http://arxiv.org/abs/1908.06382v2,10.48550/arXiv.1908.06382
http://arxiv.org/abs/2107.09427v1,2021,"RankSRGAN: Super Resolution Generative Adversarial Networks with
  Learning to Rank","  Generative Adversarial Networks (GAN) have demonstrated the potential to
recover realistic details for single image super-resolution (SISR). To further
improve the visual quality of super-resolved results, PIRM2018-SR Challenge
employed perceptual metrics to assess the perceptual quality, such as PI, NIQE,
and Ma. However, existing methods cannot directly optimize these
indifferentiable perceptual metrics, which are shown to be highly correlated
with human ratings. To address the problem, we propose Super-Resolution
Generative Adversarial Networks with Ranker (RankSRGAN) to optimize generator
in the direction of different perceptual metrics. Specifically, we first train
a Ranker which can learn the behaviour of perceptual metrics and then introduce
a novel rank-content loss to optimize the perceptual quality. The most
appealing part is that the proposed method can combine the strengths of
different SR methods to generate better results. Furthermore, we extend our
method to multiple Rankers to provide multi-dimension constraints for the
generator. Extensive experiments show that RankSRGAN achieves visually pleasing
results and reaches state-of-the-art performance in perceptual metrics and
quality. Project page: https://wenlongzhang0517.github.io/Projects/RankSRGAN
",Wenlong Zhang; Yihao Liu; Chao Dong; Yu Qiao,http://arxiv.org/abs/2107.09427v1,10.48550/arXiv.2107.09427
http://arxiv.org/abs/2202.12337v1,2022,"Time Efficient Training of Progressive Generative Adversarial Network
  using Depthwise Separable Convolution and Super Resolution Generative
  Adversarial Network","  Generative Adversarial Networks have been employed successfully to generate
high-resolution augmented images of size 1024^2. Although the augmented images
generated are unprecedented, the training time of the model is exceptionally
high. Conventional GAN requires training of both Discriminator as well as the
Generator. In Progressive GAN, which is the current state-of-the-art GAN for
image augmentation, instead of training the GAN all at once, a new concept of
progressing growing of Discriminator and Generator simultaneously, was
proposed. Although the lower stages such as 4x4 and 8x8 train rather quickly,
the later stages consume a tremendous amount of time which could take days to
finish the model training. In our paper, we propose a novel pipeline that
combines Progressive GAN with slight modifications and Super Resolution GAN.
Super Resolution GAN up samples low-resolution images to high-resolution images
which can prove to be a useful resource to reduce the training time
exponentially.
",Atharva Karwande; Pranesh Kulkarni; Tejas Kolhe; Akshay Joshi; Soham Kamble,http://arxiv.org/abs/2202.12337v1,10.48550/arXiv.2202.12337
http://arxiv.org/abs/1907.03063v1,2019,MRI Super-Resolution with Ensemble Learning and Complementary Priors,"  Magnetic resonance imaging (MRI) is a widely used medical imaging modality.
However, due to the limitations in hardware, scan time, and throughput, it is
often clinically challenging to obtain high-quality MR images. The
super-resolution approach is potentially promising to improve MR image quality
without any hardware upgrade. In this paper, we propose an ensemble learning
and deep learning framework for MR image super-resolution. In our study, we
first enlarged low resolution images using 5 commonly used super-resolution
algorithms and obtained differentially enlarged image datasets with
complementary priors. Then, a generative adversarial network (GAN) is trained
with each dataset to generate super-resolution MR images. Finally, a
convolutional neural network is used for ensemble learning that synergizes the
outputs of GANs into the final MR super-resolution images. According to our
results, the ensemble learning results outcome any one of GAN outputs. Compared
with some state-of-the-art deep learning-based super-resolution methods, our
approach is advantageous in suppressing artifacts and keeping more image
details.
",Qing Lyu; Hongming Shan; Ge Wang,http://arxiv.org/abs/1907.03063v1,10.1109/TCI.2020.2964201
http://arxiv.org/abs/2003.03489v1,2020,"Super Resolution Using Segmentation-Prior Self-Attention Generative
  Adversarial Network","  Convolutional Neural Network (CNN) is intensively implemented to solve super
resolution (SR) tasks because of its superior performance. However, the problem
of super resolution is still challenging due to the lack of prior knowledge and
small receptive field of CNN. We propose the Segmentation-Piror Self-Attention
Generative Adversarial Network (SPSAGAN) to combine segmentation-priors and
feature attentions into a unified framework. This combination is led by a
carefully designed weighted addition to balance the influence of feature and
segmentation attentions, so that the network can emphasize textures in the same
segmentation category and meanwhile focus on the long-distance feature
relationship. We also propose a lightweight skip connection architecture called
Residual-in-Residual Sparse Block (RRSB) to further improve the
super-resolution performance and save computation. Extensive experiments show
that SPSAGAN can generate more realistic and visually pleasing textures
compared to state-of-the-art SFTGAN and ESRGAN on many SR datasets.
",Yuxin Zhang; Zuquan Zheng; Roland Hu,http://arxiv.org/abs/2003.03489v1,10.48550/arXiv.2003.03489
http://arxiv.org/abs/2212.13068v1,2022,"Transformer and GAN Based Super-Resolution Reconstruction Network for
  Medical Images","  Because of the necessity to obtain high-quality images with minimal radiation
doses, such as in low-field magnetic resonance imaging, super-resolution
reconstruction in medical imaging has become more popular (MRI). However, due
to the complexity and high aesthetic requirements of medical imaging, image
super-resolution reconstruction remains a difficult challenge. In this paper,
we offer a deep learning-based strategy for reconstructing medical images from
low resolutions utilizing Transformer and Generative Adversarial Networks
(T-GAN). The integrated system can extract more precise texture information and
focus more on important locations through global image matching after
successfully inserting Transformer into the generative adversarial network for
picture reconstruction. Furthermore, we weighted the combination of content
loss, adversarial loss, and adversarial feature loss as the final multi-task
loss function during the training of our proposed model T-GAN. In comparison to
established measures like PSNR and SSIM, our suggested T-GAN achieves optimal
performance and recovers more texture features in super-resolution
reconstruction of MRI scanned images of the knees and belly.
",Weizhi Du; Harvery Tian,http://arxiv.org/abs/2212.13068v1,10.48550/arXiv.2212.13068
http://arxiv.org/abs/1912.09497v1,2019,"Anisotropic Super Resolution in Prostate MRI using Super Resolution
  Generative Adversarial Networks","  Acquiring High Resolution (HR) Magnetic Resonance (MR) images requires the
patient to remain still for long periods of time, which causes patient
discomfort and increases the probability of motion induced image artifacts. A
possible solution is to acquire low resolution (LR) images and to process them
with the Super Resolution Generative Adversarial Network (SRGAN) to create a
super-resolved version. This work applies SRGAN to MR images of the prostate
and performs three experiments. The first experiment explores improving the
in-plane MR image resolution by factors of 4 and 8, and shows that, while the
PSNR and SSIM (Structural SIMilarity) metrics are lower than the isotropic
bicubic interpolation baseline, the SRGAN is able to create images that have
high edge fidelity. The second experiment explores anisotropic super-resolution
via synthetic images, in that the input images to the network are
anisotropically downsampled versions of HR images. This experiment demonstrates
the ability of the modified SRGAN to perform anisotropic super-resolution, with
quantitative image metrics that are comparable to those of the anisotropic
bicubic interpolation baseline. Finally, the third experiment applies a
modified version of the SRGAN to super-resolve anisotropic images obtained from
the through-plane slices of the volumetric MR data. The output super-resolved
images contain a significant amount of high frequency information that make
them visually close to their HR counterparts. Overall, the promising results
from each experiment show that super-resolution for MR images is a successful
technique and that producing isotropic MR image volumes from anisotropic slices
is an achievable goal.
",Rewa Sood; Mirabela Rusu,http://arxiv.org/abs/1912.09497v1,10.1109/ISBI.2019.8759237
