AID,Year,Title,Abstract,Authors,Link,DOI
http://arxiv.org/abs/2302.08047v1,2023,"TcGAN: Semantic-Aware and Structure-Preserved GANs with Individual
  Vision Transformer for Fast Arbitrary One-Shot Image Generation","  One-shot image generation (OSG) with generative adversarial networks that
learn from the internal patches of a given image has attracted world wide
attention. In recent studies, scholars have primarily focused on extracting
features of images from probabilistically distributed inputs with pure
convolutional neural networks (CNNs). However, it is quite difficult for CNNs
with limited receptive domain to extract and maintain the global structural
information. Therefore, in this paper, we propose a novel structure-preserved
method TcGAN with individual vision transformer to overcome the shortcomings of
the existing one-shot image generation methods. Specifically, TcGAN preserves
global structure of an image during training to be compatible with local
details while maintaining the integrity of semantic-aware information by
exploiting the powerful long-range dependencies modeling capability of the
transformer. We also propose a new scaling formula having scale-invariance
during the calculation period, which effectively improves the generated image
quality of the OSG model on image super-resolution tasks. We present the design
of the TcGAN converter framework, comprehensive experimental as well as
ablation studies demonstrating the ability of TcGAN to achieve arbitrary image
generation with the fastest running time. Lastly, TcGAN achieves the most
excellent performance in terms of applying it to other image processing tasks,
e.g., super-resolution as well as image harmonization, the results further
prove its superiority.
",Yunliang Jiang; Lili Yan; Xiongtao Zhang; Yong Liu; Danfeng Sun,http://arxiv.org/abs/2302.08047v1,10.48550/arXiv.2302.08047
http://arxiv.org/abs/1901.11094v1,2019,"Resolution enhancement in scanning electron microscopy using deep
  learning","  We report resolution enhancement in scanning electron microscopy (SEM) images
using a generative adversarial network. We demonstrate the veracity of this
deep learning-based super-resolution technique by inferring unresolved features
in low-resolution SEM images and comparing them with the accurately
co-registered high-resolution SEM images of the same samples. Through spatial
frequency analysis, we also report that our method generates images with
frequency spectra matching higher resolution SEM images of the same
fields-of-view. By using this technique, higher resolution SEM images can be
taken faster, while also reducing both electron charging and damage to the
samples.
",Kevin de Haan; Zachary S. Ballard; Yair Rivenson; Yichen Wu; Aydogan Ozcan,http://arxiv.org/abs/1901.11094v1,10.1038/s41598-019-48444-2
http://arxiv.org/abs/1902.11203v1,2019,Two-phase Hair Image Synthesis by Self-Enhancing Generative Model,"  Generating plausible hair image given limited guidance, such as sparse
sketches or low-resolution image, has been made possible with the rise of
Generative Adversarial Networks (GANs). Traditional image-to-image translation
networks can generate recognizable results, but finer textures are usually lost
and blur artifacts commonly exist. In this paper, we propose a two-phase
generative model for high-quality hair image synthesis. The two-phase pipeline
first generates a coarse image by an existing image translation model, then
applies a re-generating network with self-enhancing capability to the coarse
image. The self-enhancing capability is achieved by a proposed structure
extraction layer, which extracts the texture and orientation map from a hair
image. Extensive experiments on two tasks, Sketch2Hair and Hair
Super-Resolution, demonstrate that our approach is able to synthesize plausible
hair image with finer details, and outperforms the state-of-the-art.
",Haonan Qiu; Chuan Wang; Hang Zhu; Xiangyu Zhu; Jinjin Gu; Xiaoguang Han,http://arxiv.org/abs/1902.11203v1,10.1111/cgf.13847
http://arxiv.org/abs/1903.00142v1,2019,A Unified Neural Architecture for Instrumental Audio Tasks,"  Within Music Information Retrieval (MIR), prominent tasks -- including
pitch-tracking, source-separation, super-resolution, and synthesis -- typically
call for specialised methods, despite their similarities. Conditional
Generative Adversarial Networks (cGANs) have been shown to be highly versatile
in learning general image-to-image translations, but have not yet been adapted
across MIR. In this work, we present an end-to-end supervisable architecture to
perform all aforementioned audio tasks, consisting of a WaveNet synthesiser
conditioned on the output of a jointly-trained cGAN spectrogram translator. In
doing so, we demonstrate the potential of such flexible techniques to unify MIR
tasks, promote efficient transfer learning, and converge research to the
improvement of powerful, general methods. Finally, to the best of our
knowledge, we present the first application of GANs to guided instrument
synthesis.
",Steven Spratley; Daniel Beck; Trevor Cohn,http://arxiv.org/abs/1903.00142v1,10.48550/arXiv.1903.00142
http://arxiv.org/abs/1903.01392v2,2019,An Adversarial Super-Resolution Remedy for Radar Design Trade-offs,"  Radar is of vital importance in many fields, such as autonomous driving,
safety and surveillance applications. However, it suffers from stringent
constraints on its design parametrization leading to multiple trade-offs. For
example, the bandwidth in FMCW radars is inversely proportional with both the
maximum unambiguous range and range resolution. In this work, we introduce a
new method for circumventing radar design trade-offs. We propose the use of
recent advances in computer vision, more specifically generative adversarial
networks (GANs), to enhance low-resolution radar acquisitions into higher
resolution counterparts while maintaining the advantages of the low-resolution
parametrization. The capability of the proposed method was evaluated on the
velocity resolution and range-azimuth trade-offs in micro-Doppler signatures
and FMCW uniform linear array (ULA) radars, respectively.
",Karim Armanious; Sherif Abdulatif; Fady Aziz; Urs Schneider; Bin Yang,http://arxiv.org/abs/1903.01392v2,10.23919/EUSIPCO.2019.8902510
http://arxiv.org/abs/1906.04681v2,2019,"A Hybrid Approach Between Adversarial Generative Networks and
  Actor-Critic Policy Gradient for Low Rate High-Resolution Image Compression","  Image compression is an essential approach for decreasing the size in bytes
of the image without deteriorating the quality of it. Typically, classic
algorithms are used but recently deep-learning has been successfully applied.
In this work, is presented a deep super-resolution work-flow for image
compression that maps low-resolution JPEG image to the high-resolution. The
pipeline consists of two components: first, an encoder-decoder neural network
learns how to transform the downsampling JPEG images to high resolution.
Second, a combination between Generative Adversarial Networks (GANs) and
reinforcement learning Actor-Critic (A3C) loss pushes the encoder-decoder to
indirectly maximize High Peak Signal-to-Noise Ratio (PSNR). Although PSNR is a
fully differentiable metric, this work opens the doors to new solutions for
maximizing non-differential metrics through an end-to-end approach between
encoder-decoder networks and reinforcement learning policy gradient methods.
",Nicoló Savioli,http://arxiv.org/abs/1906.04681v2,10.48550/arXiv.1906.04681
http://arxiv.org/abs/1906.05284v2,2019,Image-Adaptive GAN based Reconstruction,"  In the recent years, there has been a significant improvement in the quality
of samples produced by (deep) generative models such as variational
auto-encoders and generative adversarial networks. However, the representation
capabilities of these methods still do not capture the full distribution for
complex classes of images, such as human faces. This deficiency has been
clearly observed in previous works that use pre-trained generative models to
solve imaging inverse problems. In this paper, we suggest to mitigate the
limited representation capabilities of generators by making them image-adaptive
and enforcing compliance of the restoration with the observations via
back-projections. We empirically demonstrate the advantages of our proposed
approach for image super-resolution and compressed sensing.
",Shady Abu Hussein; Tom Tirer; Raja Giryes,http://arxiv.org/abs/1906.05284v2,10.48550/arXiv.1906.05284
http://arxiv.org/abs/1906.06575v4,2019,"Single Image Super-resolution via Dense Blended Attention Generative
  Adversarial Network for Clinical Diagnosis","  During training phase, more connections (e.g. channel concatenation in last
layer of DenseNet) means more occupied GPU memory and lower GPU utilization,
requiring more training time. The increase of training time is also not
conducive to launch application of SR algorithms. This's why we abandoned
DenseNet as basic network. Futhermore, we abandoned this paper due to its
limitation only applied on medical images. Please view our lastest work applied
on general images at arXiv:1911.03464.
",Kewen Liu; Yuan Ma; Hongxia Xiong; Zejun Yan; Zhijun Zhou; Chaoyang Liu; Panpan Fang; Xiaojun Li; Yalei Chen,http://arxiv.org/abs/1906.06575v4,10.48550/arXiv.1906.06575
http://arxiv.org/abs/1908.00274v1,2019,"Content and Colour Distillation for Learning Image Translations with the
  Spatial Profile Loss","  Generative adversarial networks has emerged as a defacto standard for image
translation problems. To successfully drive such models, one has to rely on
additional networks e.g., discriminators and/or perceptual networks. Training
these networks with pixel based losses alone are generally not sufficient to
learn the target distribution. In this paper, we propose a novel method of
computing the loss directly between the source and target images that enable
proper distillation of shape/content and colour/style. We show that this is
useful in typical image-to-image translations allowing us to successfully drive
the generator without relying on additional networks. We demonstrate this on
many difficult image translation problems such as image-to-image domain
mapping, single image super-resolution and photo realistic makeup transfer. Our
extensive evaluation shows the effectiveness of the proposed formulation and
its ability to synthesize realistic images. [Code release:
https://github.com/ssarfraz/SPL]
",M. Saquib Sarfraz; Constantin Seibold; Haroon Khalid; Rainer Stiefelhagen,http://arxiv.org/abs/1908.00274v1,10.48550/arXiv.1908.00274
http://arxiv.org/abs/1910.10344v1,2019,"Facial Expression Restoration Based on Improved Graph Convolutional
  Networks","  Facial expression analysis in the wild is challenging when the facial image
is with low resolution or partial occlusion. Considering the correlations among
different facial local regions under different facial expressions, this paper
proposes a novel facial expression restoration method based on generative
adversarial network by integrating an improved graph convolutional network
(IGCN) and region relation modeling block (RRMB). Unlike conventional graph
convolutional networks taking vectors as input features, IGCN can use tensors
of face patches as inputs. It is better to retain the structure information of
face patches. The proposed RRMB is designed to address facial generative tasks
including inpainting and super-resolution with facial action units detection,
which aims to restore facial expression as the ground-truth. Extensive
experiments conducted on BP4D and DISFA benchmarks demonstrate the
effectiveness of our proposed method through quantitative and qualitative
evaluations.
",Zhilei Liu; Le Li; Yunpeng Wu; Cuicui Zhang,http://arxiv.org/abs/1910.10344v1,10.1007/978-3-030-37734-2_43
http://arxiv.org/abs/1911.04410v2,2019,"A deep learning framework for morphologic detail beyond the diffraction
  limit in infrared spectroscopic imaging","  Infrared (IR) microscopes measure spectral information that quantifies
molecular content to assign the identity of biomedical cells but lack the
spatial quality of optical microscopy to appreciate morphologic features. Here,
we propose a method to utilize the semantic information of cellular identity
from IR imaging with the morphologic detail of pathology images in a deep
learning-based approach to image super-resolution. Using Generative Adversarial
Networks (GANs), we enhance the spatial detail in IR imaging beyond the
diffraction limit while retaining their spectral contrast. This technique can
be rapidly integrated with modern IR microscopes to provide a framework useful
for routine pathology.
",Kianoush Falahkheirkhah; Kevin Yeh; Shachi Mittal; Luke Pfister; Rohit Bhargava,http://arxiv.org/abs/1911.04410v2,10.48550/arXiv.1911.04410
http://arxiv.org/abs/1912.07116v2,2019,Image Processing Using Multi-Code GAN Prior,"  Despite the success of Generative Adversarial Networks (GANs) in image
synthesis, applying trained GAN models to real image processing remains
challenging. Previous methods typically invert a target image back to the
latent space either by back-propagation or by learning an additional encoder.
However, the reconstructions from both of the methods are far from ideal. In
this work, we propose a novel approach, called mGANprior, to incorporate the
well-trained GANs as effective prior to a variety of image processing tasks. In
particular, we employ multiple latent codes to generate multiple feature maps
at some intermediate layer of the generator, then compose them with adaptive
channel importance to recover the input image. Such an over-parameterization of
the latent space significantly improves the image reconstruction quality,
outperforming existing competitors. The resulting high-fidelity image
reconstruction enables the trained GAN models as prior to many real-world
applications, such as image colorization, super-resolution, image inpainting,
and semantic manipulation. We further analyze the properties of the layer-wise
representation learned by GAN models and shed light on what knowledge each
layer is capable of representing.
",Jinjin Gu; Yujun Shen; Bolei Zhou,http://arxiv.org/abs/1912.07116v2,10.48550/arXiv.1912.07116
http://arxiv.org/abs/2002.08900v1,2020,SynFi: Automatic Synthetic Fingerprint Generation,"  Authentication and identification methods based on human fingerprints are
ubiquitous in several systems ranging from government organizations to consumer
products. The performance and reliability of such systems directly rely on the
volume of data on which they have been verified. Unfortunately, a large volume
of fingerprint databases is not publicly available due to many privacy and
security concerns.
  In this paper, we introduce a new approach to automatically generate
high-fidelity synthetic fingerprints at scale. Our approach relies on (i)
Generative Adversarial Networks to estimate the probability distribution of
human fingerprints and (ii) Super-Resolution methods to synthesize fine-grained
textures. We rigorously test our system and show that our methodology is the
first to generate fingerprints that are computationally indistinguishable from
real ones, a task that prior art could not accomplish.
",M. Sadegh Riazi; Seyed M. Chavoshian; Farinaz Koushanfar,http://arxiv.org/abs/2002.08900v1,10.48550/arXiv.2002.08900
http://arxiv.org/abs/2004.13060v3,2020,GIMP-ML: Python Plugins for using Computer Vision Models in GIMP,"  This paper introduces GIMP-ML v1.1, a set of Python plugins for the widely
popular GNU Image Manipulation Program (GIMP). It enables the use of recent
advances in computer vision to the conventional image editing pipeline.
Applications from deep learning such as monocular depth estimation, semantic
segmentation, mask generative adversarial networks, image super-resolution,
de-noising, de-hazing, matting, enlightening and coloring have been
incorporated with GIMP through Python-based plugins. Additionally, operations
on images such as k-means based color clustering have also been added. GIMP-ML
relies on standard Python packages such as numpy, pytorch, open-cv, scipy.
Apart from these, several image manipulation techniques using these plugins
have been compiled and demonstrated in the YouTube channel
(https://youtube.com/user/kritiksoman) with the objective of demonstrating the
use-cases for machine learning based image modification. In addition, GIMP-ML
also aims to bring the benefits of using deep learning networks used for
computer vision tasks to routine image processing workflows. The code and
installation procedure for configuring these plugins is available at
https://github.com/kritiksoman/GIMP-ML.
",Kritik Soman,http://arxiv.org/abs/2004.13060v3,10.48550/arXiv.2004.13060
http://arxiv.org/abs/2005.11875v2,2020,Bayesian Conditional GAN for MRI Brain Image Synthesis,"  As a powerful technique in medical imaging, image synthesis is widely used in
applications such as denoising, super resolution and modality transformation
etc. Recently, the revival of deep neural networks made immense progress in the
field of medical imaging. Although many deep leaning based models have been
proposed to improve the image synthesis accuracy, the evaluation of the model
uncertainty, which is highly important for medical applications, has been a
missing part. In this work, we propose to use Bayesian conditional generative
adversarial network (GAN) with concrete dropout to improve image synthesis
accuracy. Meanwhile, an uncertainty calibration approach is involved in the
whole pipeline to make the uncertainty generated by Bayesian network
interpretable. The method is validated with the T1w to T2w MR image translation
with a brain tumor dataset of 102 subjects. Compared with the conventional
Bayesian neural network with Monte Carlo dropout, results of the proposed
method reach a significant lower RMSE with a p-value of 0.0186. Improvement of
the calibration of the generated uncertainty by the uncertainty recalibration
method is also illustrated.
",Gengyan Zhao; Mary E. Meyerand; Rasmus M. Birn,http://arxiv.org/abs/2005.11875v2,10.48550/arXiv.2005.11875
http://arxiv.org/abs/2006.10250v1,2020,Progressively Unfreezing Perceptual GAN,"  Generative adversarial networks (GANs) are widely used in image generation
tasks, yet the generated images are usually lack of texture details. In this
paper, we propose a general framework, called Progressively Unfreezing
Perceptual GAN (PUPGAN), which can generate images with fine texture details.
Particularly, we propose an adaptive perceptual discriminator with a
pre-trained perceptual feature extractor, which can efficiently measure the
discrepancy between multi-level features of the generated and real images. In
addition, we propose a progressively unfreezing scheme for the adaptive
perceptual discriminator, which ensures a smooth transfer process from a large
scale classification task to a specified image generation task. The qualitative
and quantitative experiments with comparison to the classical baselines on
three image generation tasks, i.e. single image super-resolution, paired
image-to-image translation and unpaired image-to-image translation demonstrate
the superiority of PUPGAN over the compared approaches.
",Jinxuan Sun; Yang Chen; Junyu Dong; Guoqiang Zhong,http://arxiv.org/abs/2006.10250v1,10.48550/arXiv.2006.10250
http://arxiv.org/abs/2006.15228v1,2020,"HypervolGAN: An efficient approach for GAN with multi-objective training
  function","  Since the advent of generative adversarial networks (GANs), various loss
functions have been developed and combined to constitute the overall training
objective function, in order to improve model performance or for specific
learning tasks. For instance, in image enhancement or restoration, there are
often several criteria to consider such as signal-noise ratio, smoothness,
structures and details. However, when the optimization goal has more than one
adversarial loss, balancing multiple losses in the overall function becomes a
challenging, critical and time-consuming problem. In this paper, we propose to
tackle the problem by means of efficient multi-objective optimization. The
proposed HypervolGAN adopts an adapted version of hypervolume maximization
method to effectively define the multi-objective training function for GAN. We
tested our proposed method on solving single image super-resolution problem.
Experiments show that the proposed HypervolGAN is efficient in saving
computational time and efforts for fine-tuning weights of various losses, and
can generate enhanced samples that have better quality than results given by
baseline GANs. The work explores the integration of adversarial learning and
optimization techniques, which can benefit not only image processing but also a
wide range of applications.
",Jingwen Su; Hujun Yin,http://arxiv.org/abs/2006.15228v1,10.48550/arXiv.2006.15228
http://arxiv.org/abs/2008.12463v2,2020,Accelerated WGAN update strategy with loss change rate balancing,"  Optimizing the discriminator in Generative Adversarial Networks (GANs) to
completion in the inner training loop is computationally prohibitive, and on
finite datasets would result in overfitting. To address this, a common update
strategy is to alternate between k optimization steps for the discriminator D
and one optimization step for the generator G. This strategy is repeated in
various GAN algorithms where k is selected empirically. In this paper, we show
that this update strategy is not optimal in terms of accuracy and convergence
speed, and propose a new update strategy for Wasserstein GANs (WGAN) and other
GANs using the WGAN loss(e.g. WGAN-GP, Deblur GAN, and Super-resolution GAN).
The proposed update strategy is based on a loss change ratio comparison of G
and D. We demonstrate that the proposed strategy improves both convergence
speed and accuracy.
",Xu Ouyang; Gady Agam,http://arxiv.org/abs/2008.12463v2,10.48550/arXiv.2008.12463
http://arxiv.org/abs/2009.09574v1,2020,"Reconstruct high-resolution multi-focal plane images from a single 2D
  wide field image","  High-resolution 3D medical images are important for analysis and diagnosis,
but axial scanning to acquire them is very time-consuming. In this paper, we
propose a fast end-to-end multi-focal plane imaging network (MFPINet) to
reconstruct high-resolution multi-focal plane images from a single 2D
low-resolution wild filed image without relying on scanning. To acquire
realistic MFP images fast, the proposed MFPINet adopts generative adversarial
network framework and the strategies of post-sampling and refocusing all focal
planes at one time. We conduct a series experiments on cytology microscopy
images and demonstrate that MFPINet performs well on both axial refocusing and
horizontal super resolution. Furthermore, MFPINet is approximately 24 times
faster than current refocusing methods for reconstructing the same volume
images. The proposed method has the potential to greatly increase the speed of
high-resolution 3D imaging and expand the application of low-resolution
wide-field images.
",Jiabo Ma; Sibo Liu; Shenghua Cheng; Xiuli Liu; Li Cheng; Shaoqun Zeng,http://arxiv.org/abs/2009.09574v1,10.48550/arXiv.2009.09574
http://arxiv.org/abs/2012.04842v2,2020,Improving the Fairness of Deep Generative Models without Retraining,"  Generative Adversarial Networks (GANs) advance face synthesis through
learning the underlying distribution of observed data. Despite the high-quality
generated faces, some minority groups can be rarely generated from the trained
models due to a biased image generation process. To study the issue, we first
conduct an empirical study on a pre-trained face synthesis model. We observe
that after training the GAN model not only carries the biases in the training
data but also amplifies them to some degree in the image generation process. To
further improve the fairness of image generation, we propose an interpretable
baseline method to balance the output facial attributes without retraining. The
proposed method shifts the interpretable semantic distribution in the latent
space for a more balanced image generation while preserving the sample
diversity. Besides producing more balanced data regarding a particular
attribute (e.g., race, gender, etc.), our method is generalizable to handle
more than one attribute at a time and synthesize samples of fine-grained
subgroups. We further show the positive applicability of the balanced data
sampled from GANs to quantify the biases in other face recognition systems,
like commercial face attribute classifiers and face super-resolution
algorithms.
",Shuhan Tan; Yujun Shen; Bolei Zhou,http://arxiv.org/abs/2012.04842v2,10.48550/arXiv.2012.04842
