"Evaluation of Eight Thermal Infrared Kernel-Driven Models Using Limited Observations","X. Ran; B. Cao; B. Qin; Z. Bian; Y. Du; H. Li; Q. Xiao; Q. Liu","Chinese Academy of Sciences, Aerospace Information Research Institute, Beijing; Chinese Academy of Sciences, Aerospace Information Research Institute, Beijing; Chinese Academy of Sciences, Aerospace Information Research Institute, Beijing; Chinese Academy of Sciences, Aerospace Information Research Institute, Beijing; Chinese Academy of Sciences, Aerospace Information Research Institute, Beijing; Chinese Academy of Sciences, Aerospace Information Research Institute, Beijing; Chinese Academy of Sciences, Aerospace Information Research Institute, Beijing; Chinese Academy of Sciences, Aerospace Information Research Institute, Beijing","2021 IEEE International Geoscience and Remote Sensing Symposium IGARSS","12 Oct 2021","2021","","","6869","6872","In the thermal infrared domain, there are four widely used 3-parameter kernel-driven models (RL, Vinnikov, Ross-Li and LSF-Li), and four newly proposed 4-parameter kernel-driven models (Vinnikov-RL, Vinnikov-Chen, LSF-RL and LSF-Chen). The fitting abilities of these eight models with limited observations are unknown which makes it difficult to choose the best one in practical applications. In this study, aimed to comprehensively evaluate all eight kernel-driven models, 1700 groups of multi-angle directional brightness temperature (DBT) datasets were simulated by the 4SAIL model considering 10 different leaf area indexes, 1 7 different component temperatures, 2 hotspot factors and 5 solar zenith angles. There are 13 angles from -60° to 60° with a step of 10° in the solar principal plane. Five, seven, nine and eleven angle groups produce 225, 400, 225, and 36 limited-angle combinations, respectively. The total 886 combinations were used to drive these eight kernel-driven models. Then, the fitted DBTs were compared with the 4SAIL simulated DBTs. Results show that LSF - Li always has the least fitting mean RMSE (0.24), followed by Ross-Li (0.33), Vinnikov (0.35), and RL (0.42) for 3-parameter models. The 4-parameter kernel-driven models have the same level accuracy (mean RMSE ≈ 0.10) and are much better than these 3-parameter models.","2153-7003","978-1-6654-0369-6","10.1109/IGARSS47720.2021.9554924","","https://ieeexplore.ieee.org/stamp/stamp.jsp?arnumber=9554924","DBT;TIR;kernel-driven model;4SAIL;limited-angle","Temperature;Fitting;Geoscience and remote sensing;Brightness temperature;Indexes","atmospheric temperature;vegetation","solar principal plane;solar zenith angles;hotspot factors;component temperatures;leaf area indexes;3-parameter models;LSF - Li;4SAIL model;multiangle directional brightness temperature datasets;LSF-RL;Vinnikov-RL;4-parameter kernel-driven models;LSF-Li;Ross-Li;3-parameter kernel-driven models;thermal infrared domain;thermal infrared kernel-driven models","","","","10","IEEE","12 Oct 2021","","","IEEE","IEEE Conferences"
"New MAIAC AOD Product Based High Resolution PM2.5 Spatial-Temporal Distribution Change at Urban Scale –––– Case Study of Wuhan","Q. Zhan; Z. Fan; S. Yan; S. Yang; C. Yang","School of Urban Design, Wuhan University, Wuhan, China; School of Urban Design, Wuhan University, Wuhan, China; School of Urban Design, Wuhan University, Wuhan, China; School of Urban Design, Wuhan University, Wuhan, China; School of Urban Design, Wuhan University, Wuhan, China","2019 10th International Workshop on the Analysis of Multitemporal Remote Sensing Images (MultiTemp)","14 Oct 2019","2019","","","1","4","In China, PM2.5 pollution has been an urgent problem affecting human health for urban areas. However, due to limited observation data, long period change of PM2.5 distribution at urban scale has not received much attention. In this study, we use a machine learning method, Gradient Boost Decision Tree (GBDT) with powerful predictive capacity, to derive and to analyze the winter PM2.5 spatial-temporal distribution change of Wuhan between two periods (December, 2005 to February, 2008 and December, 2015 to February, 2018). The new 1km Multi-Angle Implementation of Atmospheric Correction (MAIAC) AOD product is used as the primary predictor which can ensure PM2.5 distribution with high resolution at urban scale. It is found that PM2.5 pollution in winter of Wuhan is serious with averaged concentration value being more than 75 μg/m3in both periods. In addition, PM2.5 concentration shows a decreased trend in the central areas of Wuhan but an increased trend in some suburb areas because of urban expansion and construction.","","978-1-7281-4615-7","10.1109/Multi-Temp.2019.8866902","","https://ieeexplore.ieee.org/stamp/stamp.jsp?arnumber=8866902","PM2.5;MAIAC AOD;Spatial-temporal distribution;Urban scale;Long period","Urban areas;Spatial resolution;Pollution;Monitoring;Sociology;Statistics;Training","aerosols;air pollution;atmospheric composition;atmospheric optics;atmospheric techniques;decision trees;learning (artificial intelligence);remote sensing","MAIAC AOD product;PM2.5 Spatial-Temporal Distribution Change;urban scale;Wuhan;urban areas;machine learning method;Gradient Boost Decision Tree;Atmospheric Correction AOD product;urban expansion","","","","22","IEEE","14 Oct 2019","","","IEEE","IEEE Conferences"
"Detection and/or distinction between haze and/or cloud","S. Mukai; I. Sano; M. Nakata","Kyoto College of Graduate Studies for Infromatics, Kyoto, Japan; Kinki University, Higashi-Osaka, Japan; Kinki University, Higashi-Osaka, Japan","2015 IEEE International Geoscience and Remote Sensing Symposium (IGARSS)","12 Nov 2015","2015","","","2210","2213","The concentration of air pollutants has become severe, and influence of biomass burning aerosols (BBA) generated by agricultural biomass burning (ABB) has been noted upon the severe haze episodes. This work intends to show the retrieval algorithm as far as heavy air pollution caused by ABB is concerned. Aerosol retrieval in the hazy atmosphere is achieved based on radiation simulation method of successive order of scattering (MSOS) for the moderate resolution imaging spectroradiometer (MODIS) on AQUA data. Multi-angle observations with the polarization and directionality of the Earth's reflectances (POLDER) on the polarization & anisotropy of reflectances for atmospheric sciences coupled with observations from a lidar (PARASOL) are available for aerosol retrieval from a mixture of cloud and haze.","2153-7003","978-1-4799-7929-5","10.1109/IGARSS.2015.7326244","","https://ieeexplore.ieee.org/stamp/stamp.jsp?arnumber=7326244","BBA;ABB;MSOS;MODIS;POLDER","Aerosols;Atmospheric modeling;Clouds;MODIS;Satellites;Scattering","aerosols;air pollution;clouds;remote sensing by laser beam","haze detection;haze distinction;cloud detection;cloud distinction;air pollutant concentration;biomass burning aerosol;agricultural biomass burning;haze episodes;retrieval algorithm;aerosol retrieval;hazy atmosphere;radiation simulation method;moderate resolution imaging spectroradiometer;MODIS;AQUA data;POLDER;atmospheric sciences;lidar;PARASOL","","","","6","IEEE","12 Nov 2015","","","IEEE","IEEE Conferences"
"Microphysical characteristics analysis of three heavy snowfall events from the MASCRAD campaign in Greeley, Colorado, USA","W. Bang; K. Kim; G. Lee; M. Thurai; P. Kennedy; V. N. Bringi; B. Notaros","Department of Astronomy and Atmospheric Sciences, Kyungpook National University, Daegu, Republic of Korea; Department of Astronomy and Atmospheric Sciences, Kyungpook National University, Daegu, Republic of Korea; Department of Astronomy and Atmospheric Sciences, Kyungpook National University, Daegu, Republic of Korea; Electrical & Computer Engineering Dept., Colorado State University, CO, USA; Electrical & Computer Engineering Dept., Colorado State University, CO, USA; Electrical & Computer Engineering Dept., Colorado State University, CO, USA; Electrical & Computer Engineering Dept., Colorado State University, CO, USA","2016 URSI Asia-Pacific Radio Science Conference (URSI AP-RASC)","20 Oct 2016","2016","","","1555","1557","Analysis of data from three snow events during the MASCRAD winter campaign in Greeley, Colorado, USA, are presented. The campaign entailed multi-angle snowflake camera (MASC), 2D-video disdrometer, precipitation occurrence sensor system, Pluvio gauge, weather station, all installed at the well-established MASCRAD (MASC + Radar) snow field site, as well as state-of-the-art S- and X-band polarimetric radars. We present here microphysical characteristics analysis for three heavy snowfall cases, on (a) 21–22 Feb 2015, (b) 15 Dec 2015, and (c) 01–02 Feb 2016.","","978-1-4673-8801-6","10.1109/URSIAP-RASC.2016.7601356","","https://ieeexplore.ieee.org/stamp/stamp.jsp?arnumber=7601356","snow observations;remote sensing;polarimetric radar;S- and X-band radars;optical disdrometers;microphysical characteristics analysis;heavy snowfall","Radar;Instruments","cameras;data analysis;radar polarimetry;remote sensing by radar;snow","AD 02 01 to 02;AD 2015 12 15;AD 2015 02 21 to 22;X-band polarimetric radar;S-band polarimetric radar;MASCRAD snow field site;weather station;Pluvio gauge;precipitation occurrence sensor system;2D video disdrometer;multiangle snowflake camera;MASCRAD winter campaign;data analysis;USA;Colorado;Greeley;snowfall event microphysical characteristics analysis","","2","","7","IEEE","20 Oct 2016","","","IEEE","IEEE Conferences"
"Snow precipitation measurement and analysis during MASCRAD Winter observations","B. M. Notaros; V. N. Bringi; C. Kleinkort; G. -J. Huang; M. Thurai; P. C. Kennedy; S. B. Manic; A. J. Newman","Electrical & Computer Engineering Dept., Colorado State University, Ft. Collins, CO, USA; Electrical & Computer Engineering Dept., Colorado State University, Ft. Collins, CO, USA; Electrical & Computer Engineering Dept., Colorado State University, Ft. Collins, CO, USA; Electrical & Computer Engineering Dept., Colorado State University, Ft. Collins, CO, USA; Electrical & Computer Engineering Dept., Colorado State University, Ft. Collins, CO, USA; Electrical & Computer Engineering Dept., Colorado State University, Ft. Collins, CO, USA; Electrical & Computer Engineering Dept., Colorado State University, Ft. Collins, CO, USA; Research Applications Laboratory/Hydrometeorology Applications Program, National Center for Atmospheric Research (NCAR), Boulder, CO, USA","2016 IEEE International Symposium on Antennas and Propagation (APSURSI)","27 Oct 2016","2016","","","2047","2048","We present our continued studies of winter precipitation within the MASCRAD (MASC + Radar) project, using multi-angle snowflake camera (MASC), 2D-video disdrometer, computational electromagnetic scattering methods, and state-of-the-art polarimetric radar. We also introduce some recent advancements to the observation and analysis process, and discuss new illustrative results.","1947-1491","978-1-5090-2886-3","10.1109/APS.2016.7696730","","https://ieeexplore.ieee.org/stamp/stamp.jsp?arnumber=7696730","snow observations;polarimetric radar;scattering;remote sensing","Three-dimensional displays;Image reconstruction;Snow;Radar scattering;Shape;Radar polarimetry","atmospheric techniques;radar polarimetry;remote sensing by radar;snow","snow precipitation measurement;snow precipitation analysis;MASCRAD winter observation;winter precipitation;MASCRAD project;multiangle snowflake camera;2D video disdrometer;computational electromagnetic scattering method;polarimetric radar","","1","","3","IEEE","27 Oct 2016","","","IEEE","IEEE Conferences"
"Degree of Linear Polarization of Land Surfaces: Analyses Using POLDER/PARASOL Measurements","S. Liu; L. Yan; B. Yang","Beijing Key Laboratory of Spatial Information Integration and 3S Application, Institute of Remote Sensing and Geographic Information System, School of Earth and Space Sciences, Peking University, Beijing, China; Guangxi Key Laboratory of Remote Measuring System, Guilin University of Aerospace Technology, Guilin, China; College of Electrical and Information Engineering, Hunan University, Changsha, China","IEEE Access","12 Nov 2020","2020","8","","200561","200572","Polarized reflectance (Rp) and degree of linear polarization (DOLP) provide essential information about polarized characteristics of land surfaces. For a given target, DOLP determines the magnitude of Rp. It has been proved that DOLP can be used for some remote monitoring cases that cannot be well detected with either non-polarized or polarized reflectance. Several bidirectional polarization distribution function (BPDF) models have been proposed in the last several decades to reproduce the angular distribution of Rp, but much less attention has been devoted to modeling and analyzing of DOLP. In this study, the Nadal-Bréon BPDF model was transferred for calculating the DOLP of earth targets, and characteristics of DOLP were analyzed based on the modeling results. To evaluate the model's feasibility, two experiments were executed: a fitting and a a priori modeling. The results showed good correlations (r>0.9) between estimated and measured DOLP when the model was fitted with POLDER/PARASOL (a space-borne multi-angle multi-spectral polarimetric sensor) measurements. An increase of accuracy from 490 nm to 865 nm for fitting modeling was achieved and the highest accuracy was found at 865 nm for both experiments, with overall relative root mean square errors of 1.1 and 1.3 for fitting and a priori modeling, respectively. Class-based free parameters can be used for the a priori model of DOLP. The dispersion of the target-based free parameters controls the correlation of the a priori modeling results. Moreover, the maximum DOLP was found to be strongly determined by the corresponding bidirectional reflectance factor for every surface type (R2=0.86). This study provides an additional approach for obtaining DOLP from remote sensing platform and is helpful for studies of typical land surfaces.","2169-3536","","10.1109/ACCESS.2020.3033981","Natural Science Foundation of Hunan Province, China(grant numbers:2019JJ50047); National Natural Science Foundation of China(grant numbers:41801227); National Key Research and Development Program of China(grant numbers:2017YFB0503004); ","https://ieeexplore.ieee.org/stamp/stamp.jsp?arnumber=9240922","Degree of linear polarization (DOLP);bidirectional polarization distribution function (BPDF);POLDER/PARASOL;BRDF-BPDF database","Land surface;Analytical models;Biological system modeling;Atmospheric modeling;Databases;Forestry;Earth","geophysical techniques;polarimetry;remote sensing","linear polarization;polarized reflectance;polarized characteristics;bidirectional polarization distribution function models;Nadal-Bréon BPDF model;space-borne multiangle multispectral polarimetric sensor;fitting modeling;a priori model;target-based free parameters;maximum DOLP;corresponding bidirectional reflectance factor;land surfaces;POLDER/PARASOL measurements;size 490.0 nm to 865.0 nm","","2","","33","CCBY","27 Oct 2020","","","IEEE","IEEE Journals"
"Hyperspectral Inversion of Soil Moisture Content Based on SOILSPECT Model","Y. Yao; Y. Liu; M. Gao; Z. Chen","Key Laboratory of Remote Sensing on Agriculture, Ministry of Agriculture, Beijing, China; Key Laboratory of Remote Sensing on Agriculture, Ministry of Agriculture, Beijing, China; Institute of Agricultural Resources and Regional Planning, Chinese Academy of Agricultural Sciences, Beijing, China; Institute of Agricultural Resources and Regional Planning, Chinese Academy of Agricultural Sciences, Beijing, China","2018 7th International Conference on Agro-geoinformatics (Agro-geoinformatics)","30 Sep 2018","2018","","","1","6","Soil moisture content (SMC) is the important information for the crop land irrigation management and drought warning. The study of SMC quantitative inversion based on hyperspectral remote sensing technology has become the hot spot. Because of using statistical modeling methods and without considering soil bidirectional reflection characteristics, the SMC inversion accuracy and model applicable scope were limited. The purpose of this study was to use the soil radiation transfer model (SOILSPECT) to invert SMC in order to not only improve the SMC hyperspectral inversion accuracy, but also make the model applying widely. Taking the black soil and chernozem in Gongzhuling city of Jilin province as the study object, this paper conducted multi-angle spectrometry measurement for different SMC from 5% to 45% (5% interval) to get measured soil reflectance by using the ASD Fieldspec Pro spectrometer under the indoor condition. The influences of the light source zenith angle, observing zenith angle, azimuth angle and SMC on soil bidirectional reflectance distribution function (BRDF) were analyzed. Then SOILSPECT model parameters were obtained by using Particle Swarm Optimization (PSO) method under the different SMC gradients, and SMC inversion by using SOILSPECT model was conducted. The results showed that soil BRDF declined with SMC rising in the range of 400~1400 nm wavelength, when SMC was less than the field water holding capacity, and soil BRDF rose with SMC rising when SMC was larger than the field water holding capacity. In the range of 1400~2400nm wavelength and under different observing zenith angles, there was no rules for soil BRDF changing. SMC inversion accuracy based on SOILSPECT model was higher. R2 value was above 0.98 compared the estimated values with the measured values. The inversion accuracy for 15% and 30% of SMC were higher at every sensitive band, but that for other SMC was unsteadiness. SMC inversion accuracy based on SOILSPECT model increased with the decreasing of the observational zenith angle. The vertical observation can get the highest SMC inversion accuracy.","","978-1-5386-5038-7","10.1109/Agro-Geoinformatics.2018.8476086","","https://ieeexplore.ieee.org/stamp/stamp.jsp?arnumber=8476086","soil moisture content;hyperspectral inversion;BRDF;SOILSPECT model","Soil measurements;Reflectivity;Mathematical model;Scattering;Hyperspectral sensors;Soil moisture","geophysical techniques;irrigation;moisture;radiative transfer;reflectivity;remote sensing;soil","Particle Swarm Optimization;light source zenith angle;observing zenith angle;azimuth angle;SOILSPECT model parameters;soil bidirectional reflectance distribution function;SMC hyperspectral inversion accuracy;soil radiation transfer model;soil bidirectional reflection characteristics;statistical modeling methods;SMC quantitative inversion;soil moisture content;highest SMC inversion accuracy;soil BRDF","","","","31","IEEE","30 Sep 2018","","","IEEE","IEEE Conferences"
"A Unique Satellite Formation of Super-Polyhedron for Multistatic SAR","Y. Zhang; H. Zhang; K. Liu; R. Wang; Y. Deng; C. Li","University of Chinese Academy of Sciences, Beijing, China; Department of Space Microwave Remote Sensing System, Chinese Academy of Sciences, Beijing, China; Department of Space Microwave Remote Sensing System, Chinese Academy of Sciences, Beijing, China; Department of Space Microwave Remote Sensing System, Chinese Academy of Sciences, Beijing, China; Department of Space Microwave Remote Sensing System, Chinese Academy of Sciences, Beijing, China; University of Chinese Academy of Sciences, Beijing, China","2019 6th Asia-Pacific Conference on Synthetic Aperture Radar (APSAR)","30 Mar 2020","2019","","","1","6","Spaceborne multistatic synthetic aperture radar has wide applications, including digital beamforming (DBF), cross-and along-track interferometry, multi-angle imaging et al. Nevertheless, classical satellite formations are very difficult to meet the application requirements of multistatic SAR synchronously. Therefore, Super-Polyhedron (SP), a unique satellite formation, is presented to avoid those weaknesses and provide more potential for the rapid development of multistatic SAR. Moreover, Super-Tetrahedron (ST), as a specific instance, is exhibited to highlight the advantages of the formation by compared with other satellite formations with the same number of satellites.","2474-2333","978-1-7281-2912-9","10.1109/APSAR46974.2019.9048376","","https://ieeexplore.ieee.org/stamp/stamp.jsp?arnumber=9048376","satellite formation;Super-Polyhedron;Super-Tetrahedron;multistatic SAR (MuSAR)","","array signal processing;radar imaging;spaceborne radar;synthetic aperture radar","Super-Tetrahedron;application requirements;classical satellite formations;multiangle imaging;along-track interferometry;digital beamforming;spaceborne multistatic synthetic aperture radar;multistatic SAR;super-polyhedron;unique satellite formation","","","","25","IEEE","30 Mar 2020","","","IEEE","IEEE Conferences"
"Modified Degree of Polarization Function for Rough Metallic Surface Parameter Estimation Based on Multispectral Polarimetric Measurement","X. Wang; J. Yuan; C. Yan; Y. Qiao; J. Zhang; X. Ju; N. Ding; Y. Dong","University of Chinese Academy of Sciences, Beijing, China; University of Chinese Academy of Sciences, Beijing, China; Center of Materials Science and Optoelectrics Engineering, University of Chinese Academy of Science, Beijing, China; Changchun Institute of Optics, Fine Mechanics and Physics, Chinese Academy of Sciences, Changchun, China; Changchun Institute of Optics, Fine Mechanics and Physics, Chinese Academy of Sciences, Changchun, China; Changchun Institute of Optics, Fine Mechanics and Physics, Chinese Academy of Sciences, Changchun, China; University of Chinese Academy of Sciences, Beijing, China; University of Chinese Academy of Sciences, Beijing, China","IEEE Access","6 Nov 2020","2020","8","","197184","197193","In order to recognize different materials from passive polarimetric measurements specifically, a model that can describe the distribution of polarization energy scattered from the target surface is needed for estimating the parameters of interest (complex refractive index n, k and surface roughness σ) of targets. This paper presents a new method for targets parameters estimation. The presented method modifies the degree of linear polarization (DOLP) model by introducing the Lorentz-Drude dispersion constants which do not vary with wavelength as well as the diffuse component of reflection related to the surface roughness to the DOLP equation. This solves the problem of difficulty and inaccuracy caused by multi-angle passive polarimetric measurements used by previous works and helps to improving the parameters estimation accuracy for rough targets. The Monte Carlo simulations result illustrate that the presented method is robust to Gaussian noise. Moreover, the experimental results of rough aluminium plate and rough copper plate validate the effectiveness of the presented model. The errors of estimated n are about 8% for aluminium plate and 9% for copper plate. The errors of estimated k are less than 4% for aluminium plate and no more than 5% for copper plate. The errors of estimated surface roughness σ are about 6.8% and about 6% for aluminium plate and copper plate respectively. The high estimation accuracy and less detection angle requirement achieved by the presented method are significant for material characterization in passive remote sensing application.","2169-3536","","10.1109/ACCESS.2020.3025155","National Key Research and Development Program of China(grant numbers:2016YFF0103603); Technology Development Program of Jilin Province, China(grant numbers:20180201012GX); National Natural Science Foundation of China (NSFC)(grant numbers:61627819,61727818,6187030909,61875192); National Natural Science Foundation of China Youth Fund(grant numbers:61805235); STS Project of Chinese Academy of Science(grant numbers:KFJ-STS-SCYD-212,KFJ-STS-ZDTP-049,KFJ-STS-ZDTP-057); ","https://ieeexplore.ieee.org/stamp/stamp.jsp?arnumber=9200992","Polarization;refractive index estimation;degree of linear polarization;surface roughness;remote sensing recognition;Lorentz-Drude model","Rough surfaces;Surface roughness;Mathematical model;Refractive index;Reflection;Estimation;Dispersion","light polarisation;Monte Carlo methods;polarimetry;reflectivity;refractive index;remote sensing;rough surfaces","polarization function;rough metallic surface parameter estimation;multispectral polarimetric measurement;polarization energy;target surface;complex refractive index;targets parameters estimation;linear polarization;Lorentz-Drude dispersion constants;DOLP equation;multiangle passive polarimetric measurements;parameters estimation accuracy;rough targets;Monte Carlo simulations result;rough aluminium plate;rough copper plate;surface roughness;high estimation accuracy;passive remote sensing application","","1","","33","CCBY","21 Sep 2020","","","IEEE","IEEE Journals"
