"Multi-angle SAR image fusion algorithm based on visibility classification of non-layover region targets","S. Zhu; D. Ran","School of Space Information, Space Engineering University, Beijing, China; School of Space Information, Space Engineering University, Beijing, China","2017 International Conference on Security, Pattern Analysis, and Cybernetics (SPAC)","1 Mar 2018","2017","","","642","647","In order to reduce the layover region in traditional single-angle synthetic aperture radar (SA-SAR) image of mountainous area, a multi-angle synthetic aperture radar (MA-SAR) image fusion algorithm based on visibility classification of non-layover region targets is proposed. By defining a practical index named multi-angle visibility of non-layover region targets which used for automatic pixel classification, the proposed algorithm calculates the visibility index of every pixel of SA-SAR images obtained from different observation angles and fuses those pixels with the same visibility index to form the fused image. The fused image can effectively eliminate all adverse effects on target detection and classification which caused by the phenomenon of layover, and realize a precision MA-SAR imaging of mountainous area. The simulation results have verified the effectiveness of the proposed algorithm.","","978-1-5386-3016-7","10.1109/SPAC.2017.8304355","","https://ieeexplore.ieee.org/stamp/stamp.jsp?arnumber=8304355","Multi-angle synthetic aperture radar (MA-SAR);Image fusion;Multi-angle visibility index;Automatic pixel classification","Filtering;Indexes;Synthetic aperture radar;Image fusion;Image segmentation;Speckle;Imaging","geophysical image processing;image classification;image fusion;object detection;radar imaging;radar resolution;remote sensing by radar;synthetic aperture radar;visibility","multiangle SAR image fusion algorithm;visibility classification;layover region;single-angle synthetic aperture radar image;mountainous area;multiangle synthetic aperture radar image fusion algorithm;multiangle visibility;automatic pixel classification;visibility index;SA-SAR images;target detection;precision MA-SAR imaging;observation angles;image fusion;nonlayover region targets","","4","","9","IEEE","1 Mar 2018","","","IEEE","IEEE Conferences"
"The Harp Hype Ran Gular Imaging Polarimeter and the Need for Small Satellite Payloads with High Science Payoff for Earth Science Remote Sensing","J. V. Martins; R. Fernandez-Borda; B. McBride; L. Remer; H. M. J. Barbosa","UMBC, Joint Center for Earth Systems Technology, Maryland, USA; UMBC, Joint Center for Earth Systems Technology, Maryland, USA; UMBC, Joint Center for Earth Systems Technology, Maryland, USA; UMBC, Joint Center for Earth Systems Technology, Maryland, USA; Instituto de Física, Universidade de São Paulo, São Paulo, Brasil","IGARSS 2018 - 2018 IEEE International Geoscience and Remote Sensing Symposium","4 Nov 2018","2018","","","6304","6307","The largest uncertainties on estimating climate change revolve around the lack of quantitative information on aerosol and cloud microphysical properties, which limits our understanding of cloud-aerosol interaction processes and cloud feedbacks in the climate system. Part of this limitation comes from the small number of global satellite sensors which in turn only measures a restricted subset of aerosol and cloud microphysical properties. Enabling small satellites to perform high quality cloud and aerosol microphysical measurements is an important pathway to resolve this puzzle. The reduced cost of small satellites can enable the use of multiple platforms or even constellations to increase spatial and temporal coverage for the required measurements. The HARP (HyperAngular Rainbow Polarimeter) is a 3U CubeSat sensor designed for the measurement of aerosol, clouds and surface properties with a wide FOV that enables nearly global coverage from multiple wavelengths and tens of different along track viewing angles. The technology developed for HARP allows for all these characteristics to be packaged within the envelope of a CubeSat sensor while preserving strict science requirements.","2153-7003","978-1-5386-7150-4","10.1109/IGARSS.2018.8518823","","https://ieeexplore.ieee.org/stamp/stamp.jsp?arnumber=8518823","Aerosol;Clouds;Polarimeter;Multi-Angle;CubeSat","Aerosols;Cloud computing;Sensors;Aircraft;NASA;Climate change","aerosols;artificial satellites;atmospheric measuring apparatus;clouds;polarimeters;remote sensing","climate change;cloud microphysical properties;cloud-aerosol interaction processes;cloud feedbacks;climate system;global satellite sensors;high quality cloud;aerosol microphysical measurements;CubeSat sensor;strict science requirements;harp hype;gular imaging Polarimeter;small satellite payloads;high science payoff;earth science remote sensing;HARP;HyperAngular Rainbow Polarimeter;3U CubeSat sensor;surface properties","","19","","8","IEEE","4 Nov 2018","","","IEEE","IEEE Conferences"
"A Combined Algorithm for Soil and Vegetation Temperatures with SLSTR Dual-Angle Data","Z. Bian; B. Cao; H. Li; Y. Du; Q. Xiao; Q. Liu","State Key Laboratory of Remote Sensing Science, Institute of Remote Sensing and Digital Earth, Chinese Academy of Sciences, Beijing, China; State Key Laboratory of Remote Sensing Science, Institute of Remote Sensing and Digital Earth, Chinese Academy of Sciences, Beijing, China; State Key Laboratory of Remote Sensing Science, Institute of Remote Sensing and Digital Earth, Chinese Academy of Sciences, Beijing, China; State Key Laboratory of Remote Sensing Science, Institute of Remote Sensing and Digital Earth, Chinese Academy of Sciences, Beijing, China; State Key Laboratory of Remote Sensing Science, Institute of Remote Sensing and Digital Earth, Chinese Academy of Sciences, Beijing, China; State Key Laboratory of Remote Sensing Science, Institute of Remote Sensing and Digital Earth, Chinese Academy of Sciences, Beijing, China","IGARSS 2019 - 2019 IEEE International Geoscience and Remote Sensing Symposium","14 Nov 2019","2019","","","154","157","Because of noises from land surface temperature (LST) inversion and different spatial resolution between nadir and oblique views, we proposed a combined algorithm for soil and vegetation temperatures with Sea and Land Surface Temperature Radiometer (SLSTR) data, in which a Bayesian strategy was adopted and retrieval results from a multi-pixel algorithm were selected as a priori information in a multi-angle algorithm. The SLSTR LST that inverted by a general split-window algorithm was evaluated first to understand inversion noise. Then, the combined algorithm was evaluated using a synthetic dataset, which displayed a robust performance than the multiangle and the multi-pixel algorithm.","2153-7003","978-1-5386-9154-0","10.1109/IGARSS.2019.8898727","","https://ieeexplore.ieee.org/stamp/stamp.jsp?arnumber=8898727","SLSTR data;soil and vegetation temperatures;Bayesian strategy","Land surface temperature;Ocean temperature;Land surface;Soil;Sea surface;Vegetation mapping;Temperature sensors","atmospheric techniques;land surface temperature;radiometers;remote sensing","different spatial resolution;oblique views;vegetation temperatures;Land Surface Temperature Radiometer data;multipixel algorithm;multiangle algorithm;SLSTR LST;general split-window algorithm;inversion noise;SLSTR dual-angle data;land surface temperature inversion","","","","12","IEEE","14 Nov 2019","","","IEEE","IEEE Conferences"
"An Approach of Feature Matching for Multi-Angle SAR Images of Man-Made Targets","Y. Zhang; F. Li; C. Ding; B. Lei; X. Qiu","Institute of Electronics, Chinese Academy of Sciences; Institute of Electronics, Chinese Academy of Sciences; Institute of Electronics, Chinese Academy of Sciences; Institute of Electronics, Chinese Academy of Sciences; Institute of Electronics, Chinese Academy of Sciences","IGARSS 2019 - 2019 IEEE International Geoscience and Remote Sensing Symposium","14 Nov 2019","2019","","","1200","1203","Accumulation of target features from multi-angle observation data is of great significance for SAR Automatic Target Recognition. How to make correspondence matching with multi-angle data effectively for man-made targets? Due to the intensities and positions of the scattering centers varies with the aspect angle strongly, it is difficult to register SAR images using traditional matching methods. In this work, an approach for feature matching of man-made targets is proposed from complex SAR data. And it is based on the mechanisms of the dominate scattering to build up the relationship of the different multi-aspect images. Scattering map is employed to make scattering center extractions. Then the scattering centers are matching by using the physical model. Terra-SAR data of an aircraft test the validity of the approach.","2153-7003","978-1-5386-9154-0","10.1109/IGARSS.2019.8899875","","https://ieeexplore.ieee.org/stamp/stamp.jsp?arnumber=8899875","SAR ATR;Multi-angle SAR images;Feature matching","Scattering;Radar polarimetry;Feature extraction;Mathematical model;Synthetic aperture radar;Aircraft;Geometry","aircraft testing;image matching;object recognition;radar imaging;synthetic aperture radar","aircraft test;Terra-SAR data;target features accumulation;scattering center extractions;multiaspect images;complex SAR data;scattering centers;correspondence matching;SAR automatic target recognition;multiangle observation data;man-made targets;multiangle SAR images;feature matching;terra-SAR data","","1","","6","IEEE","14 Nov 2019","","","IEEE","IEEE Conferences"
"Application of Photon Recollision Probability Theory for Compatibility Check Between Foliage Clumping and Leaf Area Index Products Obtained from Earth Observation Data","J. Pisek; H. Buddenbaum; F. Camacho; J. Hill; J. L. R. Jensen; H. Lange; Z. Liu; A. Piayda; Y. Qu; O. Roupsard; S. P. Serbin; S. Solberg; O. Sonnentag; A. Thimonier; F. Vuolo","Tartu Observatory, Tõravere, Estonia; Trier University, Trier, Germany; EOLAB, Valencia, Spain; Trier University, Trier, Germany; Texas State University, San Marcos, TX, USA; Norwegian Institute of Bioeconomy Research, Ås, Akershus, Norway; Center for Ecological Research, Northeast Forestry University, Harbin, China; Thünen Institute of Climate-Smart Agriculture, Braunschweig, Germany; Beijing Normal University, Beijing, China; CIRAD-Persyst, Montpellier, France; Brookhaven National Laboratory, Upton, NY, USA; Norwegian Institute of Bioeconomy Research, Ås, Akershus, Norway; Université de Montréal, Montréal, QC, Canada; WSL-Swiss Federal Institute for Forest, Snow and Landscape Research, Birmensdorf, Switzerland; Institute of Surveying, Remote Sensing and Land Information, Vienna, Austria","IGARSS 2018 - 2018 IEEE International Geoscience and Remote Sensing Symposium","4 Nov 2018","2018","","","5918","5920","Clumping index (CI) is a measure of foliage aggregation relative to a random distribution of leaves in space. The CI can help with estimating fractions of sunlit and shaded leaves for a given value of leaf area index (LAI). Both the CI and LAI can be obtained from global Earth Observing (EO) systems such as the Moderate Resolution Imaging Spectrometer (MODIS). Here, the compatibility between CI and LAI products derived from EO data is examined independently using the theory of spectral invariants, also referred to as photon recollision probability theory (i.e. ` p-theory'), along with raw LAI-2000/2200 Plant Canopy Analyzer data from 75 sites distributed across a range of plant functional types (PFTs). The p-theory describes the probability (p-value) that a photon, having intercepted an element in the canopy, will recollide with another canopy element rather than escape the canopy. Our results indicate that the integration of empirically-based CI maps with the MODIS LAI product is feasible, providing a potential means to improve the accuracy of LAI EO data products. Given the strong results for the large range of PFTs explored here, we demonstrate the capacity to obtain p-values for any location solely from EO data. This is relevant for future applications of the photon recollision probability concept for global and local monitoring of vegetation using EO data.","2153-7003","978-1-5386-7150-4","10.1109/IGARSS.2018.8518535","","https://ieeexplore.ieee.org/stamp/stamp.jsp?arnumber=8518535","Photon recollision probability;Foliage clumping index;Leaf area index;Multi-angle remote sensing","MODIS;Indexes;Remote sensing;Photonics;Forestry;Vegetation mapping;Atmospheric modeling","probability;vegetation;vegetation mapping","MODIS LAI product;LAI EO data products;photon recollision probability theory;foliage clumping;leaf area index products;Earth observation data;clumping index;foliage aggregation;sunlit;shaded leaves;global Earth;Moderate Resolution Imaging Spectrometer;plant functional types;canopy element;plant canopy analyzer data;local vegetation monitoring","","","","17","IEEE","4 Nov 2018","","","IEEE","IEEE Conferences"
"Application of the photochemical reflectance index to track light use efficiency with a two-leaf model","Q. Zhang; W. Ju; J. M. Chen; F. Yang","International Institute for Earth System Science, Nanjing University, China; International Institute for Earth System Science, Nanjing University, China; International Institute for Earth System Science, Nanjing University, China; Institute of Geographic Sciences and Natural Resources Research, Chinese Academy of Sciences, China","2016 IEEE International Geoscience and Remote Sensing Symposium (IGARSS)","3 Nov 2016","2016","","","5362","5365","Proper determination of light use efficiency (LUE) is a prerequisite for LUE models to simulate gross primary productivity (GPP). This study was devoted to apply the photochemical reflectance index (PRI) to accurately track LUE variations for a sub-tropical coniferous forest using tower-based PRI and GPP measurements. To improve the ability of PRI to track LUE, a simple two-leaf approach is used to process the remote sensing and flux data. The results showed: both PRI and LUE decreased with increases of bioclimatic factors. PRI is able to capture diurnal and seasonal changes in LUE. And the two-leaf approach significantly enhanced the correlation between PRI and LUE at either half-hourly or daily time steps.","2153-7003","978-1-5090-3332-4","10.1109/IGARSS.2016.7730397","","https://ieeexplore.ieee.org/stamp/stamp.jsp?arnumber=7730397","Multi-angle;Hyperspectra;PRI;LUE;Two-leaf approach","Remote sensing;Reflectivity;Correlation;Indexes;Productivity;Ecosystems;Biological system modeling","forestry;geophysical techniques;photosynthesis;remote sensing;vegetation","subtropical coniferous forest;tower-based PRI measurement;GPP measurement;remote sensing data;flux data;gross primary productivity;two-leaf model;light use efficiency;photochemical reflectance index","","","","10","IEEE","3 Nov 2016","","","IEEE","IEEE Conferences"
"Research on the adjacency effect for off-nadir optical remote sensing","X. Ma; Z. Yang; X. Peng","Key Laboratory of Electronics and Information Technology for Space System, National Space Science Center, Chinese Academy of Sciences, Beijing, China; Key Laboratory of Electronics and Information Technology for Space System, National Space Science Center, Chinese Academy of Sciences, Beijing, China; Key Laboratory of Electronics and Information Technology for Space System, National Space Science Center, Chinese Academy of Sciences, Beijing, China","2019 IEEE International Conference on Signal, Information and Data Processing (ICSIDP)","21 Aug 2020","2019","","","1","4","With the application of the multi-angle remote sensing which obtain earth's surface data through several scan angles, the analysis of the adjacency effect in off-nadir optical remote sensing is significant. Monte Carlo method is used to simulate the atmospheric point spread function (PSF) that are appropriate for the off-nadir optical remote sensing. By the convolution of the atmospheric PSF and the surface-leaving radiance, the radiance caused by the adjacency effect could be calculated. The influence factor analysis shows that, in addition to the surface albedo and the meteorological range, the viewing direction will affect the adjacency effect dramatically. With the deviation of the viewing zenith angle from the nadir, adjacency effect becomes weak. Unlike the nadir remote sensing, the adjacency effect in off-nadir remote sensing is azimuthally dependent and the contribution of the background in the viewing direction is greater than others. Based on a three-dimensional scene and a whole chain optical imaging simulation software, the images before the optical system of the sensor with and without the adjacency effect are simulated. The calculation of the SNR, contrast and spatial resolution of the images reveals that the adjacency effect seriously degrades the image quality. These results could provide the basis for modeling the multi-angle optical remote sensing imaging system and exploring the correction algorithm of the adjacency effect.","","978-1-7281-2345-5","10.1109/ICSIDP47821.2019.9173006","","https://ieeexplore.ieee.org/stamp/stamp.jsp?arnumber=9173006","off-nadir remote sensing;adjacency effect;atmospheric point spread function","Integrated optics;Solid modeling;Atmospheric modeling;Optical imaging;Adaptive optics;Software;Optical sensors","albedo;astronomical image processing;atmospheric optics;computer simulation;image resolution;Monte Carlo methods;optical images;optical transfer function;remote sensing;stereo image processing","multiangle optical remote sensing imaging system;off-nadir optical remote sensing;atmospheric point spread function;atmospheric PSF;surface albedo;meteorological range;three-dimensional scene;optical imaging simulation software;image constrast;image resolution;SNR;Monte Carlo method","","","","14","IEEE","21 Aug 2020","","","IEEE","IEEE Conferences"
"The Influence of Spatial Resolution on the Retrieval of Clumping Index Based on Polder and Modis Data","S. Yin; Z. Jiao; X. Zhang; L. Cui; R. Xie; J. Guo; Z. Zhu; S. Li; Y. Dong; Y. Tong","Beijing Engineering Research Center for Global Land Remote Sensing Products, Institute of Remote Sensing Science and Engineering, Faculty of Geographical Science, Beijing Normal University, Beijing, China; Beijing Engineering Research Center for Global Land Remote Sensing Products, Institute of Remote Sensing Science and Engineering, Faculty of Geographical Science, Beijing Normal University, Beijing, China; Beijing Engineering Research Center for Global Land Remote Sensing Products, Institute of Remote Sensing Science and Engineering, Faculty of Geographical Science, Beijing Normal University, Beijing, China; Beijing Engineering Research Center for Global Land Remote Sensing Products, Institute of Remote Sensing Science and Engineering, Faculty of Geographical Science, Beijing Normal University, Beijing, China; Beijing Engineering Research Center for Global Land Remote Sensing Products, Institute of Remote Sensing Science and Engineering, Faculty of Geographical Science, Beijing Normal University, Beijing, China; Beijing Engineering Research Center for Global Land Remote Sensing Products, Institute of Remote Sensing Science and Engineering, Faculty of Geographical Science, Beijing Normal University, Beijing, China; Beijing Engineering Research Center for Global Land Remote Sensing Products, Institute of Remote Sensing Science and Engineering, Faculty of Geographical Science, Beijing Normal University, Beijing, China; Beijing Engineering Research Center for Global Land Remote Sensing Products, Institute of Remote Sensing Science and Engineering, Faculty of Geographical Science, Beijing Normal University, Beijing, China; State Key Laboratory of Remote Sensing Science, Beijing Normal University and Aerospace Information Research Institute, Chinese Academy of Sciences, Beijing, China; Beijing Engineering Research Center for Global Land Remote Sensing Products, Institute of Remote Sensing Science and Engineering, Faculty of Geographical Science, Beijing Normal University, Beijing, China","2021 IEEE International Geoscience and Remote Sensing Symposium IGARSS","12 Oct 2021","2021","","","6754","6756","Clumping Index (CI) is an important vegetation structure parameter, which describes the grouping of leaves relative to the random distribution. Multi-angle data of the POLarization and Directionality of Earth Reflectance (POLDER) sensor (about 6×7 km) and the MODerate resolution Imaging Spectradiometer (MODIS) (500 m) are two main sources for global CI products. To better understand the variability inherent in CIs of such different spatial resolutions and optimize the used of CI products, extensive POLDER CIs and corresponding MODIS CIs were retrieved and compared in this study. Field measurements were conduct in one selected POLDER pixel in Hebei, China. Our results showed that POLDER and MODIS CIs presented relative good consistency (R2=0.65, RMSE=0.07, bias=0.003), and the correlation coefficient can reach 0.98 at the class level. Both POLDER CI (0.67) and MODIS CI (0.62±0.06) showed good consistency with field CIs (0.64±0.10) and POLDER CI was more likely to overestimate than MODIS CI.","2153-7003","978-1-6654-0369-6","10.1109/IGARSS47720.2021.9553813","National Natural Science Foundation of China(grant numbers:41971288,42090013,41801237); ","https://ieeexplore.ieee.org/stamp/stamp.jsp?arnumber=9553813","POLDER;MODIS;Clumping index;scale effect","Reflectivity;Correlation coefficient;Earth;Databases;Vegetation mapping;Imaging;Indexes","image resolution;vegetation;vegetation mapping","field measurements;POLDER sensor;polarization and directionality of Earth reflectance sensor;moderate resolution imaging spectradiometer;selected POLDER pixel;global CI products;multiangle data;random distribution;vegetation structure parameter;clumping index;spatial resolution;POLDER CI;relative good consistency;MODIS CI;size 500.0 m","","","","15","IEEE","12 Oct 2021","","","IEEE","IEEE Conferences"
"An approach to wide-field imaging of linear rail ground-based SAR in high squint multi-angle mode","Z. Yuan; Z. Qiming; W. Yanping; L. Yun; L. Yang; B. Zechao; L. Fang","School of Information Science and Technology, North China University of Technology, Beijing, China; School of Information Science and Technology, North China University of Technology, Beijing, China; School of Information Science and Technology, North China University of Technology, Beijing, China; School of Information Science and Technology, North China University of Technology, Beijing, China; School of Information Science and Technology, North China University of Technology, Beijing, China; School of Information Science and Technology, North China University of Technology, Beijing, China; Quanzhou Institute of Equipment Manufacturing, Haixi Institutes, Quanzhou, China","Journal of Systems Engineering and Electronics","28 Aug 2020","2020","31","4","722","733","Ground-based synthetic aperture radar (GB-SAR) has been successfully applied to the ground deformation monitoring. However, due to the short length of the GB-SAR platform, the scope of observation is largely limited. The practical applications drive us to make improvements on the conventional linear rail GB-SAR system in order to achieve larger field imaging. First, a turntable is utilized to support the rotational movement of the radar. Next, a series of high-squint scanning is performed with multiple squint angles. Further, the high squint modulation phase of the echo data is eliminated. Then, a new multi-angle imaging method is performed in the wave number domain to expand the field of view. Simulation and real experiments verify the effectiveness of this method.","1004-4132","","10.23919/JSEE.2020.000047","","https://ieeexplore.ieee.org/stamp/stamp.jsp?arnumber=9180139","ground-based synthetic aperture radar (GB-SAR);high squint;multi-angle","Imaging;Radar imaging;Synthetic aperture radar;Monitoring;Rails;Azimuth","geophysical image processing;radar imaging;rails;remote sensing by radar;synthetic aperture radar","multiangle imaging method;high squint modulation phase;multiple squint angles;high-squint scanning;larger field imaging;conventional linear rail GB-SAR system;GB-SAR platform;ground deformation monitoring;ground-based synthetic aperture radar;high squint multiangle mode;linear rail ground-based SAR;wide-field imaging","","2","","","","28 Aug 2020","","","BIAI","BIAI Journals"
