"A multi-angle analysis on development of modern peri-urban agricultural areas in China: A case study of Beijing","L. Yu; Z. Song","Institute of Remote Sensing and Digital Earth, Chinese Academy of Sciences, Beijing, China; Miyun Campus of Capital University of Economics and Business, Beijing, China","2017 IEEE International Geoscience and Remote Sensing Symposium (IGARSS)","4 Dec 2017","2017","","","75","78","Modern peri-urban agricultural areas play a unique role in urban expansion, environment conservation, and socio-economic sustainable development. In this paper, theoretical and methodological issues that shape the development of peri-urban agricultural areas were discussed. Researches on the complex peri-urban spatial system can provide a scientific and philosophical framework for guiding the development of modern peri-urban agricultural areas. The integration of urban planning and land planning and the utilization of novel indicator systems for evaluating development and spatial planning allows optimization of development plans for modern peri-urban agricultural areas. Theories and specific analysis approaches for modern peri-urban agricultural areas in Beijing were also discussed, including the multi-functional theory, the principal component analysis (PCA) method, the fractal analysis method and optimization models. The present development and spatial evolution characteristics of peri-urban agricultural area in Beijing are further clarified using these methods. Finally, the development processes and the spatial differences of the peri-urban agricultural area in Beijing were evaluated.","2153-7003","978-1-5090-4951-6","10.1109/IGARSS.2017.8126897","","https://ieeexplore.ieee.org/stamp/stamp.jsp?arnumber=8126897","modern peri-urban agricultural areas;urban-rural integration;layout model;Beijing","Sociology;Statistics;Biological system modeling;Planning;Sustainable development;Urban areas;Industries","agriculture;fractals;geographic information systems;sustainable development;town and country planning","modern peri-urban agricultural areas;peri-urban agricultural area;complex peri-urban spatial system;multiangle analysis;urban expansion;socio-economic sustainable development;philosophical framework;land planning;indicator systems;multifunctional theory;optimization models;fractal analysis method;principal component analysis","","","","20","IEEE","4 Dec 2017","","","IEEE","IEEE Conferences"
"A data assimilation approach for simultaneously estimating a suite of land surface variables from satellite data","S. Liang; Z. Xiao; H. Shi; H. Ma","Beijing Normal University, Beijing, Beijing, CN; Beijing Normal University, Beijing, Beijing, CN; Beijing Normal University, Beijing, Beijing, CN; Beijing Normal University, Beijing, Beijing, CN","2017 IEEE International Geoscience and Remote Sensing Symposium (IGARSS)","4 Dec 2017","2017","","","3973","3975","After over two decade of efforts, many land products are now being produced systematically from a variety of satellite data, and these products have been widely used. However, estimating a set of atmospheric and surface variables from one sensor data is often an ill-posed inversion problem, because the number of unknowns is often larger than the available bands[1]. Thus, one has to make assumptions while trying to obtain realistic solutions, and as a result, most products still need significant improvements of quality and accuracy. Although the average accuracy may be acceptable, the error of each product can be very large under certain conditions. Furthermore, different products of land variables from different inversion algorithms are physically inconsistent for most cases. Many products in the current form are not suitable for climate study because the products are not continuous both spatially and temporally due to factors such as clouds. There is an urgent need to develop more advanced new inversion methods and produce more accurate products. We have recently proposed a data assimilation approach to estimate an improved suite of products from one or multiple satellite data. The general idea is to use the surface and atmospheric radiation models with parameters that are adjusted to optimally reproduce the spectral radiance received by the EOS sensors. Such adjustments are usually made by identifying reasonably close “first guesses” for the model parameters and determining statistically optimum estimates of the parameters by giving appropriate weights to the first guesses versus addition to the error increments needed to get agreement with the observations. The first guesses are the multiple years MODIS/MISR land product climatologies. The best estimate at present time is a climatological value corrected by some combinations of previous time's departure from climatology weighted using temporal autocorrelation and what it takes to fit present observations. The presentation will review this approach and also introduce three case studies[2-4]. Case one [3] estimated only leaf area index (LAI) by integrating temporal, spectral, and angular information from Moderate Resolution Imaging Spectroradiometer (MODIS), SPOT/VEGETATION, and Multi-angle Imaging Spectroradiometer (MISR) data based on an ensemble Kalman filter (EnKF) technique. Validation results at six sites demonstrate that the combination of temporal information from multiple sensors, spectral information provided by red and near-infrared (NIR) bands, and angular information from MISR bidirectional reflectance factor (BRF) data can provide a more accurate estimate of LAI than previously available. Case two [2] estimated temporally complete land-surface parameter profiles from MODIS time-series reflectance data also based on the EnKF technique. The products include LAI, the fraction of absorbed photosynthetically active radiation (FAPAR) and surface broadband albedo. The LAI/FAPAR and surface albedo values estimated using this framework were compared with MODIS collection 5 eight-day 1-km LAI/FAPAR products (MOD15A2) and 500-m surface albedo product (MCD43A3), and GEOV1 LAI/FAPAR products at 1/112. spatial resolution and a ten-day frequency, respectively, and validated by ground measurement data from several sites with different vegetation types. The results demonstrate that this new data assimilation framework can estimate temporally complete land-surface parameter profiles from MODIS time-series reflectance data even if some of the reflectance data are contaminated by residual cloud or are missing and that the retrieved LAI, FAPAR, and surface albedo values are physically consistent. The root mean square errors of the retrieved LAI, FAPAR, and surface albedo against ground measurements are 0.5791, 0.0453, and 0.0190, respectively. Case three [4] further estimated multiple land surface parameters and aerosol optical depth (AOD) from MODIS top-of-atmosphere (TOA) reflectance data without relying on atmospheric correction. Soil, vegetation canopy, and atmospheric radiative transfer models were coupled. LAI and AOD were estimated first and the coupled model then calculated land surface reflectance, incident photosynthetically active radiation (PAR), land surface albedo, and the FAPAR. The flowchart is shown in Fig. 1. The retrieved land surface parameters and AOD were compared with the corresponding MODIS, Global Land Surface Satellite (GLASS), GEOV1, and MISR products and validated by ground measurements from seven sites with different vegetation types. The results demonstrated that the new inversion method can effectively produce multiple physically consistent parameters with accuracy comparable to that of existing satellite products over the select sites (Figure 2).","2153-7003","978-1-5090-4951-6","10.1109/IGARSS.2017.8127870","","https://ieeexplore.ieee.org/stamp/stamp.jsp?arnumber=8127870","Data assimilation;inversion methods;land remote sensing;biophysical parameters","Atmospheric modeling;Land surface;MODIS;Reflectivity;Satellites;Indexes;Remote sensing","aerosols;atmospheric optics;atmospheric radiation;atmospheric techniques;climatology;data assimilation;geophysical signal processing;Kalman filters;radiative transfer;radiometry;remote sensing;vegetation;vegetation mapping","top-of-atmosphere reflectance data;atmospheric radiative transfer models;retrieved land surface parameters;Global Land Surface Satellite;MISR products;inversion method;multiple physically consistent parameters;existing satellite products;data assimilation approach;land surface variables;land products;sensor data;inversion problem;land variables;advanced new inversion methods;accurate products;improved suite;multiple satellite data;atmospheric radiation models;model parameters;climatological value;temporal autocorrelation;case studies;angular information;Moderate Resolution Imaging Spectroradiometer;Multiangle Imaging Spectroradiometer data;ensemble Kalman filter technique;temporal information;multiple sensors;spectral information;MISR bidirectional reflectance factor data;accurate estimate;MODIS time-series reflectance data;ground measurement data;data assimilation framework;retrieved LAI;vegetation types;inversion algorithms;fraction of absorbed photosynthetically active radiation;calculated land surface reflectance;statistically optimum estimates;multiple years MODIS-MISR land product climatologies;GEOV1 LAI-FAPAR products;temporally complete land-surface parameter profiles;estimated multiple land surface parameters;FAFAR;surface broadband albedo;MCD43A3;MODIS TOA reflectance data","","","","","IEEE","4 Dec 2017","","","IEEE","IEEE Conferences"
"Evaluation of AMSR2 and SMOS soil moisture products over Heihe river basin in China","H. Lu; T. Koike","Ministry of Education Key Laboratory for Earth System Modeling, Tsinghua University, Beijing, China; The Department of Civil Engineering, University of Tokyo, Tokyo, Japan","2015 IEEE International Geoscience and Remote Sensing Symposium (IGARSS)","12 Nov 2015","2015","","","685","688","The spatial distribution characteristics and temporal variation trends of soil moisture significantly affect terrestrial water, energy, and carbon cycles at various scales. Satellite remote sensing is highly expected to provide such valuable information. Before applying the remotely sensed soil moisture products, a thorough validation must be conducted to insure product quality. In this paper, we evaluate the soil moisture products retrieved from the European Space Agency Soil Moisture and Ocean Salinity (SMOS) mission and the Advanced Microwave Scanning Radiometer 2 (AMSR2) on board the Global Change Observation Mission - Water (GCOM-W) over Heihe river basin in China, respectively. The land cover in Heihe river basin changes from desert to grass, agriculture field, and then mountain forest, which makes the basin an obvious spatial variation in soil moisture field and valuable to check the reliability and stability of two soil moisture products. We calculate the diurnal relative difference (DRD) of monthly averaged soil moisture between day and night observation of each products, and comparing them with that calculated from corresponding Global Land Data Assimilation System (GLDAS) simulations. The comparison results indicate that the SMOS soil moisture products are much unstable than AMSR2 retrievals. The DRD of SMOS is 20 times larger than that of AMSR2 and 100 times larger than that of GLDAS. We speculate that the radio frequency interference effects on SMOS observation may contribute to this unstable performance. Moreover, the retrievals from multi-angle observations in SMOS algorithm is also a potential source causing this systemic bias.","2153-7003","978-1-4799-7929-5","10.1109/IGARSS.2015.7325856","","https://ieeexplore.ieee.org/stamp/stamp.jsp?arnumber=7325856","AMSR2;SMOS;soil moisture;Heihe;ascending and descending difference;GLDAS","Soil moisture;Rivers;Remote sensing;Microwave radiometry;Numerical models;Accuracy;Satellites","land cover;moisture;remote sensing;rivers;soil","SMOS algorithm;AMSR2 retrieval;GLDAS simulation;global land data assimilation system;diurnal relative difference;mountain forest;agriculture field;land cover;GCOM-W;Global Change Observation Mission-Water;AMSR2 mission;Advanced Microwave Scanning Radiometer 2;SMOS mission;European Space Agency Soil Moisture and Ocean Salinity;product quality;satellite remote sensing;carbon cycle;terrestrial water;China;Heihe river basin;SMOS soil moisture product evaluation;AMSR2 soil moisture product evaluation","","1","","8","IEEE","12 Nov 2015","","","IEEE","IEEE Conferences"
"Multi-level change detection in urban areas using ZY-3 multi-temporal stereo imagery","D. Wen; Hui Liu; J. Li; X. Huang","The State Key Laboratory of Information Engineering in Surveying, Mapping and Remote Sensing, Wuhan University, Wuhan, China; The State Key Laboratory of Information Engineering in Surveying, Mapping and Remote Sensing, Wuhan University, Wuhan, China; The School of Remote Sensing and Information Engineering, Wuhan University, Wuhan, China; The School of Remote Sensing and Information Engineering, Wuhan University, Wuhan, China","2017 Joint Urban Remote Sensing Event (JURSE)","11 May 2017","2017","","","1","4","Due to the rapid process of urbanization, there is an urgent need for accurate and detailed change detection in urban areas. Ziyuan-3 (ZY-3), as China's first civilian high spatial resolution satellite, carrying the three-line array camera, enables the acquisition of in-track stereo images. The characteristics of multi-angle imaging and high-spatial resolution are fully exploited to explore subtle urban change information. In this study, a multi-level (pixel-grid-block) change detection framework using stereo images was conducted to detect information related to land cover transitions, changed hotspots, and multi-temporal landscape. The experimental results reveal some interesting and informative findings: (1) our proposed multi-level method is effective in detecting change details, with kappa coefficient reaching 0.81 at the pixel level and correctness being 95% at the grid level; (2) the block-level landscape analysis indicate that there was greater fragmentation and spatial heterogeneity of building landscape during the urbanization process; (3) the mean nearest neighbor distance between building patches decreases by about 1.0 m during 2012 and 2013.","","978-1-5090-5808-2","10.1109/JURSE.2017.7924604","","https://ieeexplore.ieee.org/stamp/stamp.jsp?arnumber=7924604","","Buildings;Remote sensing;Urban areas;Spatial resolution;Satellites;Trajectory;Indexes","cameras;geophysical image processing;image resolution;land cover;stereo image processing;terrain mapping","urban areas;Ziyuan-3;China;civilian high spatial resolution satellite;three-line array camera;in-track stereo images;multiangle imaging;multilevel change detection framework;land cover transitions;multitemporal landscape;kappa coefficient;pixel level;grid level;block-level landscape analysis;spatial heterogeneity;building landscape;urbanization process;mean nearest neighbor distance;building patches;ZY-3 multitemporal stereo imagery","","2","","14","IEEE","11 May 2017","","","IEEE","IEEE Conferences"
"The Effects of Sun-Viewer Geometry on Sun-Induced Fluorescence and Its Relationship with Gross Primary Production","Q. Zhang; Y. Zhang; Z. Li; J. Li; X. Zhang","Jiangsu Provincial Key Laboratory of Geographic Information Science and Technology, International Institute for Earth System Science, Nanjing University, Nanjing, China; Jiangsu Provincial Key Laboratory of Geographic Information Science and Technology, International Institute for Earth System Science, Nanjing University, Nanjing, China; Jiangsu Provincial Key Laboratory of Geographic Information Science and Technology, International Institute for Earth System Science, Nanjing University, Nanjing, China; Jiangsu Provincial Key Laboratory of Geographic Information Science and Technology, International Institute for Earth System Science, Nanjing University, Nanjing, China; Jiangsu Provincial Key Laboratory of Geographic Information Science and Technology, International Institute for Earth System Science, Nanjing University, Nanjing, China","IGARSS 2019 - 2019 IEEE International Geoscience and Remote Sensing Symposium","14 Nov 2019","2019","","","9048","9051","Gross primary production (GPP) from photosynthesis by terrestrial vegetation is the largest sink of atmospheric CO2. Sun-induced chlorophyll fluorescence (SIF) has been shown a powerful proxy for photosynthetic activity and used to estimate GPP. However, both non-physiological and functional factors controlling the emission of canopy SIF. The non-physiological factors, especially the sun-viewer geometry, impact the relationships between SIF and GPP. In this study, we did near-surface observations of both carbon flux and multi-view-angle spectra above a wheat canopy. The carbon flux was used to calculate GPP and the canopy spectra were used to retrieve SIF. SIF is significantly correlated with the angle between sun and viewer than SIF (R2=0.63). The relationships of SIF with GPP are also changing with different view azimuth angles. Generally, SIF observed at 180o (pointing north) are more correlated to GPP than that at the other two angles. A model recently developed by He et al. (2017) was used to normalize multi-angle SIF to the hotspot direction (SIFh) and to compute the canopy-level total SIF (SIFt), in order to reduce the effects of sun-viewer geometry on SIF. Compared to the correlation of GPP with the original observed SIF (SIFobs), the coefficients of determination (R2) increase by ~0.1 and ~0.05 for those of GPP with SIFh and SIFt, respectively. These results would be helpful in estimating GPP of crops at large scales using remote sensing techniques.","2153-7003","978-1-5386-9154-0","10.1109/IGARSS.2019.8898345","","https://ieeexplore.ieee.org/stamp/stamp.jsp?arnumber=8898345","GPP;multiple-angle remote sensing;SIF;sun-viewer geometry;hotspot","Fluorescence;Remote sensing;Sun;Production;Azimuth;Temperature measurement;Geometry","atmospheric composition;carbon;crops;fluorescence;photosynthesis;vegetation mapping","remote sensing techniques;canopy spectra;wheat canopy;multiview-angle spectra;carbon flux;gross primary production;original observed SIF;canopy-level total SIF;multiangle SIF;sun-viewer geometry;canopy SIF;GPP;sun-induced chlorophyll fluorescence;C;CO2","","4","","17","IEEE","14 Nov 2019","","","IEEE","IEEE Conferences"
"Improving Satellite Estimates of the Fraction of Absorbed Photosynthetically Active Radiation Through Data Integration: Methodology and Validation","X. Tao; S. Liang; D. Wang; T. He; C. Huang","Department of Geography, The State University of New York, Buffalo, NY, USA; Department of Geographical Sciences, University of Maryland, College Park, MD, USA; Department of Geographical Sciences, University of Maryland, College Park, MD, USA; Department of Geographical Sciences, University of Maryland, College Park, MD, USA; Department of Geographical Sciences, University of Maryland, College Park, MD, USA","IEEE Transactions on Geoscience and Remote Sensing","23 Mar 2018","2018","56","4","2107","2118","The fraction of absorbed photosynthetically active radiation (FAPAR) is a critical input in many climate and ecological models. The accuracy of satellite FAPAR products directly influences estimates of ecosystem productivity and carbon stocks. The targeted accuracy of FAPAR products is 10% or 0.05 for many applications. However, most current FAPAR products do not meet such requirements, and further improvements are still needed. In this paper, a data fusion scheme based on the multiple resolution tree (MRT) approach is developed to integrate multiple satellite FAPAR estimates at site and regional scales. MRT was chosen because of the superior computational efficiency compared with other fusion methods. The fusion scheme removed the bias in FAPAR estimates and resulted in a 15% increase in the R2 and 3% reduction in the root-mean-square error compared with the average of individual FAPAR estimates. The regional-scale fusion filled in the missing values, and provided spatially consistent FAPAR distributions at different resolutions. Overall, MRT can be used to efficiently and accurately generate spatially and temporally continuous FAPAR data across both site and regional scales.","1558-0644","","10.1109/TGRS.2017.2775103","National Aeronautics and Space Administration; National Natural Science Foundation of China(grant numbers:41771379); ","https://ieeexplore.ieee.org/stamp/stamp.jsp?arnumber=8241453","Data fusion;fraction of absorbed photosynthetically active radiation (FAPAR) integration;Landsat;Moderate Resolution Imaging Spectroradiometer (MODIS);Multi-angle Imaging SpectroRadiometer (MISR);multiple resolution tree (MRT)","Satellites;Kalman filters;Data integration;Green products;Remote sensing;MODIS;Biological system modeling","climatology;ecology;geophysical techniques;mean square error methods;photosynthesis;remote sensing;sensor fusion;vegetation","carbon stocks;targeted accuracy;current FAPAR products;data fusion scheme;multiple resolution tree approach;MRT;multiple satellite FAPAR estimates;fusion methods;individual FAPAR estimates;regional-scale fusion;spatially consistent FAPAR distributions;continuous FAPAR data;absorbed photosynthetically active radiation;data integration;critical input;satellite FAPAR products;ecosystem productivity;climate model;ecological model;root-mean-square error","","13","","51","IEEE","28 Dec 2017","","","IEEE","IEEE Journals"
"Multi-Angle SAR Sparse Image Reconstruction With Improved Attributed Scattering Model","Y. Wei; Y. Li; X. Chen; Z. Ding","Beijing Key Laboratory of Embedded Real-time Information Processing Technology, Beijing, China; Beijing Key Laboratory of Embedded Real-time Information Processing Technology, Beijing, China; Beijing Key Laboratory of Embedded Real-time Information Processing Technology, Beijing, China; Beijing Key Laboratory of Embedded Real-time Information Processing Technology, Beijing, China","IEEE Geoscience and Remote Sensing Letters","23 Jun 2020","2020","17","7","1188","1192","The traditional synthetic aperture radar (SAR) sparse imaging methods are based on the point scattering model. However, this model is not suitable for many distributed targets with large variations in scattering characteristics at different angles, i.e., many distributed targets can no longer be considered as a combination of a series of ideal point scatterers under multi-angle observations. To solve this problem, by introducing the improved attributed scattering model into the traditional SAR echo model, we propose our multi-angle sparse image reconstruction method (MASIRM). Through modeling the illuminated scene with point scatterers and line-segment-scatterers, a multi-angle echo model is first presented. By generating an adaptive mixed dictionary and applying the pattern-coupled sparse Bayesian learning, the MASIRM obtains more geometric information of the distributed target with higher quality sparse SAR images. Real data experiments demonstrate that MASIRM performs favorably against traditional imaging methods.","1558-0571","","10.1109/LGRS.2019.2942476","Key Program of National Natural Science Foundation of China(grant numbers:11833001,61931002); National Science Fund for Distinguished Yong Scholars(grant numbers:61625103); ","https://ieeexplore.ieee.org/stamp/stamp.jsp?arnumber=8864096","Improved attributed scattering model;multi-angle synthetic aperture radar;sparse Bayesian learning;sparse image reconstruction;synthetic aperture radar (SAR)","Synthetic aperture radar;Adaptation models;Scattering;Radar polarimetry;Imaging;Radar imaging","Bayes methods;electromagnetic wave scattering;image reconstruction;radar cross-sections;radar imaging;synthetic aperture radar","multiangle SAR sparse image reconstruction;synthetic aperture radar;point scattering model;distributed target;scattering characteristics;multiangle observations;multiangle sparse image reconstruction method;line-segment-scatterers;multiangle echo model;pattern-coupled sparse Bayesian learning;sparse SAR images;imaging methods;attributed scattering model;SAR echo model;MASIRM;adaptive mixed dictionary","","4","","12","IEEE","11 Oct 2019","","","IEEE","IEEE Journals"
