"Authors","Author full names","Author(s) ID","Titles","Year","Source title","Volume","Issue","Art. No.","Page start","Page end","Page count","DOI","Cited by","Link","Abstract","Indexed Keywords","Author Keywords","Document Type","Publication Stage","Open Access","Source","EID"
"Su H.; Ji B.; Wang Y.","Su, Hua (57203702610); Ji, Bowen (57207830717); Wang, Yunpeng (55976829800)","57203702610; 57207830717; 55976829800","Sea Ice extent detection in the Bohai Sea Using Sentinel-3 OLCI Data","2019","Remote Sensing","11","20","2436","","","","10.3390/rs11202436","13","https://www.scopus.com/inward/record.uri?eid=2-s2.0-85074210474&doi=10.3390%2frs11202436&partnerID=40&md5=68320c3c07fb7c7b7a6c31c301f43a1a","Sea ice distribution is an important indicator of ice conditions and regional climate change in the Bohai Sea (China). In this study, we monitored the spatiotemporal distribution of the Bohai Sea ice in the winter of 2017-2018 by developing sea ice information indexes using 300 m resolution Sentinel-3 Ocean and Land Color Instrument (OLCI) images. We assessed and validated the index performance using Sentinel-2 MultiSpectral Instrument (MSI) images with higher spatial resolution. The results indicate that the proposed Normalized Difference Sea Ice Information Index (NDSIIIOLCI), which is based on OLCI Bands 20 and 21, can be used to rapidly and effectively detect sea ice but is somewhat affected by the turbidity of the seawater in the southern Bohai Sea. The novel Enhanced Normalized Difference Sea Ice Information Index (ENDSIIIOLCI), which builds on NDSIIIOLCI by also considering OLCI Bands 12 and 16, can monitor sea ice more accurately and effectively than NDSIIIOLCI and suffers less from interference from turbidity. The spatiotemporal evolution of the Bohai Sea ice in the winter of 2017-2018 was successfully monitored by ENDSIIIOLCI. The results show that this sea ice information index based on OLCI data can effectively extract sea ice extent for sediment-laden water and is well suited for monitoring the evolution of Bohai Sea ice in winter. © 2019 by the authors.","Climate change; Seawater effects; Turbidity; Bohai Sea; Information index; Multispectral instruments; OLCI imagery; Regional climate changes; Sea ice extent; Spatiotemporal distributions; Spatiotemporal evolution; Sea ice","Bohai sea ice; OLCI imagery; Sea ice extent; Sea ice information index","Article","Final","All Open Access; Gold Open Access","Scopus","2-s2.0-85074210474"
"Spasova T.; Nedkov R.; Dancheva A.; Stoyanov A.; Ivanova I.; Georgiev N.","Spasova, Temenuzhka (57211430744); Nedkov, Roumen (57204958301); Dancheva, Adlin (57204632209); Stoyanov, Andrey (24765749200); Ivanova, Iva (57198062540); Georgiev, Nikolay (57211428499)","57211430744; 57204958301; 57204632209; 24765749200; 57198062540; 57211428499","Seasonal assessment of the dynamics of sea ice based on aerospace data on Livingston Island, New Shetland Islands in Antarctica and Longyearbyen in the Arctic","2020","Proceedings of SPIE - The International Society for Optical Engineering","11524","","115240J","","","","10.1117/12.2570829","1","https://www.scopus.com/inward/record.uri?eid=2-s2.0-85091226958&doi=10.1117%2f12.2570829&partnerID=40&md5=d6c23f6ceeea9afec269d713e00cd3e8","Sea ice plays a major role in our planet's climate. It' acts as a reflector of solar energy, mainly in spring and summer. Sea ice covered with fresh snow can reflect 75-90% of solar energy, the open sea reflects just 5-15%. Sea ice acts as an insulator in autumn and winter. This insulating effect limits the amount of both heat and moisture the ocean loses to the atmosphere. The declining sea ice disrupts the climate, societies and fauna of Polar areas, but encourages the econcmic and industrial development. The relevance of this study is related to current trends in the use of remote sensing in solving problems of a different nature in environmental monitoring. The sea ice was analyzed and mapped according to the European Space Agency data (ESA), acquired by sensors of Sentinel-1 SAR (Synthetic Aperture Radar), Sentinel-2MSI (Multi Spectral Instrument), Sentinel-3 and GIS. The subject of the study is to demonstrate the dynamics, during the summer season from 2015 to 2019, around the coastline of Livingston Island, New Shetland Islands in Antarctica and Longyearbyen in the Arctic. Changes in environmental objects are indicated by radar images through different processing approaches. The results clearly show that sea ice melting can be best recorded by using SAR data through the C-band. The results obtained are data in the form of thematic maps showing the spatial reflectance of sea ice and its dynamics over time.  © 2020 SPIE.","Dynamics; Insulator contamination; Maps; Reflection; Sea ice; Solar energy; Space optics; Synthetic aperture radar; Environmental Monitoring; Environmental objects; European Space Agency; Industrial development; Processing approach; SAR(synthetic aperture radar); Sea ice melting; Shetland islands; Remote sensing","Optical data; SAR data; Sea ice; Sentinel 2-MSI; Sentinel-1 SAR","Conference paper","Final","","Scopus","2-s2.0-85091226958"
"Picchiani M.; Del Frate F.; Sist M.","Picchiani, Matteo (36004934300); Del Frate, Fabio (8255132900); Sist, Massimiliano (57188714386)","36004934300; 8255132900; 57188714386","A neural network sea-ice cloud classification algorithm for copernicus sentinel-3 sea and land surface temperature radiometer","2018","International Geoscience and Remote Sensing Symposium (IGARSS)","2018-July","","8517857","3015","3018","3","10.1109/IGARSS.2018.8517857","3","https://www.scopus.com/inward/record.uri?eid=2-s2.0-85063159658&doi=10.1109%2fIGARSS.2018.8517857&partnerID=40&md5=d3cd7aab641e6669929bf1ca11259f27","A Neural Network approach to classify Sentinel-3 sea and land surface temperature radiometer (SLSTR) pixels over polar regions is presented. The proposed approach is based on a careful preliminary analysis aimed to simulate SLSTR observation by means of MODIS data. The latter have been considered because of the long available time series and the quality of cloud mask products. A large set of MODIS AQUA and TERRA products has been applied to develop the training set of the Neural Network classificator that has been tuned to discriminate clear ocean, clouds and sea-ice surfaces on the scene. © 2018 IEEE","","Cloud detection; Neural Network; Sentinel-3","Conference paper","Final","","Scopus","2-s2.0-85063159658"
"Liu X.; Cheng X.; Liang Q.; Li T.; Peng F.; Chi Z.; He J.","Liu, Xuying (57315185100); Cheng, Xiao (7401754355); Liang, Qi (57202339067); Li, Teng (57203094691); Peng, Fukai (57196152196); Chi, Zhaohui (55883960800); He, Jiaying (56113469400)","57315185100; 7401754355; 57202339067; 57203094691; 57196152196; 55883960800; 56113469400","Grounding event of iceberg d28 and its interactions with seabed topography","2022","Remote Sensing","14","1","154","","","","10.3390/rs14010154","0","https://www.scopus.com/inward/record.uri?eid=2-s2.0-85122027496&doi=10.3390%2frs14010154&partnerID=40&md5=43a5dd8f8bd86af11ff92a5f40fb3557","Iceberg D28, a giant tabular iceberg that calved from Amery Ice Shelf in September 2019, grounded off Kemp Coast, East Antarctica, from August to September of 2020. The motion of the iceberg is characterized herein by time-series images captured by synthetic aperture radar (SAR) on Sentinel-1 and the moderate resolution imaging spectroradiometer (MODIS) boarded on Terra from 6 August to 15 September 2020. The thickness of iceberg D28 was estimated by utilizing data from altimeters on Cryosat-2, Sentinel-3, and ICESat-2. By using the iceberg draft and grounding point locations inferred from its motion, the maximum water depths at grounding points were deter-mined, varying from 221.72 ± 21.77 m to 269.42 ± 25.66 m. The largest disagreements in seabed elevation inferred from the grounded iceberg and terrain models from the Bedmap2 and BedMachine datasets were over 570 m and 350 m, respectively, indicating a more complicated submarine topography in the study area than that presented by the existing seabed terrain models. Wind and sea water velocities from reanalysis products imply that the driving force from sea water is a more dominant factor than the wind in propelling iceberg D28 during its grounding, which is consistent with previous findings on iceberg dynamics. © 2021 by the authors. Licensee MDPI, Basel, Switzerland.","Radiometers; Seawater; Synthetic aperture radar; Topography; Amery Ice Shelf; East antarctica; Iceberg d28; Iceberg draft; Iceberg dynamic; Iceberg grounding; Sea water; Seabed topography; Terrain Modeling; Times series; Sea ice","Iceberg D28; Iceberg draft; Iceberg dynamics; Iceberg grounding; Satellite altimetry; Seabed topography","Article","Final","All Open Access; Gold Open Access","Scopus","2-s2.0-85122027496"
"Aldenhoff W.; Eriksson L.E.B.; Heuze C.","Aldenhoff, Wiebke (57192703338); Eriksson, Leif E.B. (7403253539); Heuze, Celine (55671418200)","57192703338; 7403253539; 55671418200","Comparison of Sentinel-1 Sar and Sentinel-3 Altimetry Data for Sea Ice Type Discrimination","2019","International Geoscience and Remote Sensing Symposium (IGARSS)","","","8899041","4238","4240","2","10.1109/IGARSS.2019.8899041","0","https://www.scopus.com/inward/record.uri?eid=2-s2.0-85077708266&doi=10.1109%2fIGARSS.2019.8899041&partnerID=40&md5=a0b79871bb03b90423f11ec7d9b74512","In this paper near co-incidental Sentinel-1 C-band SAR imagery and Sentinel-3 SRAL Ku-band altimeter data are compared for their capabilities of sea ice type discrimination. Knowledge of sea ice type is important for climate research and safety in Arctic offshore operations.First-year ice is characterised by a low SAR backscatter intensity in both HH and HV polarisation compared to multi-year ice, while the altimeter waveform parameters show high pulse peakiness and peak power compared to multi-year ice.Thus SAR imagery and altimetry can principally discriminate different ice types. The complexity of the backscattered radar signal however impedes a clear separation of the two types for all cases. Cross comparison of the two sensors offers an opportunity of high resolution validation data, which is often lacking for sea ice studies. © 2019 IEEE.","Aneroid altimeters; Backscattering; Geology; Meteorological instruments; Offshore oil well production; Remote sensing; Sea ice; Synthetic aperture radar; Altimeter data; Altimeter waveform; Back-scattered radar; Climate research; High resolution; Multi-year ices; SAR backscatter; Validation data; Radar imaging","altimeter; SAR; Sea ice","Conference paper","Final","","Scopus","2-s2.0-85077708266"
"König C.; König T.; Singha S.; Frost A.; Jacobsen S.","König, Christine (57364184700); König, Thomas (57526960400); Singha, Suman (55574366500); Frost, Anja (56421565500); Jacobsen, Sven (56668348800)","57364184700; 57526960400; 55574366500; 56421565500; 56668348800","Combined use of space borne optical and sar data to improve knowledge about sea ice for shipping","2021","Remote Sensing","13","23","4842","","","","10.3390/rs13234842","0","https://www.scopus.com/inward/record.uri?eid=2-s2.0-85120669459&doi=10.3390%2frs13234842&partnerID=40&md5=7e59f66f676b2594309555ef335a016a","As a first step towards a new combined product for sea ice classification based on opti-cal/thermal data collected by Sentinel-3 satellites and SAR data from Sentinel-1 satellites, which can be used as an appropriate support for navigation in Arctic and sub-Arctic waters, two existing classification algorithms are adapted to these data. The classification based on optical data has improved, so it is expected that the results will be ideally suited to be processed together with SAR data into significantly improved sea ice information products to support marine navigation. The usefulness of the combined processing is demonstrated by means of two simple algorithms and a more sophisticated approach is outlined, which will be realized in the future in order to form the basis for an integration into an operational service with the involvement of further partners and users. © 2021 by the authors. Licensee MDPI, Basel, Switzerland.","Classification (of information); Marine navigation; Ice type; Optical data; SAR; SAR data; Sea ice classification; Sentinel-1; Sentinel-3; SLSTR; Space-borne; Thermal data; Sea ice","Ice type; SAR; Sea ice; Sentinel-1; Sentinel-3; SLSTR","Article","Final","All Open Access; Gold Open Access; Green Open Access","Scopus","2-s2.0-85120669459"
"Blix K.; Li J.; Massicotte P.; Matsuoka A.","Blix, Katalin (57188722540); Li, Juan (57211096161); Massicotte, Philippe (57203236301); Matsuoka, Atsushi (55351273900)","57188722540; 57211096161; 57203236301; 55351273900","Developing a new machine-learning algorithm for estimating Chlorophyll-a concentration in optically complex waters: A case study for high northern latitude waters by using Sentinel 3 OLCI","2019","Remote Sensing","11","18","2076","","","","10.3390/rs11182076","15","https://www.scopus.com/inward/record.uri?eid=2-s2.0-85072647161&doi=10.3390%2frs11182076&partnerID=40&md5=4ff1c86de073b83ae89ab256a51a8473","The monitoring of Chlorophyll-a (Chl-a) concentration in high northern latitude waters has been receiving increased focus due to the rapid environmental changes in the sub-Arctic, Arctic. Spaceborne optical instruments allow the continuous monitoring of the occurrence, distribution, and amount of Chl-a. In recent years, the Ocean and Land Color Instruments (OLCI) onboard the Sentinel 3 (S3) A and B satellites were launched, which provide data about various aquatic environments on advantageous spatial, spectral, and temporal resolutions with high SNR. Although S3 OLCI could be favorable to monitor high northern latitude waters, there have been several challenges related to Chl-a concentration retrieval in these waters due to their unique optical properties coupled with challenging environments including high sun zenith angle, presence of sea ice, and frequent cloud covers. In this work, we aim to overcome these difficulties by developing a machine-learning (ML) approach designed to estimate Chl-a concentration from S3 OLCI data in high northern latitude optically complex waters. The ML model is optimized and requires only three S3 OLCI bands, reflecting the physical characteristic of Chl-a as input in the regression process to estimate Chl-a concentration with improved accuracy in terms of the bias (five times improvements.) The ML model was optimized on data from Arctic, coastal, and open waters, and showed promising performance. Finally, we present the performance of the optimized ML approach by computing Chl-a maps and corresponding certainty maps in highly complex sub-Arctic and Arctic waters. We show how these certainty maps can be used as a support to understand possible radiometric calibration issues in the retrieval of Level 2 reflectance over these waters. This can be a useful tool in identifying erroneous Level 2 Remote sensing reflectance due to possible failure of the atmospheric correction algorithm. © 2019 by the authors.","Chlorophyll; Learning algorithms; Learning systems; Optical properties; Reflection; Remote sensing; Sea ice; Signal to noise ratio; Arctic; Atmospheric correction algorithm; Chlorophyll a; Chlorophyll-a concentration; Ocean color; Remote-sensing reflectance; Sentinel 3 OLCI; Spaceborne optical instruments; Machine learning","Arctic; Chlorophyll-a; Machine-learning; Ocean color monitoring; Sentinel 3 OLCI","Article","Final","All Open Access; Gold Open Access; Green Open Access","Scopus","2-s2.0-85072647161"
"Elizaveta Z.; Ekaterina B.; Vladimir K.; Bertrand C.","Elizaveta, Zabolotskikh (57482070600); Ekaterina, Balashova (57482226300); Vladimir, Kudryavtsev (57481910000); Bertrand, Chapron (8046793100)","57482070600; 57482226300; 57481910000; 8046793100","SYNERGISTIC USE OF SATELLITE SCATTEROMETER, SAR AND ALTIMETER DATA TO STUDY FIRST YEAR SEA ICE PROPERTIES","2021","International Geoscience and Remote Sensing Symposium (IGARSS)","2021-July","","","5633","5636","3","10.1109/IGARSS47720.2021.9553828","1","https://www.scopus.com/inward/record.uri?eid=2-s2.0-85125997248&doi=10.1109%2fIGARSS47720.2021.9553828&partnerID=40&md5=e5ae6b67179e3512fa5b9140e9d211b4","In this study we demonstrate high potential of synergistic satellite data usage to investigate the Arctic saline sea ice. A simple geometrical optics model is explored to show the possibility to derive the First Year sea ice parameters best fitting the experimental data. Satellite Sentinel-1 Synthetic Aperture Radar (SAR) data are used to analyze the mesoscale sea ice structure and detect the age of the sea ice samples. Sentinel-3 altimeter data along with the Metop Advanced scatterometer (ASCAT) measurements of the normalized radar cross section (NRCS) are jointly used to build the NRCS dependencies on the incidence angle for the selected sea ice samples. Sea ice drift fields are used to investigate only those regions where the drift is negligible on a single day scale. It is shown that the suggested approach presents a powerful tool to study the Arctic sea ice properties. © 2021 IEEE","","Arctic sea ice; First year ice; Radar backscatter incidence angle dependency; Satellite remote sensing","Conference paper","Final","","Scopus","2-s2.0-85125997248"
"Longepe N.; Thibaut P.; Vadaine R.; Poisson J.-C.; Guillot A.; Boy F.; Picot N.; Borde F.","Longepe, Nicolas (23492895800); Thibaut, Pierre (55897105000); Vadaine, Rodolphe (56910213300); Poisson, Jean-Christophe (50761485600); Guillot, Amandine (56189838600); Boy, Francois (54794821000); Picot, Nicolas (15751403000); Borde, Franck (36004660500)","23492895800; 55897105000; 56910213300; 50761485600; 56189838600; 54794821000; 15751403000; 36004660500","Comparative evaluation of sea ice lead detection based on SAR imagery and altimeter data","2019","IEEE Transactions on Geoscience and Remote Sensing","57","6","8626038","4050","4061","11","10.1109/TGRS.2018.2889519","13","https://www.scopus.com/inward/record.uri?eid=2-s2.0-85066604266&doi=10.1109%2fTGRS.2018.2889519&partnerID=40&md5=63e6bcb7dd68dbcc26483780dd1f6c25","The detection of sea ice leads is a prerequisite for the estimation of ice freeboard and thickness from altimeter data. The classification of altimeter waveforms is generally performed using statistical parameters on the echo power or machine learning approaches directly on the waveforms. The validation and optimization of such algorithms can be carried out using a set of reference cases provided by Earth Observation images. In this paper, we first developed a new lead detector based on Sentinel-1 (S-1) synthetic aperture radar (SAR) images. A robust and consistent methodology for the joint assessment of Altimeter and SAR leads detector is then provided. We propose to fully account for the 2-D geometric problem when comparing the 1-D altimeter track and 2-D SAR image. The surface of the lead intersecting the altimeter footprint and its distance to nadir are considered here. Based on collocated Sentinel-3 (S-3) altimeter data and S-1 images, the performance of our S-3 lead detector is fully assessed. A new parameterization is found resulting in a better tradeoff between good detection and false alarm rate. A similar analysis is performed using AltiKa altimeter data, showing enhanced performance for S-3 altimeter data acquired in Delay-Doppler mode with reduced off-nadir returns. © 1980-2012 IEEE.","Aneroid altimeters; Chemical detection; Lead; Learning systems; Meteorological instruments; Sea ice; Synthetic aperture radar; Altimeter waveform; Altimetry; Comparative evaluations; Earth observation images; Geometric problems; Machine learning approaches; Statistical parameters; Synthetic aperture radar (SAR) images; data acquisition; detection method; Doppler radar; ice thickness; lead; machine learning; nadir; satellite altimetry; satellite data; satellite imagery; sea ice; Sentinel; synthetic aperture radar; waveform analysis; Radar imaging","Altimetry; lead; sea ice; synthetic aperture radar (SAR)","Article","Final","","Scopus","2-s2.0-85066604266"
"Shu S.; Liu H.; Beck R.A.; Frappart F.; Korhonen J.; Xu M.; Yang B.; Hinkel K.M.; Huang Y.; Yu B.","Shu, Song (55272561600); Liu, Hongxing (12240469400); Beck, Richard A. (26425489000); Frappart, Frédéric (8651675100); Korhonen, Johanna (15756003600); Xu, Min (57157925000); Yang, Bo (57157838500); Hinkel, Kenneth M. (7003687931); Huang, Yan (57033058300); Yu, Bailang (15840948500)","55272561600; 12240469400; 26425489000; 8651675100; 15756003600; 57157925000; 57157838500; 7003687931; 57033058300; 15840948500","Analysis of Sentinel-3 SAR altimetry waveform retracking algorithms for deriving temporally consistent water levels over ice-covered lakes","2020","Remote Sensing of Environment","239","","111643","","","","10.1016/j.rse.2020.111643","30","https://www.scopus.com/inward/record.uri?eid=2-s2.0-85077944930&doi=10.1016%2fj.rse.2020.111643&partnerID=40&md5=1884235aa9e471a70af4f2af6f1b74e6","Satellite radar altimetry has been widely used in the monitoring of water levels of lakes, rivers and wetlands in the past decades. The conventional pulse-limited radar altimeters have a relatively large ground footprint, which limits their capability to retrieve surface elevation information over small and medium-sized water bodies. A new generation of satellite radar altimeter system, a dual-frequency SAR radar altimeter (SRAL) onboard the Copernicus Sentinel-3 satellite, has produced densely sampled elevation measurements with a smaller footprint for the Earth's surfaces since June 2016, owing to the Delay-Doppler processing technique. Four standard SRAL SAR altimetry waveform retracking algorithms (known as retrackers) have been designed to retrieve elevation measurements for different types of surfaces: Ice-Sheet retracker for polar ice sheets, SAMOSA-3 retracker for open ocean and coastal zones, OCOG retracker for sea-ice margins, and Sea-Ice retracker for sea ice. In this research, we evaluated the performances of the Sentinel-3 SRAL SAR altimetry retrackers over lakes, particularly over seasonally ice-covered lakes in one hydrological cycle. For 15 lakes and reservoirs with different sizes and at varying latitudes in the northern hemisphere, we compared the lake water levels estimated by each of standard SRAL SAR retrackers against in-situ water level measurements for different seasons (a full hydrologic cycle) during 2016–2017. Our evaluation shows that Sea-Ice retracker was unable to provide continuous estimates of lake water levels, as a result of the high rate of missing data. Although the precision and relative accuracy of lake water level estimates from these three standard SRAL SAR retrackers are similar, the SAMOSA-3 retracker has the least bias in comparison with ground-based gauge measurements. When the lakes in the mid- and high-latitude regions were covered by ice in the winter season, these three standard SAR retrackers generated erroneous lake water level measurements, significantly lower than the true lake water levels recorded by in-situ gauge stations. The measurement errors of these three standard retrackers increase with the growth of the lake ice thickness. To address the negative effect of the seasonal ice cover, we developed a new bimodal correction algorithm. We demonstrate that our bimodal correction algorithm can retrieve the ice thickness and reliably estimate water levels for the ice-covered lakes in winter, hence enabling the generation of temporally consistent lake water level measurements throughout all seasons for lake hydrological analysis. © 2020 Elsevier Inc.","Aneroid altimeters; Coastal zones; Gages; Glaciers; Lakes; Level measurement; Meteorological instruments; Radar equipment; Radar measurement; Radio altimeters; Satellites; Sea ice; Space-based radar; Synthetic aperture radar; Water levels; Ice cover; Lake water level; SAR altimetry; Sentinel-3; Wave forms; algorithm; data processing; Doppler radar; hydrological cycle; ice cover; lake water; radar altimetry; sea ice; Sentinel; synthetic aperture radar; tracking; water level; waveform analysis; Reservoirs (water)","Ice cover; Lake water levels; SAR altimetry; Sentinel-3; Waveform","Article","Final","","Scopus","2-s2.0-85077944930"
