"Authors","Author full names","Author(s) ID","Titles","Year","Source title","Volume","Issue","Art. No.","Page start","Page end","Page count","DOI","Cited by","Link","Abstract","Indexed Keywords","Author Keywords","Document Type","Publication Stage","Open Access","Source","EID"
"Arun P.V.; Sadeh R.; Avneri A.; Tubul Y.; Camino C.; Buddhiraju K.M.; Porwal A.; Lati R.N.; Zarco-Tejada P.J.; Peleg Z.; Herrmann I.","Arun, P.V. (57202034266); Sadeh, R. (57209321842); Avneri, A. (57207958385); Tubul, Y. (57266839800); Camino, C. (55387868700); Buddhiraju, K.M. (36815713200); Porwal, A. (9738526000); Lati, R.N. (37088792100); Zarco-Tejada, P.J. (6701731228); Peleg, Z. (15136927700); Herrmann, I. (36070624100)","57202034266; 57209321842; 57207958385; 57266839800; 55387868700; 36815713200; 9738526000; 37088792100; 6701731228; 15136927700; 36070624100","Multimodal Earth observation data fusion: Graph-based approach in shared latent space","2022","Information Fusion","78","","","20","39","19","10.1016/j.inffus.2021.09.004","2","https://www.scopus.com/inward/record.uri?eid=2-s2.0-85115401406&doi=10.1016%2fj.inffus.2021.09.004&partnerID=40&md5=180247e9a56560637a79ea9eed3cfb89","Multiple and heterogenous Earth observation (EO) platforms are broadly used for a wide array of applications, and the integration of these diverse modalities facilitates better extraction of information than using them individually. The detection capability of the multispectral unmanned aerial vehicle (UAV) and satellite imagery can be significantly improved by fusing with ground hyperspectral data. However, variability in spatial and spectral resolution can affect the efficiency of such dataset's fusion. In this study, to address the modality bias, the input data was projected to a shared latent space using cross-modal generative approaches or guided unsupervised transformation. The proposed adversarial networks and variational encoder-based strategies used bi-directional transformations to model the cross-domain correlation without using cross-domain correspondence. It may be noted that an interpolation-based convolution was adopted instead of the normal convolution for learning the features of the point spectral data (ground spectra). The proposed generative adversarial network-based approach employed dynamic time wrapping based layers along with a cyclic consistency constraint to use the minimal number of unlabeled samples, having cross-domain correlation, to compute a cross-modal generative latent space. The proposed variational encoder-based transformation also addressed the cross-modal resolution differences and limited availability of cross-domain samples by using a mixture of expert-based strategy, cross-domain constraints, and adversarial learning. In addition, the latent space was modelled to be composed of modality independent and modality dependent spaces, thereby further reducing the requirement of training samples and addressing the cross-modality biases. An unsupervised covariance guided transformation was also proposed to transform the labelled samples without using cross-domain correlation prior. The proposed latent space transformation approaches resolved the requirement of cross-domain samples which has been a critical issue with the fusion of multi-modal Earth observation data. This study also proposed a latent graph generation and graph convolutional approach to predict the labels resolving the domain discrepancy and cross-modality biases. Based on the experiments over different standard benchmark airborne datasets and real-world UAV datasets, the developed approaches outperformed the prominent hyperspectral panchromatic sharpening, image fusion, and domain adaptation approaches. By using specific constraints and regularizations, the network developed was less sensitive to network parameters, unlike in similar implementations. The proposed approach illustrated improved generalizability in comparison with the prominent existing approaches. In addition to the fusion-based classification of the multispectral and hyperspectral datasets, the proposed approach was extended to the classification of hyperspectral airborne datasets where the latent graph generation and convolution were employed to resolve the domain bias with a small number of training samples. Overall, the developed transformations and architectures will be useful for the semantic interpretation and analysis of multimodal data and are applicable to signal processing, manifold learning, video analysis, data mining, and time series analysis, to name a few. © 2021 Elsevier B.V.","Antennas; Convolutional neural networks; Generative adversarial networks; Graphic methods; Image enhancement; Image fusion; Learning systems; Metadata; Observatories; Satellite imagery; Signal encoding; Unmanned aerial vehicles (UAV); Convolutional neural network; Cross-domain; Cross-modal; Earth observation data; Ground measured spectrum; HyperSpectral; Multi-modal; Multi-spectral; Multispectral unmanned aerial vehicle; Spectra's; Convolution","Convolutional neural networks; Fusion; Ground measured spectra; Hyperspectral; Multispectral UAV","Article","Final","","Scopus","2-s2.0-85115401406"
"Kerdegari H.; Razaak M.; Argyriou V.; Remagnino P.","Kerdegari, Hamideh (55438018000); Razaak, Manzoor (55639468300); Argyriou, Vasileios (13806485100); Remagnino, Paolo (6602806859)","55438018000; 55639468300; 13806485100; 6602806859","Urban scene segmentation using semi-supervised GAN","2019","Proceedings of SPIE - The International Society for Optical Engineering","11155","","111551H","","","","10.1117/12.2533055","4","https://www.scopus.com/inward/record.uri?eid=2-s2.0-85078136549&doi=10.1117%2f12.2533055&partnerID=40&md5=300b8ecab1c88e4fe9f5c879afc2c092","Semantic segmentation of remote sensing data such as multispectral imagery has been boosted recently using deep convolutional neural networks (CNN). However, segmentation of multispectral images using supervised machine learning algorithms such as CNN requires a significant number of pixel-level annotated data, often unavailable, making the task extremely challenging. To address this, this paper puts forward a semi-supervised framework, based on generative adversarial networks (GAN). The proposed solution consists of a generator network to provide photo-realistic images as extra training data to a multi-class classifier acting as a discriminator and trained on a small annotated dataset. Performance of the proposed semi-supervised GAN is evaluated on two benchmarks multispectral semantic segmentation datasets collected from urban scenes of Vaihingen and Potsdam. Results indicate that the proposed framework achieves competitive performance compared to state-of-the-art semantic segmentation methods and show the potential of GAN-based methods for the challenging task of multispectral image segmentation. © 2019 SPIE.","Benchmarking; Classification (of information); Deep neural networks; Learning algorithms; Machine learning; Neural networks; Remote sensing; Semantics; Supervised learning; Adversarial networks; Competitive performance; Convolutional neural network; Multi-class classifier; Multi-spectral imagery; Semantic segmentation; Semi-supervised; Supervised machine learning; Image segmentation","Convolu-tional neural network; Generative adversarial networks (GAN); Multispectral imagery; Semantic segmentation; Semi-supervised GAN","Conference paper","Final","","Scopus","2-s2.0-85078136549"
"Dai X.; Yuan X.; Wei X.","Dai, Xuerui (57193803463); Yuan, Xue (7402202691); Wei, Xueye (8847047900)","57193803463; 7402202691; 8847047900","Data augmentation for thermal infrared object detection with cascade pyramid generative adversarial network","2022","Applied Intelligence","52","1","","967","981","14","10.1007/s10489-021-02445-9","4","https://www.scopus.com/inward/record.uri?eid=2-s2.0-85105923141&doi=10.1007%2fs10489-021-02445-9&partnerID=40&md5=67e086fae0ec29a19096da0dea3b93d5","Object detection based on convolutional neural network (CNN) should be trained effectively with much data. Data augmentation techniques devote to generate more data, which can enhance the generalization ability and robustness of detection network. For object detection in thermal infrared (TIR) images, objects are difficult to label because of the heavy noise and low resolution. So, it is highly recommended for us to do data augmentation. However, traditional data augmentation strategies (such as image flipping, random color jittering) only produce limited training samples. In order to generate images with high resolution, and ensure they are subject to the distribution of real samples, generative adversarial network (GAN) is introduced. To generate high-resolution samples, image pyramids are input into different branches, then these cascade features are fused to gradually improve the resolution. For the sake of improving the discriminant capability of discriminator, the feature matching loss is calculated when training. And the generated images with different resolutions are discriminated in multiple stages. The data augmentation algorithm proposed in this paper is called cascade pyramid generative adversarial network (CPGAN). No matter on the KAIST Multispectral data set or OSU thermal-color data set, with our CPGAN, the detection accuracy of classical detection algorithms is greatly improved. In addition, the detection speed remains entirely unaffected because CPGAN only exists in the training phase. © 2021, The Author(s), under exclusive licence to Springer Science+Business Media, LLC, part of Springer Nature.","Convolutional neural networks; Image enhancement; Infrared radiation; Object recognition; Adversarial networks; Data augmentation algorithms; Detection algorithm; Detection networks; Different resolutions; Generalization ability; Multi-spectral data; Thermal infrared images; Object detection","Data augmentation; GAN; Object detection; Thermal infrared images","Article","Final","","Scopus","2-s2.0-85105923141"
"Wang L.; Gao C.; Zhao Y.; Song T.; Feng Q.","Wang, Lan (57191097124); Gao, Chenqiang (12753046300); Zhao, Yue (57203762157); Song, Tiecheng (57203522510); Feng, Qi (57129725400)","57191097124; 12753046300; 57203762157; 57203522510; 57129725400","Infrared and Visible Image Registration Using Transformer Adversarial Network","2018","Proceedings - International Conference on Image Processing, ICIP","","","8451370","1248","1252","4","10.1109/ICIP.2018.8451370","3","https://www.scopus.com/inward/record.uri?eid=2-s2.0-85062916597&doi=10.1109%2fICIP.2018.8451370&partnerID=40&md5=6184460aa52ca5b80bd09e0acb4bef23","In this paper we address the task of infrared and visible image registration in complex scenes. Due to the difference of infrared and visible images, it is neither easy to reliably find features nor suitable for directly training in deep learning architecture. Thus, we propose a two-stage adversarial network, which first conducts a multi-spectral image transfer to obtain a mapped image. And then the proposed network incorporate a transformer module into the conditional adversarial network architecture to get the refined warped image. Our method can back propagate the multi-spectral registration loss and achieve end-to-end training. Experiments on our multi -spectral dataset demonstrate that this approach is effective and robust, which outperforms other state-of-the-art methods. © 2018 IEEE.","Deep learning; Image registration; Infrared imaging; Spectroscopy; Adversarial networks; Complex scenes; Infrared and visible image; Learning architectures; Multi-spectral; Multi-spectrum; Multispectral images; State-of-the-art methods; Network architecture","Generative Adversarial Networks; Image Registration; Infrared Image; Multi-spectrum","Conference paper","Final","","Scopus","2-s2.0-85062916597"
"Gandikota R.; Radha Krishna K.; Sharma A.; ManjuSarma M.; Bothale V.M.","Gandikota, Rohit (57212350460); Radha Krishna, K. (57222241774); Sharma, Anupama (55605769875); ManjuSarma, M. (57222244883); Bothale, Vinod M (6505542077)","57212350460; 57222241774; 55605769875; 57222244883; 6505542077","RTC-GAN: REAL-TIME CLASSIFICATION of SATELLITE IMAGERY USING DEEP GENERATIVE ADVERSARIAL NETWORKS with INFUSED SPECTRAL INFORMATION","2020","International Geoscience and Remote Sensing Symposium (IGARSS)","","","9323363","6993","6996","3","10.1109/IGARSS39084.2020.9323363","1","https://www.scopus.com/inward/record.uri?eid=2-s2.0-85101979819&doi=10.1109%2fIGARSS39084.2020.9323363&partnerID=40&md5=6e47f541ca713a2956765bbf3703c248","This paper implements a deep learning-based Convolutional Neural Network (CNN) with adversarial training and infused pixel information to classify multi-spectral data into 4 LULC classes and cloud. The network is capable of classifying the image on a real-time basis at acquisition time in pixel level by considering the various spectral band values at the pixel and a spatial region around the pixel to collect the spatial features. This way, both spatial information, and spectral information are considered to classify the image. This novel GAN architecture named RTC-GAN is generalized over all the satellites that have their sensors in and around standard NIR, R and G spectral bands while being able to classify the images in realtime. This network is realized and tested on data obtained from satellites Landsat 8 Sentinel2 and Indian Remote Sensing (IRS) satellites like Cartosat-2S, Resourcesat-2/2A. The dataset is not open-sourced and hence very minimal information is provided regarding the IRS data. © 2020 IEEE.","Convolutional neural networks; Deep learning; Geology; Image classification; Pixels; Remote sensing; Satellite imagery; Acquisition time; Adversarial networks; Minimal information; Multi-spectral data; Pixel information; Spatial features; Spatial informations; Spectral information; Classification (of information)","Cartosat; Generative Adversarial Networks; Landsat8; LULC; Real-Time Analysis; Satellite Imagery","Conference paper","Final","","Scopus","2-s2.0-85101979819"
"","","","5th International Conference on Machine Vision and Information Technology, CMVIT 2021","2021","Journal of Physics: Conference Series","1880","1","","","","286","","0","https://www.scopus.com/inward/record.uri?eid=2-s2.0-85105483234&partnerID=40&md5=c8e90ba1c150e8d31ff95138411efca2","The proceedings contain 37 papers. The topics discussed include: a brief analysis of intelligent voice technology for China's mainstream media content production and distribution implications - take the application of IFLYTEK series products in mainstream media as an example; time-frequency bandpass filter with nonstationary signal decomposition application; design and implementation of wireless identification and sensing platform in structure monitoring; dynamic scene deblurring of multi-scale progressive attention network; an occlusion handling evaluation criterion for deep learning object segmentation; image inpainting of multi-spectral image with laser lines based on generative adversarial network; research on intelligent damage assessment system for time-sharing rental vehicles based on image recognition; and dynamic degradation quantification of wind turbine high speed shaft bearing based on oscillation based sparsity indices.","","","Conference review","Final","","Scopus","2-s2.0-85105483234"
"Lore K.G.; Reddy K.K.; Giering M.; Bernal E.A.","Lore, Kin Gwn (57190128995); Reddy, Kishore K. (55443153000); Giering, Michael (56464245300); Bernal, Edgar A. (12800366000)","57190128995; 55443153000; 56464245300; 12800366000","Generative adversarial networks for spectral super-resolution and bidirectional rgb-to-multispectral mapping","2019","IEEE Computer Society Conference on Computer Vision and Pattern Recognition Workshops","2019-June","","9025450","926","933","7","10.1109/CVPRW.2019.00122","17","https://www.scopus.com/inward/record.uri?eid=2-s2.0-85071519076&doi=10.1109%2fCVPRW.2019.00122&partnerID=40&md5=a0acb08f88953b4bf73f88bc6b5ad48a","Acquisition of multi-and hyperspectral imagery imposes significant requirements on the hardware capabilities of the sensors involved. In order to keep costs manageable, and due to limitations in the sensing technology, tradeoffs between the spectral and the spatial resolution of hyperspectral images are usually made. Such tradeoffs are usually not necessary when considering acquisition of traditional RGB imagery. We investigate the use of statistical learning, and in particular, of conditional generative adversarial networks (cGANs) to estimate mappings from three-channel RGB to 31-band multispectral imagery. We demonstrate the application of the proposed approach to (i) RGB-to-multispectral image mapping, (ii) spectral super-resolution of image data, and (iii) recovery of RGB imagery from multispectral data. © 2019 IEEE.","Computer vision; Optical resolving power; Remote sensing; Spectroscopy; Adversarial networks; Hyper-spectral imageries; Multi-spectral data; Multi-spectral imagery; Multispectral images; Sensing technology; Spatial resolution; Statistical learning; Photomapping","","Conference paper","Final","","Scopus","2-s2.0-85071519076"
"Jamali A.; Mahdianpari M.","Jamali, Ali (56909712300); Mahdianpari, Masoud (57190371939)","56909712300; 57190371939","A cloud-based framework for large-scale monitoring of ocean plastics using multi-spectral satellite imagery and generative adversarial network","2021","Water (Switzerland)","13","18","2553","","","","10.3390/w13182553","5","https://www.scopus.com/inward/record.uri?eid=2-s2.0-85115435905&doi=10.3390%2fw13182553&partnerID=40&md5=7aa145df5785a2f6a098be414387695c","Marine debris is considered a threat to the inhabitants, as well as the marine environments. Accumulation of marine debris, besides climate change factors, including warming water, sea-level rise, and changes in oceans’ chemistry, are causing the potential collapse of the marine environment’s health. Due to the increase of marine debris, including plastics in coastlines, ocean and sea surfaces, and even in deep ocean layers, there is a need for developing new advanced technology for the detection of large-sized marine pollution (with sizes larger than 1 m) using state-of-the-art remote sensing and machine learning tools. Therefore, we developed a cloud-based framework for large-scale marine pollution detection with the integration of Sentinel-2 satellite imagery and advanced machine learning tools on the Sentinel Hub cloud application programming interface (API). Moreover, we evaluated the performance of two shallow machine learning algorithms of random forest (RF) and support vector machine (SVM), as well as the deep learning method of the generative adversarial network-random forest (GAN-RF) for the detection of ocean plastics in the pilot site of Mytilene Island, Greece. Based on the obtained results, the shallow algorithms of RF and SVM achieved an overall accuracy of 88% and 84%, respectively, with available training data of plastic debris. The GAN-RF classifier improved the detection of ocean plastics of the RF method by 8%, achieving an overall accuracy of 96% by generating several synthetic ocean plastic samples. © 2021 by the authors. Licensee MDPI, Basel, Switzerland.","Aegean Islands; Greece; Lesbos; Northern Aegean; Application programming interfaces (API); Classification (of information); Climate change; Debris; Decision trees; Deep learning; Elastomers; Learning algorithms; Marine pollution; Oil spills; Radiometers; Remote sensing; Satellite imagery; Sea level; Support vector machines; Cloud-based; Large-scale monitoring; Marine debris; Marine environment; Multi-spectral; Ocean plastic; Overall accuracies; Random forests; Sentinel hub; Support vectors machine; accuracy assessment; advanced technology; climate change; debris flow; deep water; marine environment; marine pollution; monitoring; monitoring system; plastic waste; satellite imagery; sea surface; Sentinel; spectral analysis; support vector machine; warming; Generative adversarial networks","Generative adversarial network; Marine debris; Marine pollution; Ocean plastics; Random forest; Sentinel Hub; Support vector machine","Article","Final","All Open Access; Gold Open Access","Scopus","2-s2.0-85115435905"
"Wang L.; Xu X.; Yu Y.; Yang R.; Gui R.; Xu Z.; Pu F.","Wang, Lei (57211488504); Xu, Xin (56294598500); Yu, Yue (57214104632); Yang, Rui (57208294306); Gui, Rong (57211231417); Xu, Zhaozhuo (57171068000); Pu, Fangling (13408173100)","57211488504; 56294598500; 57214104632; 57208294306; 57211231417; 57171068000; 13408173100","SAR-to-optical image translation using supervised cycle-consistent adversarial networks","2019","IEEE Access","7","","8825802","129136","129149","13","10.1109/ACCESS.2019.2939649","70","https://www.scopus.com/inward/record.uri?eid=2-s2.0-85078034428&doi=10.1109%2fACCESS.2019.2939649&partnerID=40&md5=a6086960f8b2c0f3cb16077d491dcb0b","Optical remote sensing (RS) data suffer from the limitation of bad weather and cloud contamination, whereas synthetic aperture radar (SAR) can work under all weather conditions and overcome this disadvantage of optical RS data. However, due to the imaging mechanism of SAR and the speckle noise, untrained people are difficult to recognize the land cover types visually from SAR images. Inspired by the excellent image-to-image translation performance of Generative Adversarial Networks (GANs), a supervised Cycle-Consistent Adversarial Network (S-CycleGAN) was proposed to generate large optical images from the SAR images. When the optical RS data are unavailable or partly unavailable, the generated optical images can be alternative data that aid in land cover visual recognition for untrained people. The main steps of SAR-to-optical image translation were as follows. First, the large SAR image was split to small patches. Then S-CycleGAN was used to translate the SAR patches to optical image patches. Finally, the optical image patches were stitched to generate the large optical image. A paired SAR-optical image dataset which covered 32 Chinese cities was published to evaluate the proposed method. The dataset was generated from Sentinel-1 (SEN-1) SAR images and Sentinel-2 (SEN-2) multi-spectral images. S-CycleGAN was applied to two experiments, which were SAR-to-optical image translation and cloud removal, and the results showed that S-CycleGAN could keep both the land cover and structure information well, and its performance was superior to some famous image-to-image translation models. © 2013 IEEE.","Flow visualization; Geometrical optics; Remote sensing; Spectroscopy; Synthetic aperture radar; Adversarial networks; Cloud contamination; Cloud removal; Multispectral images; Optical image; Optical remote sensing; Sentinel; Structure information; Radar imaging","cloud removal; GAN; SAR-to-optical image translation; Sentinel; visualization","Article","Final","All Open Access; Gold Open Access","Scopus","2-s2.0-85078034428"
"Lu L.; Zhu H.; Dong J.; Ju Y.; Zhou H.","Lu, Liang (57201005874); Zhu, Hongbao (57208780202); Dong, Junyu (22634069200); Ju, Yakun (57197800254); Zhou, Huiyu (23062556900)","57201005874; 57208780202; 22634069200; 57197800254; 23062556900","Three-dimensional reconstruction with a laser line based on image in-painting and multi-spectral photometric stereo","2021","Sensors","21","6","2131","1","18","17","10.3390/s21062131","2","https://www.scopus.com/inward/record.uri?eid=2-s2.0-85102573052&doi=10.3390%2fs21062131&partnerID=40&md5=29954801d13c9eb86120377265f81f36","This paper presents a multi-spectral photometric stereo (MPS) method based on image in-painting, which can reconstruct the shape using a multi-spectral image with a laser line. One of the difficulties in multi-spectral photometric stereo is to extract the laser line because the required illumination for MPS, e.g., red, green, and blue light, may pollute the laser color. Unlike previous methods, through the improvement of the network proposed by Isola, a Generative Adversarial Network based on image in-painting was proposed, to separate a multi-spectral image with a laser line into a clean laser image and an uncorrupted multi-spectral image without the laser line. Then these results were substituted into the method proposed by Fan to obtain high-precision 3D reconstruction results. To make the proposed method applicable to real-world objects, a rendered image dataset obtained using the rendering models in ShapeNet has been used for training the network. Evaluation using the rendered images and real-world images shows the superiority of the proposed approach over several previous methods. © 2021 by the authors. Licensee MDPI, Basel, Switzerland.","Image enhancement; Image reconstruction; Photometry; Rendering (computer graphics); Spectroscopy; 3D reconstruction; Adversarial networks; Multispectral images; Photometric stereo; Real-world image; Real-world objects; Rendered images; Three-dimensional reconstruction; Stereo image processing","And laser extraction; Generative adversarial network; Image in-painting; Multi-spectral photometric stereo","Article","Final","All Open Access; Gold Open Access; Green Open Access","Scopus","2-s2.0-85102573052"
