"Authors","Author full names","Author(s) ID","Titles","Year","Source title","Volume","Issue","Art. No.","Page start","Page end","Page count","DOI","Cited by","Link","Abstract","Indexed Keywords","Author Keywords","Document Type","Publication Stage","Open Access","Source","EID"
"Romero L.S.; Marcello J.; Vilaplana V.","Romero, Luis Salgueiro (57218455911); Marcello, Javier (6602158797); Vilaplana, Verónica (23394280500)","57218455911; 6602158797; 23394280500","Super-resolution of Sentinel-2 imagery using generative adversarial networks","2020","Remote Sensing","12","15","2424","","","","10.3390/RS12152424","33","https://www.scopus.com/inward/record.uri?eid=2-s2.0-85089853089&doi=10.3390%2fRS12152424&partnerID=40&md5=6bb6fc362a861fc8952daf3ca71d5b36","Sentinel-2 satellites provide multi-spectral optical remote sensing images with four bands at 10 m of spatial resolution. These images, due to the open data distribution policy, are becoming an important resource for several applications. However, for small scale studies, the spatial detail of these images might not be sufficient. On the other hand, WorldView commercial satellites offer multi-spectral images with a very high spatial resolution, typically less than 2 m, but their use can be impractical for large areas or multi-temporal analysis due to their high cost. To exploit the free availability of Sentinel imagery, it is worth considering deep learning techniques for single-image super-resolution tasks, allowing the spatial enhancement of low-resolution (LR) images by recovering high-frequency details to produce high-resolution (HR) super-resolved images. In this work, we implement and train a model based on the Enhanced Super-Resolution Generative Adversarial Network (ESRGAN) with pairs of WorldView-Sentinel images to generate a super-resolved multispectral Sentinel-2 output with a scaling factor of 5. Our model, named RS-ESRGAN, removes the upsampling layers of the network to make it feasible to train with co-registered remote sensing images. Results obtained outperform state-of-the-art models using standard metrics like PSNR, SSIM, ERGAS, SAM and CC. Moreover, qualitative visual analysis shows spatial improvements as well as the preservation of the spectral information, allowing the super-resolved Sentinel-2 imagery to be used in studies requiring very high spatial resolution. © 2020 by the authors.","Deep learning; Image analysis; Image resolution; Network layers; Open Data; Optical resolving power; Remote sensing; Spectroscopy; Commercial satellites; Data distribution policies; Low resolution images; Multi-temporal analysis; Optical remote sensing; Remote sensing images; Spectral information; Very high spatial resolutions; Image enhancement","Deep learning; Generative adversarial network; Sentinel-2; Super-resolution; WorldView","Article","Final","All Open Access; Gold Open Access; Green Open Access","Scopus","2-s2.0-85089853089"
"Ren C.X.; Ziemann A.; Theiler J.; Durieux A.M.S.","Ren, Christopher X. (57004276700); Ziemann, Amanda (36134071500); Theiler, James (7004449154); Durieux, Alice M.S. (57212026338)","57004276700; 36134071500; 7004449154; 57212026338","Cycle-Consistent Adversarial Networks for Realistic Pervasive Change Generation in Remote Sensing Imagery","2020","Proceedings of the IEEE Southwest Symposium on Image Analysis and Interpretation","2020-March","","9094603","42","45","3","10.1109/SSIAI49293.2020.9094603","5","https://www.scopus.com/inward/record.uri?eid=2-s2.0-85085490462&doi=10.1109%2fSSIAI49293.2020.9094603&partnerID=40&md5=17ae73c5ca32f7d9f596595252ae0d13","This paper introduces a new method of generating realistic pervasive changes in the context of evaluating the effectiveness of change detection algorithms in controlled settings. The method-a cycle-consistent adversarial network (CycleGAN)-requires low quantities of training data to generate realistic changes. Here we show an application of CycleGAN in creating realistic snow-covered scenes of multispectral Sentinel-2 imagery, and demonstrate how these images can be used as a test bed for anomalous change detection algorithms. © 2020 IEEE.","Remote sensing; Signal detection; Adversarial networks; Change detection algorithms; Multi-spectral; Remote sensing imagery; Training data; Image analysis","change detection; deep learning; generative adversarial networks; image analysis; multispectral; remote sensing","Conference paper","Final","All Open Access; Green Open Access","Scopus","2-s2.0-85085490462"
"Wang Y.; Xie Y.; Wu Y.; Liang K.; Qiao J.","Wang, Yajie (55734159700); Xie, Yanyan (57553191200); Wu, Yanyan (55977823200); Liang, Kai (57552266200); Qiao, Jilin (57552266300)","55734159700; 57553191200; 55977823200; 57552266200; 57552266300","An Unsupervised Multi-scale Generative Adversarial Network for Remote Sensing Image Pan-Sharpening","2022","Lecture Notes in Computer Science (including subseries Lecture Notes in Artificial Intelligence and Lecture Notes in Bioinformatics)","13142 LNCS","","","356","368","12","10.1007/978-3-030-98355-0_30","1","https://www.scopus.com/inward/record.uri?eid=2-s2.0-85127094685&doi=10.1007%2f978-3-030-98355-0_30&partnerID=40&md5=83048658bff66110025738d16f575ad4","Pan-sharpening of remote sensing images is an effective method to get high spatial resolution multi-spectral (HRMS) images by fusing low spatial resolution multi-spectral (LRMS) images and high spatial resolution panchromatic (PAN) images. Recently, many remote sensing images pan-sharpening methods based on convolutional neural networks (CNN) have been proposed and achieved excellent performance. However, two drawbacks still exist. On the one hand, since there are no ideal HRMS images as targets for learning, most existing methods require an extra effort to produce the simulated data for training. On the other hand, these methods ignore the local features of the original images. To address these issues, we propose an unsupervised multi-scale generative adversarial network method, which can train directly on the full-resolution images without down-sampling. Firstly, a multi-scale dense generator network is proposed to extract features from the original images to generate HRMS images. Secondly, two discriminators are used to protect the spectral information of LRMS images and spatial information of PAN images, respectively. Finally, to improve the quality of the fused image and implement training under the unsupervised setting, a new loss function is proposed. Experimental results based on QuickBird and GaoFen-2 data sets demonstrate that the proposed method can obtain much better fusion results for the full-resolution images. © 2022, Springer Nature Switzerland AG.","Convolutional neural networks; Image enhancement; Image resolution; Remote sensing; Full resolution images; High spatial resolution; Multi-scales; Multispectral images; Original images; Pan-sharpening; Remote sensing images; Remote-sensing; Spatial resolution; Unsupervised; Generative adversarial networks","Full-resolution images; Generative adversarial network; Pan-sharpening; Remote sensing; Unsupervised","Conference paper","Final","","Scopus","2-s2.0-85127094685"
"Girla I.-A.; Neagoe V.-E.","Girla, Ionut-Alexandru (57271086400); Neagoe, Victor-Emil (56005805800)","57271086400; 56005805800","A Weakly-Supervised Change Detection for Multispectral Earth Observation Imagery using a Long Short-Term Memory Classifier with a Virtual Training Data Neural Generator","2022","14th International Conference on Communications, COMM 2022 - Proceedings","","","","","","","10.1109/COMM54429.2022.9817344","0","https://www.scopus.com/inward/record.uri?eid=2-s2.0-85135194582&doi=10.1109%2fCOMM54429.2022.9817344&partnerID=40&md5=6396e10ae09bd132aeb5e1d1a2c45f31","This paper proposes a novel approach to improve accuracy of weakly-supervised change detection for multispectral Earth Observation (EO) imagery. The method is based on the idea to use an initial small-size EO labeled dataset to generate a larger set of virtual data. We have considered two variants of virtual data-generators based on the general architecture called Generative Adversarial Network (GAN): MLPGAN and LSGAN. The resulting virtual dataset is used to train a simple Long Short-Term Memory (LSTM) classifier. The proposed method is evaluated using the Mexico dataset acquired by the Thematic Mapper (TM) sensor of the Landsat 5 satellite. For each acquisition date, two spectral bands are considered (B4, B5). The two images have been acquired in April 2000 and May 2002, respectively. We have evaluated the change detection performances (OA, Kappa, MAR, and FAR) using two virtual data generators corresponding to considered GAN architectures. As a benchmark method, we have considered the case when the LSTM classifier is trained with the original small-size dataset without synthetic data generation.  © 2022 IEEE.","Brain; Change detection; Classification (of information); Generative adversarial networks; Image enhancement; Memory architecture; Network architecture; Data generation; Earth observations; Generative adversarial network; Long short term memory  classifier; Multi-spectral; Supervised change detection; Synthetic training data; Synthetic training data generation; Virtual data; Weakly-supervised change detection; Long short-term memory","Generative Adversarial Network (GAN); Long Short Term Memory (LSTM) classifier; synthetic training data generation (STDG); Weakly-supervised change detection","Conference paper","Final","","Scopus","2-s2.0-85135194582"
"Chen Y.; Xu Y.-M.; Di Y.-J.; Cui X.-N.; Zhang J.; Zhou X.-D.; Xiao C.-Y.; Li S.-H.","Chen, Ying (55796483000); Xu, Yang-Mei (57207828557); Di, Yuan-Jian (57193879680); Cui, Xing-Ning (57194236469); Zhang, Jie (57216516975); Zhou, Xin-De (57213830709); Xiao, Chun-Yan (24765782900); Li, Shao-Hua (57208221648)","55796483000; 57207828557; 57193879680; 57194236469; 57216516975; 57213830709; 24765782900; 57208221648","COD Concentration Prediction Model Based on Multi-Spectral Data Fusion and GANs Algorithm; [多光谱数据融合和GANs算法的COD浓度预测]","2021","Guang Pu Xue Yu Guang Pu Fen Xi/Spectroscopy and Spectral Analysis","41","1","","188","193","5","10.3964/j.issn.1000-0593(2021)01-0188-06","2","https://www.scopus.com/inward/record.uri?eid=2-s2.0-85099633503&doi=10.3964%2fj.issn.1000-0593%282021%2901-0188-06&partnerID=40&md5=e9ae16922f3392eaf43b04767a11ff03","Excessive concentration of organic pollutants in water is harmful, which causes not only serious environmental pollution but also endangers human health. Chemical oxygen demand (COD) can be used to characterize the pollution degree of organic pollutants in water. A quantitative prediction model of COD concentration based on generative adversarial networks (GANs) algorithm is proposed, which combines ultraviolet (UV) and Near Infrared (NIR) spectra with data-level fusion (DLDF) and feature level data fusion (FLDF). In this paper, firstly, COD standard samples are prepared according to a certain concentration gradient, and the ultraviolet spectrum (190~310 nm) and near-infrared spectrum (830~2 100 nm) of the standard sample are collected respectively. The first derivative and Savitzky-Golay (S-G) smoothing pretreatment of the obtained ultraviolet and near-infrared spectrum data are carried out to eliminate the baseline drift of the spectrum and the interference noise. Then, the data fusion of data level and featural level are carried out directly basing on the pretreated ultraviolet and near-infrared spectra, and the COD concentration prediction model is constructed by GANs algorithm. The model is evaluated by using the square of the correlation coefficient of the evaluation parameters (R2), the mean square root error of the predicted value and the real concentration value (RMSEP) and the prediction deviation. The results show that neither FLDF model nor DLDF model is not ideal. The analysis shows that the model contribution of the ultraviolet spectrum is concealed in the near-infrared band due to the unbalanced data in the ultraviolet and near-infrared bands, which makes the spectral fusion meaningless. In order to avoid the problem of fusion failure, the normalizat-ion method is proposed to deal with the mixed spectrum in the text. The effects of standard normal variation (SNV), maximum and minimum normalization (MMN) and vector normalization (VN) on the modeling are discussed. Then the normalized ultraviolet and near-infrared spectral data are fused again under the given sub-interval number, the input X of GAN model is taken as the input X, and the real measured COD value is taken as the output Y. The prediction models of COD concentration are established after different normalization methods. The modeling results show that different normalization methods have a great influence on the hybrid spectral data fusion model, and the prediction accuracy of the data-level fusion model and the feature-level fusion model is significantly improved before it is normalized, among which the prediction model with the maximum and minimum normalization is the most obvious. Finally, in order to verify the accuracy of the multi-spectral data fusion GANs Prediction model, the GANs prediction model of the full wavelength ultraviolet band of a single spectral source and the GANs prediction model of the full wavelength near-infrared band of a single spectral source are established. The experimental results show that the correlation coefficient of the characteristic level spectral fusion model basing on the ultraviolet and near-infrared spectra is 0.994 7, the prediction mean square root error is 0.976, the prediction model error is reduced by 52.9% comparing with the data level fusion, and the predicted recovery rate is 98.4%~103.1%, which is much better than the other groups. The generalization ability of the model is strong and the prediction accuracy is high. Compared with the monitoring model of single spectral source, the data fusion of mixed spectra can reflect more the chemical information of water samples, and reveals the pollutant degree of a water body more comprehensively, reflects the difference of pollutants in a water body from different levels, provides some technical support for on-line monitoring of COD concentration in water. © 2021, Peking University Press. All right reserved.","Chemical oxygen demand; Data fusion; Errors; Forecasting; Infrared devices; Near infrared spectroscopy; Organic pollutants; Ultraviolet spectroscopy; Water pollution; Concentration gradients; Concentration prediction; Correlation coefficient; Environmental pollutions; Mean square root error; Near infrared spectral; Quantitative prediction; Ultra-violet spectrums; Predictive analytics","COD concentration prediction; Data fusion; GANs model; NIR spectrum; UV spectrum","Article","Final","","Scopus","2-s2.0-85099633503"
"Li F.; Ma L.; Cai J.","Li, Feimo (57190281893); Ma, Lei (27171956800); Cai, Jian (57207874020)","57190281893; 27171956800; 57207874020","Multi-discriminator generative adversarial network for high resolution gray-scale satellite image colorization","2018","International Geoscience and Remote Sensing Symposium (IGARSS)","2018-July","","8517930","3489","3492","3","10.1109/IGARSS.2018.8517930","9","https://www.scopus.com/inward/record.uri?eid=2-s2.0-85063144299&doi=10.1109%2fIGARSS.2018.8517930&partnerID=40&md5=5ed32be21b7dbc7734245b58ace7c2f0","Automatic colorization for grayscale satellite images can help with eliminating lighting differences between multi-spectral captures, and provides strong prior information for ground type classification and object detection. In this paper, we introduced a novel generative adversarial network with multiple discriminators for colorizing gray-scale satellite images with pseudo-natural appearances. Although being powerful, deep generative model in its common form with a single discriminator could be unstable for achieving spatial consistency on local textured regions, especially highly textured ones. To address this issue, the generator in our proposed structure produces a group of colored outputs from feature maps at different scale levels of the network, each being supervised by an independent discriminator to fit the original colored training input in discrete Lab color space. The final colored output is a cascaded ensemble of these preceding by-products via summation, thus the fitting errors are reduced by a geometric series form. Quantitative and qualitative comparisons with the sole-discriminator version have been performed on high-resolution satellite images in experiments, where significant reductions in prediction errors have been observed. © 2018 IEEE","","Generative adversarial network; Gray-scale satellite images; Multiple discriminators; Pseudo-natural colorization","Conference paper","Final","","Scopus","2-s2.0-85063144299"
"Hasan C.; Horne R.; Mauw S.; Mizera A.","Hasan, Cengis (34881811700); Horne, Ross (55249833700); Mauw, Sjouke (6601991482); Mizera, Andrzej (35410075000)","34881811700; 55249833700; 6601991482; 35410075000","Cloud removal from satellite imagery using multispectral edge-filtered conditional generative adversarial networks","2022","International Journal of Remote Sensing","43","5","","1881","1893","12","10.1080/01431161.2022.2048915","2","https://www.scopus.com/inward/record.uri?eid=2-s2.0-85127289358&doi=10.1080%2f01431161.2022.2048915&partnerID=40&md5=a7c093b8e4eb27bce3040f97716bfa67","We propose a Generative Adversarial Network (GAN) based architecture for removing clouds from satellite imagery. Data used for training comprises of visible light RGB and near-infrared (NIR) band images. The novelty lies in the structure of the discriminator in the GAN architecture, which compares generated and target cloud-free RGB images concatenated with their edge-filtered versions. Experimental results show that our approach to removing clouds outperforms both visually and according to metrics, a benchmark solution that does not take edge filtering into account, and that improvements are robust when varying both training dataset size and NIR cloud penetrability. © 2022 The Author(s). Published by Informa UK Limited, trading as Taylor & Francis Group.","Infrared devices; Network architecture; Satellite imagery; Benchmark solutions; Cloud removal; Edge filtering; Multi-spectral; Near infrared band; Network-based architectures; Removing cloud; RGB images; Training dataset; Visible light; comparative study; image analysis; image classification; image resolution; satellite data; satellite imagery; Generative adversarial networks","","Article","Final","All Open Access; Hybrid Gold Open Access","Scopus","2-s2.0-85127289358"
"Jiang F.; Gong M.; Zhan T.; Fan X.","Jiang, Fenlong (57210730944); Gong, Maoguo (8933846400); Zhan, Tao (57052462500); Fan, Xiaolong (57209827950)","57210730944; 8933846400; 57052462500; 57209827950","A Semisupervised GAN-Based Multiple Change Detection Framework in Multi-Spectral Images","2020","IEEE Geoscience and Remote Sensing Letters","17","7","8854295","1223","1227","4","10.1109/LGRS.2019.2941318","17","https://www.scopus.com/inward/record.uri?eid=2-s2.0-85090386350&doi=10.1109%2fLGRS.2019.2941318&partnerID=40&md5=9996c3aeb4484448b04822ecaf9650ad","Effectively highlighting multiple changes in the earth surface from multi-temporal remote sensing images is a meaningful but challenging task. In order to reduce costs and ensure the performance, it is advisable to employ a semisupervised strategy to achieve this goal. As a discriminative joint classification task, semisupervised change detection aims to extract useful and discriminative features from a large amount of unlabeled data in addition to limited labeled samples. The discriminator of a well-trained generative adversarial network (GAN) is just right for this. Therefore, in this letter, we proposed a semisupervised GAN-based multiple change detection framework for multi-spectral images. First, the GAN is trained by all data without any prior information. Then, we combine two identical trained discriminators to construct a dual-pipeline joint classifier. Finally, the classifier is fine-tuned by a very small amount of labeled data to detect multiple changes. The superior performance of the proposed model over both real multi-spectral data sets demonstrates its robustness and effectiveness.  © 2004-2012 IEEE.","Pipelines; Spectroscopy; Adversarial networks; Change detection; Classification tasks; Discriminative features; Multi-spectral data; Multi-temporal remote sensing; Multispectral images; Prior information; algorithm; detection method; image analysis; spectral analysis; supervised learning; Remote sensing","Generative adversarial network (GAN); multi-spectral images; multiple change detection; semisupervised","Article","Final","","Scopus","2-s2.0-85090386350"
"Zhao Z.; Zhang J.; Xu S.; Sun K.; Huang L.; Liu J.; Zhang C.","Zhao, Zixiang (57218542866); Zhang, Jiangshe (9737712100); Xu, Shuang (56367405500); Sun, Kai (57193093191); Huang, Lu (57222016088); Liu, Junmin (42761838200); Zhang, Chunxia (55703936800)","57218542866; 9737712100; 56367405500; 57193093191; 57222016088; 42761838200; 55703936800","FGF-GAN: A LIGHTWEIGHT GENERATIVE ADVERSARIAL NETWORK FOR PANSHARPENING VIA FAST GUIDED FILTER","2021","Proceedings - IEEE International Conference on Multimedia and Expo","","","","","","","10.1109/ICME51207.2021.9428272","5","https://www.scopus.com/inward/record.uri?eid=2-s2.0-85126434284&doi=10.1109%2fICME51207.2021.9428272&partnerID=40&md5=8d20df2cce1d516406276ae77807356d","Pansharpening is a widely used image enhancement technique for remote sensing. Its principle is to fuse the input high-resolution single-channel panchromatic (PAN) image and low-resolution multi-spectral image and to obtain a high-resolution multi-spectral (HRMS) image. The existing deep learning pansharpening method has two shortcomings. First, features of two input images need to be concatenated along the channel dimension to reconstruct the HRMS image, which makes the importance of PAN images not prominent, and also leads to high computational cost. Second, the implicit information of features is difficult to extract through the manually designed loss function. To this end, we propose a generative adversarial network via the fast guided filter (FGF) for pansharpening. In generator, traditional channel concatenation is replaced by FGF to better retain the spatial information while reducing the number of parameters. Meanwhile, the fusion objects can be highlighted by the spatial attention module. In addition, the latent information of features can be preserved effectively through adversarial training. Numerous experiments illustrate that our network generates high-quality HRMS images that can surpass existing methods, and with fewer parameters. © 2021 IEEE Computer Society. All rights reserved.","Deep learning; Image enhancement; Image fusion; Remote sensing; Spectroscopy; Channel dimension; Fast guided filter; Guided filters; High resolution; Input image; Lower resolution; Multispectral images; Pan-sharpening; Remote-sensing; Single channels; Generative adversarial networks","Fast guided filter; Generative adversarial network; Image fusion; Pansharpening","Conference paper","Final","All Open Access; Green Open Access","Scopus","2-s2.0-85126434284"
