"Authors","Author full names","Author(s) ID","Titles","Year","Source title","Volume","Issue","Art. No.","Page start","Page end","Page count","DOI","Cited by","Link","Abstract","Indexed Keywords","Author Keywords","Document Type","Publication Stage","Open Access","Source","EID"
"Podgórski J.; Petlicki M.","Podgórski, Julian (57201640538); Petlicki, Michał (56175876400)","57201640538; 56175876400","Detailed lacustrine calving iceberg inventory from very high resolution optical imagery and object-based image analysis","2020","Remote Sensing","12","11","1807","","","","10.3390/rs12111807","4","https://www.scopus.com/inward/record.uri?eid=2-s2.0-85086437404&doi=10.3390%2frs12111807&partnerID=40&md5=bacae0d6109233d27a4bef75189b6723","In the field of iceberg and glacier calving studies, it is important to collect comprehensive datasets of populations of icebergs. Particularly, calving of lake-terminating glaciers has been understudied. The aim of this work is to present an object-based method of iceberg detection and to create an inventory of icebergs located in a proglacial lagoon of San Quintin glacier, Northern Patagonia Icefield, Chile. This dataset is created using high-resolution WorldView-2 imagery and a derived DEM. We use it to briefly discuss the iceberg size distribution and area-volume scaling. Segmentation of the multispectral imagery produced a map of objects, which were classified with use of Random Forest supervised classification algorithm. An intermediate classification product was corrected with a ruleset exploiting contextual information and a watershed algorithm that was used to divide multiple touching icebergs into separate objects. Common theoretical heavy-tail statistical distributions were tested as descriptors of iceberg area and volume distributions. Power law models were proposed for the area-volume relationship. The proposed method performed well over the open lake detecting correctly icebergs in all size bands except 5-15 m2 where many icebergs were missed. A section of the lagoon with ice melange was not reliably mapped due to uniformity of the area in the imagery and DEM. The precision of the DEM limited the scaling effort to icebergs taller than 1.7 m and larger than 99 m2, despite the inventory containing icebergs as small as 4 m2. The work demonstrates viability of object-based analysis for lacustrine iceberg detection and shows that the statistical properties of iceberg population at San Quintin glacier match those of populations produced by tidewater glaciers. © 2020 by the authors.","Classification (of information); Decision trees; Lakes; Population statistics; Contextual information; Multi-spectral imagery; Object based image analysis; Object-based analysis; Object-based methods; Statistical distribution; Statistical properties; Supervised classification; Sea ice","Glacier calving; Iceberg; Lacustrine calving; Northern patagonia icefield; Object-based image analysis; Power law; Random forest; WorldView-2","Article","Final","All Open Access; Gold Open Access; Green Open Access","Scopus","2-s2.0-85086437404"
"Bostater C.R.; Rotkiske T.; Oney T.","Bostater, Charles R. (7004344456); Rotkiske, Tyler (57188589166); Oney, Taylor (57193159201)","7004344456; 57188589166; 57193159201","Hyperspectral reflectance signature protocol for predicting subsurface bottom reflectance in water: In-situ and analytical methods","2016","Proceedings of SPIE - The International Society for Optical Engineering","9999","","99990N","","","","10.1117/12.2241547","4","https://www.scopus.com/inward/record.uri?eid=2-s2.0-85011266616&doi=10.1117%2f12.2241547&partnerID=40&md5=dbcf6ff7f879ec1b3942343bcdf294d6","In-situ measurement of bottom reflectance signatures and bottom features in water are used to test an analytical based irradiance model protocol. Comparisons between predicted and measured bottom reflectance signatures are obtained using measured hyperspectral remote sensing reflectance signatures, water depth and water column constituent concentrations. Analytical solutions and algorithms are used to generate synthetic signatures of different bottom types. The analytical methodology used to simulated bottom reflectance contains offset and bias that can be corrected using spectral window based corrections. Example results are demonstrated for application to coral species, submerged aquatic vegetation and a sand bottom type. Spectral windows are identified for predicting the above bottom types. Sensitivity analysis of predicted bottom reflectance signatures is conducted by varying water depth, chlorophyll, dissolved organic matter and total suspended mater concentrations. The protocol can be applied to shallow subsurface geospatial mapping using sensor based water surface reflectance based upon an analytical model solution derived from primitive radiative transfer theory. © 2016 SPIE.","Biological materials; Fixed platforms; Hydrophilicity; Mapping; Offshore oil wells; Reflection; Satellite imagery; Sea ice; Sensitivity analysis; Surface waters; Water quality; Bottom sediments; Coral reef; Fluid muds; Geospatial mapping; Hyperspectral remote sensing; Multi-spectral imagery; Seagrasses; Shallow subsurface; Sondes; Remote sensing","Airborne image acquisition; Bottom sediment; Coral reef bottom reflectance; Fixed platform sensing; Fluid mud; Geospatial mapping application; Hyperspectral remote sensing; Multispectral imagery; Remote sensing; Sand bottom reflectance; Satellite imagery; Seagrass bottom reflectance; Shallow subsurface sensing; Sondes; Water quality","Conference paper","Final","","Scopus","2-s2.0-85011266616"
"Zahriban Hesari M.; Buono A.; Nunziata F.; Aulicino G.; Migliaccio M.","Zahriban Hesari, Mozhgan (57216963907); Buono, Andrea (57188716157); Nunziata, Ferdinando (35613962200); Aulicino, Giuseppe (55857208900); Migliaccio, Maurizio (23012466600)","57216963907; 57188716157; 35613962200; 55857208900; 23012466600","Multi-Polarisation C-Band SAR Imagery to Estimate the Recent Dynamics of the d’Iberville Glacier","2022","Remote Sensing","14","22","5758","","","","10.3390/rs14225758","1","https://www.scopus.com/inward/record.uri?eid=2-s2.0-85144421612&doi=10.3390%2frs14225758&partnerID=40&md5=d1c6bd58f62b181f0f2d8d6a98aa146b","To monitor polar regions is of paramount importance for climatological studies. Climate change due to anthropogenic activities is inducing global warming that, for example, has resulted in glacier melting. This has had a significant impact on sea levels and ocean circulation. In this study, the temporal trend of the marine-terminated d’Iberville glacier (Ellesmere Island, Canada) is analysed using C-band synthetic aperture radar satellite imagery collected by the Radarsat-2 and Sentinel-1 missions. The data set consists of a time series of 10 synthetic aperture radar data collected from 2010 to 2022 in dual-polarimetric imaging mode, where a horizontally polarised electromagnetic wave was transmitted. An automatic approach based on a global threshold constant false alarm rate method is applied to the single- and dual-polarisation features, namely the HH-polarised normalised radar cross-section and a combination of the HH- and HV-polarised scattering amplitudes, with the aim of extracting the ice front of the glacier and, therefore, estimating its behaviour over time. Independent collocated satellite optical imagery from the Sentinel-2 multi-spectral instrument is also considered, where available, to support the experimental outcomes. The experimental results show that (1) the HH-polarised normalised radar cross-section achieved better performance with respect to the dual-polarised feature, especially under the most challenging case of a sea-ice infested sea surface; (2) when the HH-polarised normalised radar cross-section was considered, the ice front extraction methodology provided a satisfactory accuracy, i.e., a root mean square error spanning from about 1.1 pixels to 3.4 pixels, depending on the sea-surface conditions; and (3) the d’Iberville glacier exhibited, during the study period, a significant retreat whose average surface velocity was 160 m per year, resulting in a net ice area loss of 2.2 km2 (0.18 km2 per year). These outcomes demonstrate that the d’Iberville glacier is behaving as most of the marine-terminated glaciers in the study area while experiencing a larger ice loss. © 2022 by the authors.","Electromagnetic waves; Extraction; Global warming; Mean square error; Pixels; Polarization; Radar cross section; Radar imaging; Satellite imagery; Sea ice; Sea level; Space-based radar; Surface waters; Anthropogenic activity; C-band SAR; C-bands; Canada; D’iberville glacier; Ice front extraction; Multi-polarization; Normalized radar cross section; Polar Regions; SAR imagery; Synthetic aperture radar","C-band SAR; Canada; d’Iberville glacier; ice front extraction; polarisation","Article","Final","All Open Access; Gold Open Access","Scopus","2-s2.0-85144421612"
"Verma A.; Gupta K.","Verma, Ayushi (57661726200); Gupta, Kunal (56007336300)","57661726200; 56007336300","Classification of Hyperspectral Image for Property Analysis","2019","Proceedings of the 2nd International Conference on Intelligent Computing and Control Systems, ICICCS 2018","","","8663049","1","4","3","10.1109/ICCONS.2018.8663049","0","https://www.scopus.com/inward/record.uri?eid=2-s2.0-85063798053&doi=10.1109%2fICCONS.2018.8663049&partnerID=40&md5=f3c9e410e682dc28d598cac3f4ebcf39","For the detection of the sea ice SAR algorithm has been utilized in order to avoid any damage to ship. This will identify whether there is any obstruction in the way of ice or not so that ship does not strike with ice. The desired results are obtained when SAR algorithm is connected on RADARl imagery data. They also studied the algorithm for the segmentation of ice known as pixel based segmentation which helps to differentiate ice based on its properties. Large number of methods has been utilized for multi temporal segmentation from the MODIS data which is known as TempoSeg strategy for multiyear sea ice. Synthetic Aperture Radar utilized the RADARSATl imagery data in order to detect the ice of sea at different regions of the seas. With the help of Rl imagery data better outcomes are provided by the automated algorithm. In present work, the automated SAR algorithm is required to execute in order to detect sea ice. © 2018 IEEE.","Control systems; Damage detection; Image classification; Intelligent computing; Sea ice; Ships; Spectroscopy; Synthetic aperture radar; Automated algorithms; HyperSpectral; Image properties; Multi-spectral; Multi-temporal; Number of methods; Pixel-based segmentation; Property analysis; Radar imaging","Hyperspectral; Image property; multi-spectral; SAR","Conference paper","Final","","Scopus","2-s2.0-85063798053"
"Spasova T.; Nedkov R.; Dancheva A.; Stoyanov A.; Ivanova I.; Georgiev N.","Spasova, Temenuzhka (57211430744); Nedkov, Roumen (57204958301); Dancheva, Adlin (57204632209); Stoyanov, Andrey (24765749200); Ivanova, Iva (57198062540); Georgiev, Nikolay (57211428499)","57211430744; 57204958301; 57204632209; 24765749200; 57198062540; 57211428499","Seasonal assessment of the dynamics of sea ice based on aerospace data on Livingston Island, New Shetland Islands in Antarctica and Longyearbyen in the Arctic","2020","Proceedings of SPIE - The International Society for Optical Engineering","11524","","115240J","","","","10.1117/12.2570829","1","https://www.scopus.com/inward/record.uri?eid=2-s2.0-85091226958&doi=10.1117%2f12.2570829&partnerID=40&md5=d6c23f6ceeea9afec269d713e00cd3e8","Sea ice plays a major role in our planet's climate. It' acts as a reflector of solar energy, mainly in spring and summer. Sea ice covered with fresh snow can reflect 75-90% of solar energy, the open sea reflects just 5-15%. Sea ice acts as an insulator in autumn and winter. This insulating effect limits the amount of both heat and moisture the ocean loses to the atmosphere. The declining sea ice disrupts the climate, societies and fauna of Polar areas, but encourages the econcmic and industrial development. The relevance of this study is related to current trends in the use of remote sensing in solving problems of a different nature in environmental monitoring. The sea ice was analyzed and mapped according to the European Space Agency data (ESA), acquired by sensors of Sentinel-1 SAR (Synthetic Aperture Radar), Sentinel-2MSI (Multi Spectral Instrument), Sentinel-3 and GIS. The subject of the study is to demonstrate the dynamics, during the summer season from 2015 to 2019, around the coastline of Livingston Island, New Shetland Islands in Antarctica and Longyearbyen in the Arctic. Changes in environmental objects are indicated by radar images through different processing approaches. The results clearly show that sea ice melting can be best recorded by using SAR data through the C-band. The results obtained are data in the form of thematic maps showing the spatial reflectance of sea ice and its dynamics over time.  © 2020 SPIE.","Dynamics; Insulator contamination; Maps; Reflection; Sea ice; Solar energy; Space optics; Synthetic aperture radar; Environmental Monitoring; Environmental objects; European Space Agency; Industrial development; Processing approach; SAR(synthetic aperture radar); Sea ice melting; Shetland islands; Remote sensing","Optical data; SAR data; Sea ice; Sentinel 2-MSI; Sentinel-1 SAR","Conference paper","Final","","Scopus","2-s2.0-85091226958"
"Avian M.; Bauer C.; Schlögl M.; Widhalm B.; Gutjahr K.-H.; Paster M.; Hauer C.; Frießenbichler M.; Neureiter A.; Weyss G.; Flödl P.; Seier G.; Sulzer W.","Avian, Michael (8578597300); Bauer, Christian (57196863939); Schlögl, Matthias (40561707800); Widhalm, Barbara (6506176864); Gutjahr, Karl-Heinz (21934060300); Paster, Michael (57216908698); Hauer, Christoph (15845712000); Frießenbichler, Melina (57216909695); Neureiter, Anton (56037832900); Weyss, Gernot (36740612600); Flödl, Peter (56346766500); Seier, Gernot (55544865300); Sulzer, Wolfgang (27067971400)","8578597300; 57196863939; 40561707800; 6506176864; 21934060300; 57216908698; 15845712000; 57216909695; 56037832900; 36740612600; 56346766500; 55544865300; 27067971400","The status of earth observation techniques in monitoring high mountain environments at the example of pasterze glacier, austria: Data, methods, accuracies, processes, and scales","2020","Remote Sensing","12","8","1251","","","","10.3390/RS12081251","8","https://www.scopus.com/inward/record.uri?eid=2-s2.0-85085260899&doi=10.3390%2fRS12081251&partnerID=40&md5=ff7196697e8d2f7ddc0ae4ae192f9738","Earth observation offers a variety of techniques for monitoring and characterizing geomorphic processes in high mountain environments. Terrestrial laserscanning and unmanned aerial vehicles provide very high resolution data with high accuracy. Automatic cameras have become a valuable source of information-mostly in a qualitative manner-in recent years. The availability of satellite data with very high revisiting time has gained momentum through the European Space Agency's Sentinel missions, offering new application potential for Earth observation. This paper reviews the status of recent techniques such as terrestrial laserscanning, remote sensed imagery, and synthetic aperture radar in monitoring high mountain environments with a particular focus on the impact of new platforms such as Sentinel-1 and-2 as well as unmanned aerial vehicles. The study area comprises the high mountain glacial environment at the Pasterze Glacier, Austria. The area is characterized by a highly dynamic geomorphological evolution and by being subject to intensive scientific research as well as long-term monitoring. We primarily evaluate landform classification and process characterization for: (i) the proglacial lake; (ii) icebergs; (iii) the glacier river; (iv) valley-bottom processes; (v) slope processes; and (vi) rock wall processes. We focus on assessing the potential of every single method both in spatial and temporal resolution in characterizing different geomorphic processes. Examples of the individual techniques are evaluated qualitatively and quantitatively in the context of: (i) morphometric analysis; (ii) applicability in high alpine regions; and (iii) comparability of the methods among themselves. The final frame of this article includes considerations on scale dependent process detectability and characterization potentials of these Earth observation methods, along with strengths and limitations in applying these methods in high alpine regions. © 2020 by the authors. Licensee MDPI, Basel, Switzerland.","Antennas; Earth (planet); Observatories; Patient monitoring; Remote sensing; Sea ice; Space applications; Space-based radar; Synthetic aperture radar; Unmanned aerial vehicles (UAV); Earth observation techniques; Geomorphological evolution; Landform classification; Process characterization; Remote sensed imagery; Spatial and temporal resolutions; Terrestrial laser scanning; Very high resolution datum; Landforms","Cryosphere; Glacier lake evolution; Glacier river; Laserscanning; Multi-spectral satellite data; Rock fall; Slope processes; Synthetic aperture radar; UAV-structure from motion","Article","Final","All Open Access; Gold Open Access","Scopus","2-s2.0-85085260899"
"Tao Y.; Xiong S.; Song R.; Muller J.-P.","Tao, Yu (56539197700); Xiong, Siting (56009476000); Song, Rui (57215778562); Muller, Jan-Peter (7404871794)","56539197700; 56009476000; 57215778562; 7404871794","Towards streamlined single-image super-resolution: Demonstration with 10 m sentinel-2 colour and 10–60 m multi-spectral vnir and swir bands","2021","Remote Sensing","13","13","2614","","","","10.3390/rs13132614","4","https://www.scopus.com/inward/record.uri?eid=2-s2.0-85110158244&doi=10.3390%2frs13132614&partnerID=40&md5=6db3aca28506cea46448cf9d7df79a45","Higher spatial resolution imaging data are considered desirable in many Earth observation applications. In this work, we propose and demonstrate the TARSGAN (learning Terrestrial image deblurring using Adaptive weighted dense Residual Super-resolution Generative Adversarial Net-work) system for Super-resolution Restoration (SRR) of 10 m/pixel Sentinel-2 “true” colour images as well as all the other multispectral bands. In parallel, the ELF (automated image Edge detection and measurements of edge spread function, Line spread function, and Full width at half maximum) system is proposed to achieve automated and precise assessments of the effective resolutions of the input and SRR images. Subsequent ELF measurements of the TARSGAN SRR results suggest an averaged effective resolution enhancement factor of about 2.91 times (equivalent to ~3.44 m/pixel for the 10 m/pixel bands) given a nominal SRR upscaling factor of 4 times. Several examples are provided for different types of scenes from urban landscapes to agricultural scenes and sea-ice floes. © 2021 by the authors. Licensee MDPI, Basel, Switzerland.","Agricultural robots; Display devices; Edge detection; Optical resolving power; Sea ice; Earth observations; Edge spread function; Effective resolutions; ELF measurements; Image edge detection; Line spread functions; Spatial resolution; Super-resolution restoration; Image enhancement","Effective resolution assessment; Image quality; Multispectral; Sentinel; Sentinel-2; Sharpness; SR; SRR; Super-resolution restoration","Article","Final","All Open Access; Gold Open Access; Green Open Access","Scopus","2-s2.0-85110158244"
