"Authors","Author full names","Author(s) ID","Titles","Year","Source title","Volume","Issue","Art. No.","Page start","Page end","Page count","DOI","Cited by","Link","Abstract","Indexed Keywords","Author Keywords","Document Type","Publication Stage","Open Access","Source","EID"
"Veremeeva A.; Nitze I.; Günther F.; Grosse G.; Rivkina E.","Veremeeva, Alexandra (35192586200); Nitze, Ingmar (56224472600); Günther, Frank (36632093600); Grosse, Guido (7101977707); Rivkina, Elizaveta (6602942286)","35192586200; 56224472600; 36632093600; 7101977707; 6602942286","Geomorphological and climatic drivers of thermokarst lake area increase trend (1999–2018) in the kolyma lowland yedoma region, north‐eastern siberia","2021","Remote Sensing","13","2","178","1","31","30","10.3390/rs13020178","23","https://www.scopus.com/inward/record.uri?eid=2-s2.0-85099222916&doi=10.3390%2frs13020178&partnerID=40&md5=bf6f78c74a49f6bf00d5549f9ec11800","Thermokarst lakes are widespread in Arctic lowlands. Under a warming climate, landscapes with highly ice‐rich Yedoma Ice Complex (IC) deposits are particularly vulnerable, and thermokarst lake area dynamics serve as an indicator for their response to climate change. We conducted lake change trend analysis for a 44,500 km2 region of the Kolyma Lowland using Landsat imagery in conjunction with TanDEM‐X digital elevation model and Quaternary Geology map data. We delineated yedoma–alas relief types with different yedoma fractions, serving as a base for geospatial analysis of lake area dynamics. We quantified lake changes over the 1999–2018 period using machine‐learning‐based classification of robust trends of multi‐spectral indices of Landsat data and object‐based long‐term lake detection. We analyzed the lake area dynamics sep-arately for 1999–2013 and 1999–2018 periods, including the most recent five years that were char-acterized by very high precipitation. Comparison of drained lake basin area with thermokarst lake extents reveal the overall limnicity decrease by 80% during the Holocene. Current climate warming and wetting in the region led to a lake area increase by 0.89% for the 1999–2013 period and an increase by 4.15% for the 1999–2018 period. We analyzed geomorphological factors impacting modern lake area changes for both periods such as lake size, elevation, and yedoma–alas relief type. We detected a lake area expansion trend in high yedoma fraction areas indicating ongoing Yedoma IC degradation by lake thermokarst. Our concept of differentiating yedoma–alas relief types helps to characterize landscape‐scale lake area changes and could potentially be applied for refined assessments of greenhouse gas emissions in Yedoma regions. Comprehensive geomor-phological inventories of Yedoma regions using geospatial data provide a better understanding of the extent of thermokarst processes during the Holocene and the pre‐conditioning of modern thermokarst lake area dynamics. © 2021 by the authors. Licensee MDPI, Basel, Switzerland.","Climate change; Dynamics; Gas emissions; Greenhouse gases; Petroleum refining; Climatic drivers; Digital elevation model; Geo-spatial analysis; Geo-spatial data; Landsat imagery; Quaternary geologies; Spectral indices; Thermokarst lakes; Lakes","Ice‐rich permafrost; Kolyma Lowland; Lake drainage; Lake dynamics; Landsat‐based trend analysis; Periglacial geomorphology; Siberia; Thermokarst; Thermokarst lakes; Yedoma Ice Complex","Article","Final","All Open Access; Gold Open Access; Green Open Access","Scopus","2-s2.0-85099222916"
"Keeney J.; Hickey R.","Keeney, Joseph (56681901000); Hickey, Robert (7101900159)","56681901000; 7101900159","Using satellite image analysis for locating prehistoric archaeological sites in Alaska's Central Brooks Range","2015","Journal of Archaeological Science: Reports","3","","","80","89","9","10.1016/j.jasrep.2015.05.022","16","https://www.scopus.com/inward/record.uri?eid=2-s2.0-84930960342&doi=10.1016%2fj.jasrep.2015.05.022&partnerID=40&md5=0f47d16e513bd36297e3756d57900631","In this pilot study, we apply satellite image analysis to archaeological site prospection in Alaska's Brooks Range. Our goal was to test whether satellite remote sensing, which has been successful in locating large archaeological features associated with sedentary peoples, could be applied to arctic interior sites associated with mobile hunter-gatherers. In particular, we strove to develop a relatively straightforward and inexpensive model using existing data which could be used to help guide archaeology surveys. Using 1-m resolution IKONOS imagery of Lake Matcharak along the upper Noatak River, we produced a Normalized Difference Vegetation Index (NDVI) and tasseled cap transformation of the study area and stacked these five vegetation indices into one image. We then applied unsupervised and supervised classifications to the image first, to test for the presence of a site-specific spectral class and second, determine the nature of that class. Through a visual analysis of the unsupervised classification, a spectral phenomenon was seen to co-occur with archaeological sites in the study area. The supervised classification provided a high-resolution land cover map used to identify the signature as the ecotone between un-vegetated sediments and dense willow (Salix sp.) stands. Dense willow stands along the Lake Matcharak shore visually correlate with most of the known archaeological sites, possibly reflecting landform and/or vegetation characteristics that would have appealed to past inhabitants. The methods described here could contribute to building better survey strategies and archaeological predictive models for elsewhere in the Brooks Range and Alaska. © 2015.","","Alaska; Archaeology; Arctic; Hunter-gatherers; Multi-spectral analysis; Prehistoric sites; Satellite imagery; Site prospection; Site reconnaissance","Article","Final","All Open Access; Green Open Access","Scopus","2-s2.0-84930960342"
"Buschkamp P.; Gulde S.; Bewick C.; Tully Peacocke P.; Sandri P.; Te Hennepe F.","Buschkamp, Peter (24281008200); Gulde, Stephan (6602795607); Bewick, Charlotte (56082767000); Tully Peacocke, Patrick (57211107223); Sandri, Paolo (6603597012); Te Hennepe, Frank (36118293900)","24281008200; 6602795607; 56082767000; 57211107223; 6603597012; 36118293900","Design study of a hosted arctic imager for weather and climate monitoring in the polar regions","2018","Proceedings of SPIE - The International Society for Optical Engineering","11180","","111804W","","","","10.1117/12.2536095","1","https://www.scopus.com/inward/record.uri?eid=2-s2.0-85072674678&doi=10.1117%2f12.2536095&partnerID=40&md5=f9079c101b0e89baad21f6adcb3ab64b","A Hosted Arctic Imager (HAI) concept is currently being investigated as part of ESA's Polaris program. HAI intends to fulfil the needs for providing weather and atmospheric services in the polar regions enabling e.g. near-real-time observations of Atmospheric Motion Vectors of the Arctic and Nordic regions, similar to the measurements offered by its Meteosat counterparts in GEO, such as SEVIRI on MSG and FCI on MTG. The compact hosted-payload multispectral imager operates from a High Elliptical Orbit in 12 spectral bands from 0.4μm to 13.3μm at a Ground Sampling Distance of 1-3km. The optical concepts employs a split design into a wavelength-optimized VIS and a (N)IR telescope, built as all-metal free-form optics, where a hole in the first mirror of the (N)IR telescope presents the entrance aperture of the VIS telescope. Our instrument design maximizes the re-use of heritage technology, e.g. for detectors, scanner, and calibration elements, in order to enable a low-risk fast-track development program. © COPYRIGHT SPIE.","Computer software reusability; Spectroscopy; Atmospheric monitoring; Atmospheric motion vectors; Entrance apertures; Freeform optics; Ground sampling distances; Instrument designs; Metal optics; Multi spectral imager; Telescopes","Atmospheric monitoring; Free-form optics; Metal optics; Multi-spectral imager","Conference paper","Final","All Open Access; Bronze Open Access","Scopus","2-s2.0-85072674678"
"Bartsch A.; Widhalm B.; Leibman M.; Ermokhina K.; Kumpula T.; Skarin A.; Wilcox E.J.; Jones B.M.; Frost G.V.; Höfler A.; Pointner G.","Bartsch, Annett (8709691100); Widhalm, Barbara (6506176864); Leibman, Marina (6602909851); Ermokhina, Ksenia (55453883200); Kumpula, Timo (57222997904); Skarin, Anna (24171972900); Wilcox, Evan J. (57198863740); Jones, Benjamin M. (16636910800); Frost, Gerald V. (54395292900); Höfler, Angelika (57192269268); Pointner, Georg (57194632496)","8709691100; 6506176864; 6602909851; 55453883200; 57222997904; 24171972900; 57198863740; 16636910800; 54395292900; 57192269268; 57194632496","Feasibility of tundra vegetation height retrieval from Sentinel-1 and Sentinel-2 data","2020","Remote Sensing of Environment","237","","111515","","","","10.1016/j.rse.2019.111515","33","https://www.scopus.com/inward/record.uri?eid=2-s2.0-85076042309&doi=10.1016%2fj.rse.2019.111515&partnerID=40&md5=179f8cf80216b767e382a5d82d6612a7","The quantification of vegetation height for the circumpolar Arctic tundra biome is of interest for a wide range of applications, including biomass and habitat studies as well as permafrost modelling in the context of climate change. To date, only indices from multispectral data have been used in these environments to address biomass and vegetation changes over time. The retrieval of vegetation height itself has not been attempted so far over larger areas. Synthetic Aperture Radar (SAR) holds promise for canopy modeling over large extents, but the high variability of near-surface soil moisture during the snow-free season is a major challenge for application of SAR in tundra for such a purpose. We hypothesized that tundra vegetation height can be derived from multispectral indices as well as from C-band SAR data acquired in winter (close to zero liquid water content). To test our hypothesis, we used C-band SAR data from Sentinel-1 and multi-spectral data from Sentinel-2. Results show that vegetation height can be derived with an RMSE of 44 cm from Normalized Difference Vegetation Index (NDVI) and 54 cm from Tasseled Cap Wetness index (TC). Retrieval from C-band SAR shows similar performance, but C-VV is more suitable than C-HH to derive vegetation height (RMSEs of 48 and 56 cm respectively). An exponential relationship with in situ height was evident for all tested parameters (NDVI, TC, C-VV and C-HH) suggesting that the C-band SAR and multi-spectral approaches possess similar capabilities including tundra biomass retrieval. Errors might occur in specific settings as a result of high surface roughness, high photosynthetic activity in wetlands or high snow density. We therefore introduce a method for combined use of Sentinel-1 and Sentinel-2 to address the ambiguities related to Arctic wetlands and barren rockfields. Snow-related deviations occur within tundra fire scars in permafrost areas in the case of C-VV use. The impact decreases with age of the fire scar, following permafrost and vegetation recovery. The evaluation of masked C-VV retrievals across different regions, tundra types and sources (in situ and circumpolar vegetation community classification from satellite data) suggests pan-Arctic applicability to map current conditions for heights up to 160 cm. The presented methodology will allow for new applications and provide advanced insight into changing environmental conditions in the Arctic. © 2019 The Authors","Arctic; Biomass; Climate change; Forestry; Permafrost; Radar; Snow; Soil moisture; Surface roughness; Synthetic aperture radar; Wetlands; Environmental conditions; Multispectral indices; Normalized difference vegetation index; Optical; Photosynthetic activity; Shrubs; Tasseled cap wetness; Tundra; biomass; climate change; environmental conditions; feasibility study; NDVI; permafrost; satellite data; Sentinel; shrub; soil moisture; soil-vegetation interaction; synthetic aperture radar; tundra; vegetation type; Vegetation","Optical; Radar; Shrubs; Tundra; Vegetation","Article","Final","All Open Access; Green Open Access; Hybrid Gold Open Access","Scopus","2-s2.0-85076042309"
"Bartsch A.; Pointner G.; Ingeman-Nielsen T.; Lu W.","Bartsch, Annett (8709691100); Pointner, Georg (57194632496); Ingeman-Nielsen, Thomas (14068804900); Lu, Wenjun (55861171800)","8709691100; 57194632496; 14068804900; 55861171800","Towards circumpolar mapping of arctic settlements and infrastructure based on sentinel-1 and sentinel-2","2020","Remote Sensing","12","15","2368","","","","10.3390/RS12152368","18","https://www.scopus.com/inward/record.uri?eid=2-s2.0-85089689584&doi=10.3390%2fRS12152368&partnerID=40&md5=a2161703fedbc180bd50f80e104f04ee","Infrastructure expands rapidly in the Arctic due to industrial development. At the same time, climate change impacts are pronounced in the Arctic. Ground temperatures are, for example, increasing as well as coastal erosion. A consistent account of the current human footprint is needed in order to evaluate the impact on the environments as well as risk for infrastructure. Identification of roads and settlements with satellite data is challenging due to the size of single features and low density of clusters. Spatial resolution and spectral characteristics of satellite data are the main issues regarding their separation. The Copernicus Sentinel-1 and-2 missions recently provided good spatial coverage and at the same time comparably high pixel spacing starting with 10 m for modes available across the entire Arctic. The purpose of this study was to assess the capabilities of both, Sentinel-1 C-band Synthetic Aperture Radar (SAR) and the Sentinel-2 multispectral information for Arctic focused mapping. Settings differ across the Arctic (historic settlements versus industrial, locations on bedrock versus tundra landscapes) and reference data are scarce and inconsistent. The type of features and data scarcity demand specific classification approaches. The machine learning approaches Gradient Boosting Machines (GBM) and deep learning (DL)-based semantic segmentation have been tested. Records for the Alaskan North Slope, Western Greenland, and Svalbard in addition to high-resolution satellite data have been used for validation and calibration. Deep learning is superior to GBM with respect to users accuracy. GBM therefore requires comprehensive postprocessing. SAR provides added value in case of GBM. VV is of benefit for road identification and HH for detection of buildings. Unfortunately, the Sentinel-1 acquisition strategy is varying across the Arctic. The majority is covered in VV+VH only. DL is of benefit for road and building detection but misses large proportions of other human-impacted areas, such as gravel pads which are typical for gas and oil fields. A combination of results from both GBM (Sentinel-1 and-2 combined) and DL (Sentinel-2; Sentinel-1 optional) is therefore suggested for circumpolar mapping. © 2020 by the authors.","Adaptive boosting; Climate change; Deep learning; Mapping; Oil fields; Roads and streets; Satellites; Semantics; Space-based radar; Synthetic aperture radar; Acquisition strategies; Classification approach; High resolution satellite data; Impact on the environment; Industrial development; Machine learning approaches; Semantic segmentation; Spectral characteristics; Classification (of information)","Arctic; Infrastructure; Machine learning; Multi-spectral; SAR; Settlements","Article","Final","All Open Access; Gold Open Access; Green Open Access","Scopus","2-s2.0-85089689584"
"Freitas P.; Vieira G.; Canário J.; Folhas D.; Vincent W.F.","Freitas, Pedro (57209306615); Vieira, Gonçalo (7005863976); Canário, João (6602689212); Folhas, Diogo (57209311254); Vincent, Warwick F. (57203324223)","57209306615; 7005863976; 6602689212; 57209311254; 57203324223","Identification of a threshold minimum area for reflectance retrieval from thermokarst lakes and ponds using full-pixel data from Sentinel-2","2019","Remote Sensing","11","6","657","","","","10.3390/rs11060657","10","https://www.scopus.com/inward/record.uri?eid=2-s2.0-85065042534&doi=10.3390%2frs11060657&partnerID=40&md5=43bdbd6a48d4f725565c0e13fbbaec9e","Thermokarst waterbodies caused by permafrost thawing and degradation are ubiquitous in many subarctic and Arctic regions. They are globally important components of the biogeochemical carbon cycle and have potential feedback effects on climate. These northern waters are mostly small lakes and ponds, and although they may be mapped using very high-resolution satellites or aerial photography, these approaches are generally not suitable for monitoring purposes, due to the cost and limited availability of such images. In this study we evaluated the potential use of widely available high-resolution imagery from Sentinel-2 (S2) for the characterization of the spectral reflectance of thermokarst lakes and ponds. Specifically, we aimed to define the minimum lake area that could be reliably imaged, and to identify challenges and solutions for remote sensing of such waters in the future. The study was conducted in subarctic Canada, in the vicinity of Whapmagoostui-Kuujjuarapik (Nunavik, Québec), an area in the sporadic permafrost zone with numerous thermokarst waterbodies that vary greatly in size. Ground truthing lake reflectance data were collected using an Unmanned Aerial System (UAS) fitted with a multispectral camera that collected images at 13 cm resolution. The results were compared with reflectance from Sentinel-2 images, and the effect of lake area on the reflectance response was assessed. Our results show that Sentinel-2 imagery was suitable for waterbodies larger than 350 m2 once their boundaries were defined, which in the two test sites would allow monitoring from 11% to 30% of the waterbodies and 73% to 85% of the total lake area. Challenges for remote sensing of small lakes include the confounding effects of water reflection (both direct radiation and diffuse), wind and shadow. Given the small threshold area and frequent revisit time, Sentinel-2 provides a valuable approach towards the continuous monitoring of waterbodies, including ponds and small lakes such as those found in thermokarst landscapes. UASs provide a complementary approach for ground truthing and boundary definition. © 2019 by the authors.","Aerial photography; Antennas; Permafrost; Ponding; Ponds; Radiation effects; Reflection; Remote sensing; Satellites; Small satellites; Continuous monitoring; High resolution imagery; Multi-spectral cameras; Sentinel-2; Spectral reflectances; Subarctic; Unmanned aerial systems; Very high resolution; Lakes","Lakes; Permafrost; Ponds; Reflectance; Satellite; Sentinel-2; Subarctic; Unmanned Aerial Systems","Article","Final","All Open Access; Gold Open Access; Green Open Access","Scopus","2-s2.0-85065042534"
"Spasova T.; Nedkov R.; Dancheva A.; Stoyanov A.; Ivanova I.; Georgiev N.","Spasova, Temenuzhka (57211430744); Nedkov, Roumen (57204958301); Dancheva, Adlin (57204632209); Stoyanov, Andrey (24765749200); Ivanova, Iva (57198062540); Georgiev, Nikolay (57211428499)","57211430744; 57204958301; 57204632209; 24765749200; 57198062540; 57211428499","Seasonal assessment of the dynamics of sea ice based on aerospace data on Livingston Island, New Shetland Islands in Antarctica and Longyearbyen in the Arctic","2020","Proceedings of SPIE - The International Society for Optical Engineering","11524","","115240J","","","","10.1117/12.2570829","1","https://www.scopus.com/inward/record.uri?eid=2-s2.0-85091226958&doi=10.1117%2f12.2570829&partnerID=40&md5=d6c23f6ceeea9afec269d713e00cd3e8","Sea ice plays a major role in our planet's climate. It' acts as a reflector of solar energy, mainly in spring and summer. Sea ice covered with fresh snow can reflect 75-90% of solar energy, the open sea reflects just 5-15%. Sea ice acts as an insulator in autumn and winter. This insulating effect limits the amount of both heat and moisture the ocean loses to the atmosphere. The declining sea ice disrupts the climate, societies and fauna of Polar areas, but encourages the econcmic and industrial development. The relevance of this study is related to current trends in the use of remote sensing in solving problems of a different nature in environmental monitoring. The sea ice was analyzed and mapped according to the European Space Agency data (ESA), acquired by sensors of Sentinel-1 SAR (Synthetic Aperture Radar), Sentinel-2MSI (Multi Spectral Instrument), Sentinel-3 and GIS. The subject of the study is to demonstrate the dynamics, during the summer season from 2015 to 2019, around the coastline of Livingston Island, New Shetland Islands in Antarctica and Longyearbyen in the Arctic. Changes in environmental objects are indicated by radar images through different processing approaches. The results clearly show that sea ice melting can be best recorded by using SAR data through the C-band. The results obtained are data in the form of thematic maps showing the spatial reflectance of sea ice and its dynamics over time.  © 2020 SPIE.","Dynamics; Insulator contamination; Maps; Reflection; Sea ice; Solar energy; Space optics; Synthetic aperture radar; Environmental Monitoring; Environmental objects; European Space Agency; Industrial development; Processing approach; SAR(synthetic aperture radar); Sea ice melting; Shetland islands; Remote sensing","Optical data; SAR data; Sea ice; Sentinel 2-MSI; Sentinel-1 SAR","Conference paper","Final","","Scopus","2-s2.0-85091226958"
