"Authors","Author full names","Author(s) ID","Titles","Year","Source title","Volume","Issue","Art. No.","Page start","Page end","Page count","DOI","Cited by","Link","Abstract","Indexed Keywords","Author Keywords","Document Type","Publication Stage","Open Access","Source","EID"
"Bartsch A.; Pointner G.; Nitze I.; Efimova A.; Jakober D.; Ley S.; Högström E.; Grosse G.; Schweitzer P.","Bartsch, Annett (8709691100); Pointner, Georg (57194632496); Nitze, Ingmar (56224472600); Efimova, Aleksandra (57351162000); Jakober, Dan (57350584400); Ley, Sarah (57219172566); Högström, Elin (56372298800); Grosse, Guido (7101977707); Schweitzer, Peter (7102806020)","8709691100; 57194632496; 56224472600; 57351162000; 57350584400; 57219172566; 56372298800; 7101977707; 7102806020","Expanding infrastructure and growing anthropogenic impacts along Arctic coasts","2021","Environmental Research Letters","16","11","115013","","","","10.1088/1748-9326/ac3176","11","https://www.scopus.com/inward/record.uri?eid=2-s2.0-85119686313&doi=10.1088%2f1748-9326%2fac3176&partnerID=40&md5=9574d2dc91df81b720a70044f074ad49","The accelerating climatic changes and new infrastructure development across the Arctic require more robust risk and environmental assessment, but thus far there is no consistent record of human impact. We provide a first panarctic satellite-based record of expanding infrastructure and anthropogenic impacts along all permafrost affected coasts (100 km buffer, ≈6.2 Mio km2), named the Sentinel-1/2 derived Arctic Coastal Human Impact (SACHI) dataset. The completeness and thematic content goes beyond traditional satellite based approaches as well as other publicly accessible data sources. Three classes are considered: linear transport infrastructure (roads and railways), buildings, and other impacted area. C-band synthetic aperture radar and multi-spectral information (2016-2020) is exploited within a machine learning framework (gradient boosting machines and deep learning) and combined for retrieval with 10 m nominal resolution. In total, an area of 1243 km2 constitutes human-built infrastructure as of 2016-2020. Depending on region, SACHI contains 8%-48% more information (human presence) than in OpenStreetMap. 221 (78%) more settlements are identified than in a recently published dataset for this region. 47% is not covered in a global night-time light dataset from 2016. At least 15% (180 km2) correspond to new or increased detectable human impact since 2000 according to a Landsat-based normalized difference vegetation index trend comparison within the analysis extent. Most of the expanded presence occurred in Russia, but also some in Canada and US. 31% and 5% of impacted area associated predominantly with oil/gas and mining industry respectively has appeared after 2000. 55% of the identified human impacted area will be shifting to above 0 °C ground temperature at two meter depth by 2050 if current permafrost warming trends continue at the pace of the last two decades, highlighting the critical importance to better understand how much and where Arctic infrastructure may become threatened by permafrost thaw.  © 2021 The Author(s).","Arctic; Adaptive boosting; Deep learning; Permafrost; Risk assessment; Synthetic aperture radar; Anthropogenic impacts; Arctic; Climatic changes; Human impact; Infrastructure; New infrastructure development; Remote-sensing; Sentinel; Sentinel-1; Settlement; anthropogenic effect; climate change; data set; infrastructure; permafrost; Remote sensing","Arctic; Infrastructure; Machine learning; Permafrost; Remote sensing; Sentinel; Settlements","Article","Final","All Open Access; Gold Open Access; Green Open Access","Scopus","2-s2.0-85119686313"
"Te Hennepe F.; Bewick C.; Gulde S.; Peacocke P.T.","Te Hennepe, Frank (36118293900); Bewick, Charlotte (56082767000); Gulde, Stephan (6602795607); Peacocke, Patrick Tully (56646621100)","36118293900; 56082767000; 6602795607; 56646621100","Weather and climate monitoring in the arctic regions","2017","Proceedings of the International Astronautical Congress, IAC","7","","","4407","4416","9","","0","https://www.scopus.com/inward/record.uri?eid=2-s2.0-85051422500&partnerID=40&md5=f9e389106e7377385b742dcd63d54568","In recent years, the interest in the Arctic regions by various stakeholders has steadily increased with the use of economic, political, military and scientific arguments. Availability of additional shipping routes, the presence of productive fishing grounds and innovative means for resource extraction have resulted in an increased human presence in the high Northern latitudes. Furthermore, the polar regions, and the Arctic in particular, are the fastest changing regions affected by climate change and play a leading role in the modelling of weather and climate change on global level. In spite of its important role, the Arctic and Nordic regions only receives limited satellite-based services. This can be partially explained by the challenging geometry experienced by typical GEO satellite missions, resulting in poor performance in the telecommunications, weather monitoring and navigation domains. This is a well-known problem for the Arctic and Nordic regions, which various spacefaring nations are looking to address. As part of its Arctic initiative, the European Space Agency (ESA) is currently considering potential synergetic missions aiming at providing telecommunications, navigation and weather monitoring services to the Arctic regions. One specific concept under investigation consists of a small two-spacecraft constellation, using a High Elliptical Orbit (HEO) at 63.4° inclination with a 16 hour orbital period as an effective method of providing around-the-clock coverage of the polar regions. For the weather and atmosphere monitoring part of the mission, a so-called Hosted Arctic Imager (HAI) concept is currently being investigated as part of ESA’s Polaris programme. HAI intends to fulfil the needs for providing weather and atmospheric services in the polar regions. These services consist of near-real-time observations of Atmospheric Motion Vectors of the Arctic and Nordic regions, similar to the measurements its Meteosat counterparts in GEO offer, such as SEVIRI on MSG and FCI on MTG, and several other data products derived from these missions for atmospheric monitoring. A number of studies have been performed under ESA contract investigating the feasibility, implementation scenarios and performance of the HAI. In this paper, the overall HAI concept as proposed by OHB System will be reported. For this purpose, an analysis of the mission needs and observational requirements and conditions for the HAI will be shown followed by a presentation of the identified challenges, candidate solutions and engineering results for the mission analysis and high-level instrument design. This discussion will be complemented with an outlook on the programmatics for the HAI resulting in a promising concept for weather and atmospheric observations in the Arctic regions. © 2018 International Astronautical Federation IAF. All rights reserved.","Meteorology; Monitoring; Orbits; Space flight; Spectroscopy; Arctic regions; Atmospheric monitoring; Atmospheric motion vectors; Atmospheric observations; Mission concepts; Multi spectral imager; Satellite-based services; Spacecraft constellations; Climate change","Arctic region; Atmospheric monitoring; Meteorology; Mission concept; Multi-spectral imager","Conference paper","Final","","Scopus","2-s2.0-85051422500"
"Soldal I.H.; Dierking W.; Korosov A.; Marino A.","Soldal, Ingri Halland (57208164449); Dierking, Wolfgang (55903760300); Korosov, Anton (6505884703); Marino, Armando (34881857900)","57208164449; 55903760300; 6505884703; 34881857900","Automatic detection of small icebergs in fast ice using satellite Wide-Swath SAR images","2019","Remote Sensing","11","7","806","","","","10.3390/rs11070806","14","https://www.scopus.com/inward/record.uri?eid=2-s2.0-85063990860&doi=10.3390%2frs11070806&partnerID=40&md5=fa240b22d09161c2ca86894621f5422f","Automatic detection of icebergs in satellite images is regarded a useful tool to provide information necessary for safety in Arctic shipping or operations over large ocean areas in near-real time. In this work, we investigated the feasibility of automatic iceberg detection in Sentinel-1 Extra Wide Swath (EWS) SAR images which follow the preferred image mode in operational ice charting. As test region, we selected the Barents Sea where the size of many icebergs is on the order of the spatial resolution of the EWS-mode. We tested a new approach for a detection scheme. It is based on a combination of a filter for enhancing the contrast between icebergs and background, subsequent blob detection, and final application of a Constant False Alarm Rate (CFAR) algorithm. The filter relies mainly on the HV-polarized intensity which often reveals a larger difference between icebergs and sea ice or open water. The blob detector identifies locations of potential icebergs and thus shortens computation time. The final detection is performed on the identified blobs using the CFAR algorithm. About 2000 icebergs captured in fast ice were visually identified in Sentinel-2 Multi Spectral Imager (MSI) data and exploited for an assessment of the detection scheme performance using confusion matrices. For our performance tests, we used four Sentinel-1 EWS images. For judging the effect of spatial resolution, we carried out an additional test with one Sentinel-1 InterferometricWide Swath (IWS) mode image. Our results show that only 8-22 percent of the icebergs could be detected in the EWS images, and over 90 percent of all detections were false alarms. In IWS mode, the number of correctly identified icebergs increased to 38 percent. However, we obtained a larger number of false alarms in the IWS image than in the corresponding EWS image. We identified two problems for iceberg detection: 1) with the given frequency-polarization combination, not all icebergs are strong scatterers at HV-polarization, and (2) icebergs and deformation structures present on fast ice can often not be distinguished since both may reveal equally strong responses at HV-polarization. © 2019 by the authors.","Alarm systems; Data visualization; Errors; Geometrical optics; Ice problems; Image resolution; Polarization; Sea ice; Small satellites; Space-based radar; Spectroscopy; Synthetic aperture radar; CFAR; Constant false alarm rate algorithms; Deformation structure; iDPolRAD; Multi spectral imager; Number of false alarms; Operational ice charting; Optical image; Radar imaging","CFAR; Iceberg detection; iDPolRAD; Optical images; SAR","Article","Final","All Open Access; Gold Open Access; Green Open Access","Scopus","2-s2.0-85063990860"
"Thomson E.R.; Spiegel M.P.; Althuizen I.H.J.; Bass P.; Chen S.; Chmurzynski A.; Halbritter A.H.; Henn J.J.; Jónsdóttir I.S.; Klanderud K.; Li Y.; Maitner B.S.; Michaletz S.T.; Niittynen P.; Roos R.E.; Telford R.J.; Enquist B.J.; Vandvik V.; Macias-Fauria M.; Malhi Y.","Thomson, Eleanor R. (57204395303); Spiegel, Marcus P. (57223373510); Althuizen, Inge H.J. (57132947200); Bass, Polly (57223373578); Chen, Shuli (57207735807); Chmurzynski, Adam (57223372215); Halbritter, Aud H. (55013397100); Henn, Jonathan J. (56450461300); Jónsdóttir, Ingibjörg S. (7005669499); Klanderud, Kari (8680008900); Li, Yaoqi (57190886162); Maitner, Brian S. (54395788800); Michaletz, Sean T. (12763166300); Niittynen, Pekka (57200081789); Roos, Ruben E. (57208326799); Telford, Richard J. (57218240195); Enquist, Brian J. (7004590620); Vandvik, Vigdis (6602749682); Macias-Fauria, Marc (54786710100); Malhi, Yadvinder (7004035832)","57204395303; 57223373510; 57132947200; 57223373578; 57207735807; 57223372215; 55013397100; 56450461300; 7005669499; 8680008900; 57190886162; 54395788800; 12763166300; 57200081789; 57208326799; 57218240195; 7004590620; 6602749682; 54786710100; 7004035832","Multiscale mapping of plant functional groups and plant traits in the High Arctic using field spectroscopy, UAV imagery and Sentinel-2A data","2021","Environmental Research Letters","16","5","055006","","","","10.1088/1748-9326/abf464","18","https://www.scopus.com/inward/record.uri?eid=2-s2.0-85105705765&doi=10.1088%2f1748-9326%2fabf464&partnerID=40&md5=a3faf34d99398626464a2e1e9a177620","The Arctic is warming twice as fast as the rest of the planet, leading to rapid changes in species composition and plant functional trait variation. Landscape-level maps of vegetation composition and trait distributions are required to expand spatially-limited plot studies, overcome sampling biases associated with the most accessible research areas, and create baselines from which to monitor environmental change. Unmanned aerial vehicles (UAVs) have emerged as a low-cost method to generate high-resolution imagery and bridge the gap between fine-scale field studies and lower resolution satellite analyses. Here we used field spectroscopy data (400-2500 nm) and UAV multispectral imagery to test spectral methods of species identification and plant water and chemistry retrieval near Longyearbyen, Svalbard. Using the field spectroscopy data and Random Forest analysis, we were able to distinguish eight common High Arctic plant tundra species with 74% accuracy. Using partial least squares regression (PLSR), we were able to predict corresponding water, nitrogen, phosphorus and C:N values (r 2 = 0.61-0.88, RMSEmean = 12%-64%). We developed analogous models using UAV imagery (five bands: Blue, Green, Red, Red Edge and Near-Infrared) and scaled up the results across a 450 m long nutrient gradient located underneath a seabird colony. At the UAV level, we were able to map three plant functional groups (mosses, graminoids and dwarf shrubs) at 72% accuracy and generate maps of plant chemistry. Our maps show a clear marine-derived fertility gradient, mediated by geomorphology. We used the UAV results to explore two methods of upscaling plant water content to the wider landscape using Sentinel-2A imagery. Our results are pertinent for high resolution, low-cost mapping of the Arctic. © 2021 The Author(s). Published by IOP Publishing Ltd.","Arctic; Longyearbyen; Spitsbergen; Svalbard; Svalbard and Jan Mayen; Bryophyta; Varanidae; Antennas; Arctic vehicles; Cost benefit analysis; Costs; Decision trees; Infrared devices; Least squares approximations; Mapping; Satellite imagery; Unmanned aerial vehicles (UAV); Environmental change; High resolution imagery; Multi-scale mappings; Multi-spectral imagery; Partial least squares regressions (PLSR); Plant functional groups; Species identification; Vegetation composition; environmental change; essential oil; mapping method; satellite data; satellite imagery; Sentinel; soil-vegetation interaction; spatiotemporal analysis; spectroscopy; tundra; unmanned vehicle; Plants (botany)","bird cliff; functional trait; moss; remote sensing; shrubs; Svalbard; tundra","Article","Final","All Open Access; Gold Open Access; Green Open Access","Scopus","2-s2.0-85105705765"
"Salehi S.; Mielke C.; Rogass C.","Salehi, Sara (57188725311); Mielke, Christian (56303868700); Rogass, Christian (36154813700)","57188725311; 56303868700; 36154813700","Mapping ultramafic complexes using airborne imaging spectroscopy and spaceborne data in Arctic regions with abundant lichen cover, a case study from the Niaqornarssuit complex in South West Greenland","2020","European Journal of Remote Sensing","53","1","","156","175","19","10.1080/22797254.2020.1760733","10","https://www.scopus.com/inward/record.uri?eid=2-s2.0-85087109481&doi=10.1080%2f22797254.2020.1760733&partnerID=40&md5=bec25fb646d03a6bcacd9cdfbc8eef34","This study investigates the usage of HyMAP airborne hyperspectral and Sentinel-2, ASTER and Landsat-8 OLI spaceborne multispectral data for detailed mapping of mineral resources in the Arctic. The EnMAP Geological Mapper (EnGeoMAP) and Iterative Spectral Mixture Analysis (ISMA) approaches are tested for mapping of mafic-ultramafic rocks in areas covered by abundant lichen. Using the Structural Similarity Index Measure (SSIM), the output classification results from airborne data are quantitatively compared to the available geological map and to the HyMAP reference data in case of using spaceborne dataset. Results demonstrate the capability of both airborne and spaceborne data to provide large-scale reconnaissance mapping of geologic materials over vast arctic regions where field access is limited. The distributions of three ultramafic units (dunite, peridotite, pyroxenite) and one mafic unit (gabbro) are mapped based on analyzing specific visible and near-infrared and short-wave-infrared spectral features. The extent of peridotite and dunite units mapped using both approaches is consistent with geological map, whereas pyroxenite abundance maps show different patterns in their distribution as compared to the geological map. The results suggest that EnGeoMAP method has a better performance than ISMA method for mapping the dunite unit, whilst ISMA performs better for mapping peridotite and pyroxenite rocks. © 2020, © 2020 The Author(s). Published by Informa UK Limited, trading as Taylor & Francis Group.","Arctic; Greenland; West Greenland; Classification (of information); Fungi; Geology; Infrared devices; Infrared radiation; Iterative methods; Mineral resources; Classification results; Geologic materials; Multi-spectral data; Short wave infrared; Spectral mixture analysis; Structural similarity index measures (SSIM); Ultramafic complex; Visible and near infrared; ASTER; data set; Landsat; lichen; mapping method; satellite data; spectroscopy; Photomapping","arctic; lichen; mineral mapping; non-invasive; Spectroscopy; ultramafic; unmixing","Review","Final","All Open Access; Gold Open Access; Green Open Access","Scopus","2-s2.0-85087109481"
"Santoro M.; Wegmüller U.; Lamarche C.; Bontemps S.; Defourny P.; Arino O.","Santoro, Maurizio (7201820022); Wegmüller, Urs (7005064554); Lamarche, Céline (56181338400); Bontemps, Sophie (24281070000); Defourny, Pierre (6603669676); Arino, Olivier (7006963419)","7201820022; 7005064554; 56181338400; 24281070000; 6603669676; 7006963419","Strengths and weaknesses of multi-year Envisat ASAR backscatter measurements to map permanent open water bodies at global scale","2015","Remote Sensing of Environment","171","","","185","201","16","10.1016/j.rse.2015.10.031","53","https://www.scopus.com/inward/record.uri?eid=2-s2.0-84946542137&doi=10.1016%2fj.rse.2015.10.031&partnerID=40&md5=44f6814afd98dec0c446ca3bcae50ae3","The mapping of water bodies at global scale has been undertaken primarily using multi-spectral optical Earth Observation data. Limitations of optical data associatedwith non-uniform and temporally variable spectral signatures suggested investigating alternative approaches towards a more consistent and reliable detection of water bodies. Multi-year (2005-2012) observations of SAR backscattered intensities at moderate resolution from the Envisat Advanced Synthetic Aperture Radar (ASAR) instrument were used in this study to generate an indicator of open permanent water bodies (SAR-WBI) for the year 2010 time frame and for all land surfaces excluding Antarctica and the Greenland ice sheet. A first map of potential water bodies with a spatial resolution of 150 m was obtained with a global detection algorithm based on a set of thresholds applied to multi-temporal metrics of the SAR backscatter (temporal variability, TV, and minimum backscatter, MB). Local refinements were then used to reduce systematic commission and omission errors (4.6% of the total area mapped) due to the similarity of TV and MB over open water bodies and other land surface types primarily in cold and arid environments. The refinement rules are here explained by means of a detailed signature analysis of the SAR backscatter in such environments. The accuracy of the SAR-WBIwas 80%when compared against 2078 manually interpreted footprints with a size of 150 × 150 m2. Omission errors were primarily observed along coast- and shorelines whereas commission errors were associated with (i) ephemeral water bodies, (ii) seasonally inundated areas, and (iii) an incorrect choice of the local refinement. © 2015 Elsevier Inc.","Antarctica; Arctic; Greenland; Greenland Ice Sheet; Backscattering; Errors; Photomapping; Surface measurement; Systematic errors; C-bands; ENVISAT ASAR; Land cover; SAR; Waterbodies; algorithm; backscatter; Envisat; ephemeral lake; error analysis; global change; land cover; map generalization; observational method; spectral analysis; synthetic aperture radar; temporal variation; Synthetic aperture radar","Backscatter; C-band; Envisat ASAR; Land cover; SAR; Water body","Article","Final","","Scopus","2-s2.0-84946542137"
"Bergstedt H.; Jones B.M.; Hinkel K.; Farquharson L.; Gaglioti B.V.; Parsekian A.D.; Kanevskiy M.; Ohara N.; Breen A.L.; Rangel R.C.; Grosse G.; Nitze I.","Bergstedt, Helena (57191264268); Jones, Benjamin M. (16636910800); Hinkel, Kenneth (7003687931); Farquharson, Louise (55048999100); Gaglioti, Benjamin V. (36143969000); Parsekian, Andrew D. (35799813500); Kanevskiy, Mikhail (12039350600); Ohara, Noriaki (10541064700); Breen, Amy L. (26530722800); Rangel, Rodrigo C. (57201025669); Grosse, Guido (7101977707); Nitze, Ingmar (56224472600)","57191264268; 16636910800; 7003687931; 55048999100; 36143969000; 35799813500; 12039350600; 10541064700; 26530722800; 57201025669; 7101977707; 56224472600","Remote sensing-based statistical approach for defining drained lake basins in a continuous Permafrost region, North Slope of Alaska","2021","Remote Sensing","13","13","2539","","","","10.3390/rs13132539","3","https://www.scopus.com/inward/record.uri?eid=2-s2.0-85109739145&doi=10.3390%2frs13132539&partnerID=40&md5=f8eee11d3649a6b48bb150c4cc92ae2a","Lake formation and drainage are pervasive phenomena in permafrost regions. Drained lake basins (DLBs) are often the most common landforms in lowland permafrost regions in the Arctic (50% to 75% of the landscape). However, detailed assessments of DLB distribution and abundance are limited. In this study, we present a novel and scalable remote sensing-based approach to identifying DLBs in lowland permafrost regions, using the North Slope of Alaska as a case study. We validated this first North Slope-wide DLB data product against several previously published sub-regional scale datasets and manually classified points. The study area covered >71,000 km2, including a >39,000 km2 area not previously covered in existing DLB datasets. Our approach used Landsat-8 multispectral imagery and ArcticDEM data to derive a pixel-by-pixel statistical assessment of likelihood of DLB occurrence in sub-regions with different permafrost and periglacial landscape conditions, as well as to quantify aerial coverage of DLBs on the North Slope of Alaska. The results were consistent with previously published regional DLB datasets (up to 87% agreement) and showed high agreement with manually classified random points (64.4–95.5% for DLB and 83.2– 95.4% for non-DLB areas). Validation of the remote sensing-based statistical approach on the North Slope of Alaska indicated that it may be possible to extend this methodology to conduct a comprehensive assessment of DLBs in pan-Arctic lowland permafrost regions. Better resolution of the spatial distribution of DLBs in lowland permafrost regions is important for quantitative studies on landscape diversity, wildlife habitat, permafrost, hydrology, geotechnical conditions, and high-lat-itude carbon cycling. © 2021 by the authors. Licensee MDPI, Basel, Switzerland.","Antennas; Lakes; Permafrost; Pixels; Population distribution; Comprehensive assessment; Geotechnical conditions; Landscape diversity; Multi-spectral imagery; North Slope of Alaska; Quantitative study; Statistical approach; Statistical assessment; Remote sensing","Alaska; Arctic; ArcticDEM; Drained Lake basins; Lake drainage; Lakes; Landsat; North Slope; Permafrost; Tasseled Cap; Thermokarst","Article","Final","All Open Access; Gold Open Access; Green Open Access","Scopus","2-s2.0-85109739145"
