"Authors","Author full names","Author(s) ID","Titles","Year","Source title","Volume","Issue","Art. No.","Page start","Page end","Page count","DOI","Cited by","Link","Abstract","Indexed Keywords","Author Keywords","Document Type","Publication Stage","Open Access","Source","EID"
"Jackisch R.; Heincke B.H.; Zimmermann R.; Sørensen E.V.; Pirttijärvi M.; Kirsch M.; Salmirinne H.; Lode S.; Kuronen U.; Gloaguen R.","Jackisch, Robert (57201284843); Heincke, Björn H. (12771032500); Zimmermann, Robert (57186194700); Sørensen, Erik V. (24482482000); Pirttijärvi, Markku (57610275700); Kirsch, Moritz (47461334700); Salmirinne, Heikki (6508105566); Lode, Stefanie (56879188100); Kuronen, Urpo (6508113577); Gloaguen, Richard (55949126400)","57201284843; 12771032500; 57186194700; 24482482000; 57610275700; 47461334700; 6508105566; 56879188100; 6508113577; 55949126400","Drone-based magnetic and multispectral surveys to develop a 3D model for mineral exploration at Qullissat, Disko Island, Greenland","2022","Solid Earth","13","4","","793","825","32","10.5194/se-13-793-2022","5","https://www.scopus.com/inward/record.uri?eid=2-s2.0-85128717368&doi=10.5194%2fse-13-793-2022&partnerID=40&md5=ed395af497e6483024808c91ee066104","Mineral exploration in the West Greenland flood basalt province is attractive because of its resemblance to the magmatic sulfide-rich deposit in the Russian Norilsk region, but it is challenged by rugged topography and partly poor exposure for relevant geologic formations. On northern Disko Island, previous exploration efforts have identified rare native iron occurrences and a high potential for Ni-Cu-Co-PGE-Au mineralization. However, Quaternary landslide activity has obliterated rock exposure in many places at lower elevations. To augment prospecting field work under these challenging conditions, we acquire high-resolution magnetic and multispectral remote sensing data using drones in the Qullissat area. From the data, we generate a detailed 3D model of a mineralized basalt unit, belonging to the Asuk Member of the Palaeocene Vaigat Formation. Different types of legacy data and newly acquired geo- and petrophysical as well as geochemical-mineralogical measurements form the basis of an integrated geological interpretation of the unoccupied aerial system (UAS) surveys. In this context, magnetic data aim to define the location and the shape of the buried magmatic body, and to estimate if its magnetic properties are indicative for mineralization. UAS-based multispectral orthomosaics are used to identify surficial iron staining, which serves as a proxy for outcropping sulfide mineralization. In addition, UAS-based digital surface models are created for geomorphological characterization of the landscape to accurately reveal landslide features. UAS-based magnetic data suggest that the targeted magmatic unit is characterized by a pattern of distinct positive and negative magnetic anomalies. We apply a 3D magnetization vector inversion (MVI) model to the UAS-based magnetic data to estimate the magnetic properties and shape of the magmatic body. By means of introducing constraints in the inversion, (1) UAS-based multispectral data and legacy drill cores are used to assign significant magnetic properties to areas that are associated with the mineralized Asuk Member, and (2) the Earth's magnetic and the palaeomagnetic field directions are used to evaluate the general magnetization direction in the magmatic units. Our results suggest that the geometry of the mineralized target can be estimated as a horizontal sheet of constant thickness, and that the magnetization of the unit has a strong remanent component formed during a period of Earth's magnetic field reversal. The magnetization values obtained in the MVI are in a similar range to the measured ones from a drillcore intersecting the targeted unit. Both the magnetics and topography confirm that parts of the target unit were displaced by landslides. We identified several fully detached and presumably rotated blocks in the obtained model. The model highlights magnetic anomalies that correspond to zones of mineralization and is used to identify outcrops for sampling. Our study demonstrates the potential and efficiency of using high-resolution UAS-based multi-sensor data to constrain the geometry of partially exposed geological units and assist exploration targeting in difficult or poorly exposed terrain. © 2022 Robert Jackisch et al.","Arctic; Disko Island; Greenland; 3D modeling; Antennas; Basalt; Deposits; Drones; Geomagnetism; Hematite; Iron; Landslides; Magnetic storage; Magnetic susceptibility; Magnetite; Magnetization; Magnetometers; Mineral exploration; Remote sensing; Sulfur compounds; Surveys; Topography; 3D models; 3d-modeling; Aerial systems; Green land; High resolution; Magnetic anomalies; Magnetic data; Magnetization vector; Mineralisation; Multi-spectral; airborne survey; data inversion; flood basalt; magnetic anomaly; magnetic survey; magnetization; mineral exploration; mineralization; ore deposit; remote sensing; source rock; spectral analysis; three-dimensional modeling; Mineralogy","","Article","Final","All Open Access; Gold Open Access; Green Open Access","Scopus","2-s2.0-85128717368"
"Siewert S.; Angoth V.; Krishnamurthy R.; Mani K.; Mock K.; Singh S.B.; Srivistava S.; Wagner C.; Claus R.; Vis M.D.","Siewert, Sam (57195443863); Angoth, Vivek (43660976300); Krishnamurthy, Ramnarayan (57191199882); Mani, Karthikeyan (57191203216); Mock, Kenrick (6603757736); Singh, Surjith B. (57191199476); Srivistava, Saurav (57191196417); Wagner, Chris (57225761574); Claus, Ryan (57191201053); Vis, Matthew Demi (57191205227)","57195443863; 43660976300; 57191199882; 57191203216; 6603757736; 57191199476; 57191196417; 57225761574; 57191201053; 57191205227","Software defined multi-spectral imaging for Arctic sensor networks","2016","Proceedings of SPIE - The International Society for Optical Engineering","9840","","98401V","","","","10.1117/12.2222966","2","https://www.scopus.com/inward/record.uri?eid=2-s2.0-84987892083&doi=10.1117%2f12.2222966&partnerID=40&md5=7c739a6288d8d6b0486586f919a3b9dd","Availability of off-the-shelf infrared sensors combined with high definition visible cameras has made possible the construction of a Software Defined Multi-Spectral Imager (SDMSI) combining long-wave, near-infrared and visible imaging. The SDMSI requires a real-time embedded processor to fuse images and to create real-time depth maps for opportunistic uplink in sensor networks. Researchers at Embry Riddle Aeronautical University working with University of Alaska Anchorage at the Arctic Domain Awareness Center and the University of Colorado Boulder have built several versions of a low-cost drop-in-place SDMSI to test alternatives for power efficient image fusion. The SDMSI is intended for use in field applications including marine security, search and rescue operations and environmental surveys in the Arctic region. Based on Arctic marine sensor network mission goals, the team has designed the SDMSI to include features to rank images based on saliency and to provide on camera fusion and depth mapping. A major challenge has been the design of the camera computing system to operate within a 10 to 20 Watt power budget. This paper presents a power analysis of three options: 1) multi-core, 2) field programmable gate array with multi-core, and 3) graphics processing units with multi-core. For each test, power consumed for common fusion workloads has been measured at a range of frame rates and resolutions. Detailed analyses from our power efficiency comparison for workloads specific to stereo depth mapping and sensor fusion are summarized. Preliminary mission feasibility results from testing with off-the-shelf long-wave infrared and visible cameras in Alaska and Arizona are also summarized to demonstrate the value of the SDMSI for applications such as ice tracking, ocean color, soil moisture, animal and marine vessel detection and tracking. The goal is to select the most power efficient solution for the SDMSI for use on UAVs (Unoccupied Aerial Vehicles) and other drop-in-place installations in the Arctic. The prototype selected will be field tested in Alaska in the summer of 2016. © 2016 SPIE.","Arctic vehicles; Budget control; Cameras; Computer graphics; Drops; Field programmable gate arrays (FPGA); Image fusion; Infrared detectors; Infrared devices; Infrared radiation; Logic gates; Mapping; Marine applications; Program processors; Reconfigurable hardware; Sensor networks; Soil moisture; Soil testing; Spectroscopy; Stereo vision; Arctic; Co-processors; Long wave infrared; Multi spectral imager; Near Infrared; Power efficient; Real time; Saliency; Sensor fusion; Stereo image processing","Arctic; Field programmable gate array; General purpose graphics coprocessor; Long-wave infrared; Multi-spectral imager; Near-infrared; Power efficient; Real-time; Saliency; Sensor fusion; Software defined; Stereo vision","Conference paper","Final","All Open Access; Green Open Access","Scopus","2-s2.0-84987892083"
"Juutinen S.; Virtanen T.; Kondratyev V.; Laurila T.; Linkosalmi M.; Mikola J.; Nyman J.; Räsänen A.; Tuovinen J.-P.; Aurela M.","Juutinen, Sari (35753675800); Virtanen, Tarmo (7007073838); Kondratyev, Vladimir (57093496500); Laurila, Tuomas (55682775100); Linkosalmi, Maiju (56709662000); Mikola, Juha (6603885561); Nyman, Johanna (55838213100); Räsänen, Aleksi (55913645800); Tuovinen, Juha-Pekka (57190943395); Aurela, Mika (6701461735)","35753675800; 7007073838; 57093496500; 55682775100; 56709662000; 6603885561; 55838213100; 55913645800; 57190943395; 6701461735","Spatial variation and seasonal dynamics of leaf-Area index in the arctic tundra-implications for linking ground observations and satellite images","2017","Environmental Research Letters","12","9","095002","","","","10.1088/1748-9326/aa7f85","31","https://www.scopus.com/inward/record.uri?eid=2-s2.0-85030764299&doi=10.1088%2f1748-9326%2faa7f85&partnerID=40&md5=84f4cb220081d41d9522bdf201e1c48f","Vegetation in the arctic tundra typically consists of a small-scale mosaic of plant communities, with species differing in growth forms, seasonality, and biogeochemical properties. Characterization of this variation is essential for understanding and modeling the functioning of the arctic tundra in global carbon cycling, as well as for evaluating the resolution requirements for remote sensing. Our objective was to quantify the seasonal development of the leaf-Area index (LAI) and its variation among plant communities in the arctic tundra near Tiksi, coastal Siberia, consisting of graminoid, dwarf shrub, moss, and lichen vegetation. We measured the LAI in the field and used two very-high-spatial resolution multispectral satellite images (QuickBird and WorldView-2), acquired at different phenological stages, to predict landscape-scale patterns. We used the empirical relationships between the plant community-specific LAI and degree-day accumulation (0 °C threshold) and quantified the relationship between the LAI and satellite NDVI (normalized difference vegetation index). Due to the temporal difference between the field data and satellite images, the LAI was approximated for the imagery dates, using the empirical model. LAI explained variation in the NDVI values well (R 2 adj. 0.42-0.92). Of the plant functional types, the graminoid LAI showed the largest seasonal amplitudes and was the main cause of the varying spatial patterns of the NDVI and the related LAI between the two images. Our results illustrate how the short growing season, rapid development of the LAI, yearly climatic variation, and timing of the satellite data should be accounted for in matching imagery and field verification data in the Arctic region. © 2017 IOP Publishing Ltd.","Russian Federation; Sakha; Siberia; Tiksi; Bryophyta; Biogeochemistry; Carbon; Landforms; Plants (botany); Remote sensing; Satellites; Vegetation; Arctic; Biogeochemical property; Empirical relationships; Multi-spectral; Multispectral satellite image; Normalized difference vegetation index; Very high spatial resolutions; VHSR; arctic environment; carbon cycle; ground-based measurement; growing season; leaf area index; NDVI; phenology; plant community; QuickBird; remote sensing; satellite imagery; seasonal variation; spatial variation; spectral analysis; spectral resolution; tundra; vegetation dynamics; WorldView; Satellite imagery","Arctic; LAI; Multispectral; Vegetation; VHSR","Article","Final","All Open Access; Gold Open Access; Green Open Access","Scopus","2-s2.0-85030764299"
"Asim M.; Brekke C.; Mahmood A.; Eltoft T.; Reigstad M.","Asim, Muhammad (57202431574); Brekke, Camilla (8986983600); Mahmood, Arif (55636036300); Eltoft, Torbjorn (35585249500); Reigstad, Marit (6603616730)","57202431574; 8986983600; 55636036300; 35585249500; 6603616730","Improving Chlorophyll-A Estimation from Sentinel-2 (MSI) in the Barents Sea Using Machine Learning","2021","IEEE Journal of Selected Topics in Applied Earth Observations and Remote Sensing","14","","9411655","5529","5549","20","10.1109/JSTARS.2021.3074975","8","https://www.scopus.com/inward/record.uri?eid=2-s2.0-85104634963&doi=10.1109%2fJSTARS.2021.3074975&partnerID=40&md5=2fa0e27ef4bd8971dd91d5586526d278","This article addresses methodologies for remote sensing of ocean Chlorophyll-a (Chl-a), with emphasis on the Barents Sea. We aim at improving the monitoring capacity by integrating in situ Chl-a observations and optical remote sensing to locally train machine learning (ML) models. For this purpose, in situ measurements of Chl-a ranging from 0.014-10.81 mg/m^{3}, collected for the years 2016-2018, were used to train and validate models. To accurately estimate Chl-a, we propose to use additional information on pigment content within the productive column by matching the depth-integrated Chl-a concentrations with the satellite data. Using the optical images captured by the multispectral imager instrument on Sentinel-2 and the in situ measurements, a new spatial window-based match-up dataset creation method is proposed to increase the number of match-ups and hence improve the training of the ML models. The match-ups are then filtered to eliminate erroneous samples based on the spectral distribution of the remotely sensed reflectance. In addition, we design and implement a neural network model dubbed as the ocean color net (OCN), that has performed better than existing ML-based techniques, including the Gaussian process Regression (GPR), regionally tuned empirical techniques, including the ocean color (OC3) algorithm and the spectral band ratios, as well as the globally trained Case-2 regional/coast colour (C2RCC) processing chain model C2RCC-networks. The proposed OCN model achieved reduced mean absolute error compared to the GPR by 5.2%, C2RCC by 51.7%, OC3 by 22.6%, and spectral band ratios by 29%. Moreover, the proposed spatial window and depth-integrated match-up creation techniques improved the performance of the proposed OCN by 57%, GPR by 41.9%, OC3 by 5.3%, and spectral band ratio method by 24% in terms of RMSE compared to the conventional match-up selection approach.  © 2008-2012 IEEE.","Arctic Ocean; Barents Sea; Chlorophyll; Color; Geometrical optics; Machine learning; Remote sensing; Spectroscopy; Design and implements; Empirical techniques; Gaussian process regression; Multi spectral imager; Neural network model; Optical remote sensing; Remote sensing of ocean; Spectral distribution; chlorophyll a; estimation method; machine learning; monitoring; ocean color; remote sensing; Sentinel; Image enhancement","Barents sea; Chlorophyll-a (Chl-a) monitoring; ocean color (OC)","Article","Final","All Open Access; Gold Open Access; Green Open Access","Scopus","2-s2.0-85104634963"
"Wenhu L.; Shuming L.; Renhan C.; Yue Y.; Ting Y.","Wenhu, Lu (57112459400); Shuming, Liu (23097654600); Renhan, Cai (57203895101); Yue, Yin (57203899524); Ting, Yu (57203900857)","57112459400; 23097654600; 57203895101; 57203899524; 57203900857","Shallow water depth inversion based on the multi-spectral data of GF-1 satellite- case study on the Ganquan Island","2018","Proceedings of the International Offshore and Polar Engineering Conference","2018-June","","","703","708","5","","0","https://www.scopus.com/inward/record.uri?eid=2-s2.0-85053455071&partnerID=40&md5=77b0668898f2f4c5d818a4da51d3f102","Remote sensing technology is an efficient and accurate tool for real-time large-scale inversion of numerous and complex islands and reefs in South China Sea. The satellite multi-spectral data over Ganquan Island acquired by China GF-1 satellite on May 12, 2016 was converted to land surface reflection by radiometric correction with absolute calibration coefficient, geometric correction and atmospheric correction. And the Pearson correlation analysis of the single-band reflectance and dual-band reflectance ratios of 93 water depth measurements and their corresponding pixels in the study area were analyzed. The correlation analysis showed that the negative correlation of reflectance value with the single band (P <0.01), and the ratio of double band was significantly correlated with water depth (P <0.01). The Band2, Band3, Band2/Band1 and Band4/Band2, which have the highest correlations with the water depth, are selected to construct the single band model, double band model and band-ratio model, respectively. The parameters of the inversion model are obtained by the regression analysis. The results show that band ratio model of Band2/Band1 and Band4/Band2 fit the best of water depth inversion in the study area. Together with the in-situ observation of 30 stations in the study area, the RMSE, MAE and MRE methods are used to analyze the precision of the water depth inversion. The comprehensive accuracy of water depth inversion derived from the model on the selected band is 1.44m, which is better than that of traditional blue-green band, suggesting a more suitable remote sensing inversion in Ganquan Island area. Copyright © 2018 by the International Society of Offshore and Polar Engineers (ISOPE)","Arctic engineering; Correlation methods; Reefs; Reflection; Regression analysis; Satellites; Offshore oil well production; Atmospheric corrections; Islands; Negative correlation; Pearson correlation analysis; Radiometric corrections; Remote sensing technology; Single-band reflectance; Water depth; Absolute calibration; Remote sensing","GF-1 satellite; Islands; Reefs; Remote sensing; Water depth inversion","Conference paper","Final","","Scopus","2-s2.0-85053455071"
"Ahola R.; Chénier R.; Faucher M.-A.; Horner B.; Sagram M.","Ahola, Ryan (57203509394); Chénier, René (6602083043); Faucher, Marc-André (57203505060); Horner, Bradley (57204630166); Sagram, Mesha (57204634888)","57203509394; 6602083043; 57203505060; 57204630166; 57204634888","Satellite derived bathymetry for Arctic charting: A review of sensors and techniques for operational implementation within the Canadian Hydrographic Service","2018","Proceedings of SPIE - The International Society for Optical Engineering","10784","","1078407","","","","10.1117/12.2324965","3","https://www.scopus.com/inward/record.uri?eid=2-s2.0-85056476374&doi=10.1117%2f12.2324965&partnerID=40&md5=758d5b01422e6adf49bed40685c4e8af","Canada's coastline presents challenges for navigational charting. Within Arctic regions, in situ surveying presents risks to surveyors, is time consuming and costly. To better meet its mandate, the Canadian Hydrographic Service (CHS) has been investigating the potential of remote sensing to compliment traditional charting techniques. This paper focuses on an evaluation of sensors and techniques for operational Satellite Derived Bathymetry (SDB) implementation. Analysis focused on Cambridge Bay, Nunavut using Pléiades, SPOT, WorldView and PlanetScope imagery. Multiple SDB techniques were applied to evaluate their agreement with in-situ bathymetric measurements: • An empirical logarithm band ratio approach. • A multiple band modeling technique. • A multi-dimensional Look-Up-Table approach. Through this analysis, CHS attempted to answer critical questions for operational SDB implementation: • Do specific optical sensors offer advantages for SDB? • Are there advantages/disadvantages with the application of SDB techniques within the examined environment? • Can multiple SDB techniques improve CHS's understanding of the confidence it can place in remotely sensed bathymetry estimates? Early results have achieved overall root mean square errors of 0.56 to 0.99 m relative to in situ survey depths for all sensors and techniques. These similarities suggest that CHS can be confident in the accuracies observed from various SDB approaches. Results do not indicate significant advantages or disadvantages of particular optical sensors, suggesting other factors contain greater importance for SDB image selection (e.g. sea floor visibility). While this analysis provides excellent information for operational empirical SDB implementation within Arctic environments, further work is required within other Canadian coastal regions to support national SDB application. © Copyright 2018 SPIE.","Bathymetry; Hydrographic surveys; Hydrophilicity; Mean square error; Optical sensors; Satellites; Sea ice; Table lookup; Canadian Arctic; Canadian hydrographic services; Empirical model; High resolution; Multi-spectral; Navigational Charting; Remote sensing","Canadian Arctic; Canadian Hydrographic Service; Empirical Models; High Resolution Optical; Multispectral; Navigational Charting; Remote Sensing; Satellite Derived Bathymetry","Conference paper","Final","","Scopus","2-s2.0-85056476374"
"Asmus V.V.; Volgutov R.V.; Deryugina V.V.; Krovotyntsev V.A.; Maksimov A.A.; Milekhin O.E.; Trenina I.S.","Asmus, V.V. (6602215306); Volgutov, R.V. (57208656154); Deryugina, V.V. (57208644267); Krovotyntsev, V.A. (6506145899); Maksimov, A.A. (57201703614); Milekhin, O.E. (6602937121); Trenina, I.S. (57204544026)","6602215306; 57208656154; 57208644267; 6506145899; 57201703614; 6602937121; 57204544026","Satellite Technologies Applied to Hydrometeorological Problems in the Arctic Region","2019","Russian Meteorology and Hydrology","44","4","","250","261","11","10.3103/S1068373919040046","2","https://www.scopus.com/inward/record.uri?eid=2-s2.0-85065386827&doi=10.3103%2fS1068373919040046&partnerID=40&md5=b17b23defd07a544f13801c52f481971","The study provides the overview of the Russian and foreign Earth satellite observation systems used to monitor the Arctic region. The plans of development of Russian hydrometeorological constellation in the next years are outlined. A brief description of the Arktika-M satellite system is presented. The informational prospects are discussed of using IR data from MSU-IK-SRM scanning radiometer installed onboard Kanopus-V-IK satellite to monitor the Arctic sea ice. Various techniques of satellite data processing developed and used in the Planeta Research Center for Space Hydrometeorology are presented including the plotting of raster and vector Arctic sea ice maps, the maps of automated detection and classification of Arctic ice structures with multispectral imagery, sea ice drift, and sea ice boundaries in the Arctic region and its Russian sector. The long-term satellite datasets on Arctic sea ice mapping are analyzed, sea ice reduction is revealed. Map validation results for the Arctic sea ice boundaries obtained from Russian and foreign satellite data are presented. © 2019, Allerton Press, Inc.","Arctic; Russian Federation; Data handling; Ocean currents; Sea ice; Vector spaces; Automated detection and classification; Earth satellite observations; Ice monitoring; Multi-spectral imagery; Satellite data processing; Satellite technology; Scanning radiometer; The Arctic; arctic environment; data processing; hydrometeorology; ice cap; model test; model validation; monitoring system; radiometer; satellite data; sea ice; Satellite imagery","satellite Earth monitoring; sea ice monitoring; The Arctic","Article","Final","","Scopus","2-s2.0-85065386827"
