"Authors","Author full names","Author(s) ID","Titles","Year","Source title","Volume","Issue","Art. No.","Page start","Page end","Page count","DOI","Cited by","Link","Abstract","Indexed Keywords","Author Keywords","Document Type","Publication Stage","Open Access","Source","EID"
"Sui Y.; Guo H.; Liu G.; Ren Y.","Sui, Yue (55323274700); Guo, Huadong (56415384100); Liu, Guang (48461511700); Ren, Yuanzhen (57190391989)","55323274700; 56415384100; 48461511700; 57190391989","Analysis of long-term moon-based observation characteristics for arctic and antarctic","2019","Remote Sensing","11","23","2805","","","","10.3390/rs11232805","14","https://www.scopus.com/inward/record.uri?eid=2-s2.0-85076515001&doi=10.3390%2frs11232805&partnerID=40&md5=4831dfd5ffbd5719960264524c282ba3","The Antarctic and Arctic have always been critical areas of earth science research and are sensitive to global climate change. Global climate change exhibits diversity characteristics on both temporal and spatial scales. Since the Moon-based earth observation platform could provide large-scale, multi-angle, and long-term measurements complementary to the satellite-based Earth observation data, it is necessary to study the observation characteristics of this new platform. With deepening understanding of Moon-based observations, we have seen its good observation ability in the middle and low latitudes of the Earth's surface, but for polar regions, we need to further study the observation characteristics of this platform. Based on the above objectives, we used the Moon-based Earth observation geometric model to quantify the geometric relationship between the Sun, Moon, and Earth. Assuming the sensor is at the center of the nearside of the Moon, the coverage characteristics of the earth feature points are counted. The observation intervals, access frequency, and the angle information of each point during 100 years were obtained, and the variation rule was analyzed. The research showed that the lunar platform could carry out ideal observations for the polar regions. For the North and South poles, a continuous observation duration of 14.5 days could be obtained, and as the latitude decreased, the duration time was reduced to less than one day at the latitude of 65ff in each hemisphere. The dominant observation time of the North Pole is concentrated from mid-March to mid-September, and for the South Pole, it is the rest of the year, and as the latitude decreases, it extends outward from both sides. The annual coverage time and frequency will change with the relationship between the Moon and the Earth. This study also proves that the Moon-based observation has multi-angle observation advantages for the Arctic and the Antarctic areas, which can help better understand large-scale geoscientific phenomena. The above findings indicate that the Moon-based observation can be applied as a new type of remote sensing technology to the observation field of the Earth's polar regions. © 2019 by the authors.","Climate change; Earth (planet); Geometry; Observatories; Poles; Remote sensing; Arctic regions; coverage characteristics; Diversity characteristics; Earth observations; Geometric simulation; Remote sensing technology; Satellite based Earth observation; Temporal and spatial scale; Moon","Antarctic and Arctic regions; coverage characteristics; geometric simulation; Moon-based Earth observation","Article","Final","All Open Access; Gold Open Access","Scopus","2-s2.0-85076515001"
"Kennedy B.E.; King D.J.; Duffe J.","Kennedy, Blair E. (57206433570); King, Doug J. (7404430182); Duffe, Jason (6603325238)","57206433570; 7404430182; 6603325238","Retrieval of arctic vegetation biophysical and biochemical properties from chris/proba multi-angle imagery using empirical and physical modelling","2021","Remote Sensing","13","9","1830","","","","10.3390/rs13091830","1","https://www.scopus.com/inward/record.uri?eid=2-s2.0-85105914929&doi=10.3390%2frs13091830&partnerID=40&md5=e9d36310147b6ab9265f3274d3150511","Mapping and monitoring of Arctic vegetation biochemical and biophysical properties is gaining importance as global climate change is disproportionately affecting this region. Previous studies using remote sensing to model Arctic vegetation biochemical and biophysical properties have generally involved empirical modelling with nadir looking broadband sensors and have typically been conducted at the field scale in one study area. Satellite hyperspectral remote sensing has not been previously investigated for retrieving leaf and canopy biochemical and biophysical properties of Arctic vegetation across multiple sites using either empirical or physically-based modelling approaches. Furthermore, multi-angle hyperspectral sensors (CHRIS/PROBA), which can provide insight into vegetation reflectance anisotropy and potentially improve vegetation parameter estimation, have also not been investigated for this purpose. In this study, three modelling approaches previously investigated with field spectroscopy data (Kennedy et al., 2020) were used with CHRIS Mode-1 imagery to predict leaf chlorophyll content, plant area index and canopy chlorophyll content across a bioclimatic gradient in the Western Canadian Arctic. Modelling approaches included: parametric linear regression based on vegetation indices (VI), non-parametric machine learning Gaussian processes regression (GPR) and inversion of the PROSAIL radiative transfer model using a look-up table approach (LUT). CHRIS imagery was acquired with −55◦, −36◦, 0◦, +36◦, +55◦ view zenith angles (VZA) between 2011 and 2014 over three field sites extending from the Richardson Mountains in central Yukon, Canada to the north end of Banks Island, Northwest Territories, Canada. Field measurements were acquired within several weeks of satellite acquisitions. GPR had the best model fit (mean cross-validated (cv ) coefficient of determination, r2 cv = 0.61 across all vegetation variables, sites and VZAs vs. 0.59 for the simple ratio, SR) and predictive performance (normalized root mean square error, NRMSEcv = 0.13 vs. 0.14 for SR). The revised optimized soil adjusted VI (ROSAVI) performance was slightly poorer (r2 cv = 0.51; NRMSEcv = 0.15). The physically-based PROSAIL model performed poorer than all empirical models (r2 = 0.50; NRMSE = 0.18). This ranking of model performance is similar to that found in the previous field spectroscopy study, where empirical model fits and predictive performance were only slightly worse. With respect to view angle performance, NRMSE varied only slightly, indicating no distinct advantage for any one VZA. Overall, strong potential has been demonstrated for empirical modelling of Arctic vegetation chlorophyll and plant area index using hyperspectral data combined with band selection/optimization procedures in the Arctic. Recently launched and future hyperspectral satellites, including next generation airborne sensors, will likely provide improvements to the model performance reported here. © 2021 by the authors. Licensee MDPI, Basel, Switzerland.","Biophysics; Chlorophyll; Climate change; Dielectric properties; Forestry; Mean square error; Radiative transfer; Remote sensing; Satellites; Table lookup; Vegetation; Coefficient of determination; Gaussian processes regressions (GPR); Hyperspectral remote sensing; Hyperspectral satellite; Leaf chlorophyll content; Physically-based Modelling; Radiative transfer model; Root mean square errors; Learning to rank","Arctic ecosystems; Bioclimatic gradient; CHRIS/PROBA; Empirical modelling; Inversion; Multi-angle satellite spectroscopy; Physical modelling; Plant traits; Vegetation biochemical and biophysical properties","Article","Final","All Open Access; Gold Open Access","Scopus","2-s2.0-85105914929"
"Zhang C.; Zhang D.; Zhang M.; Mao W.","Zhang, Chi (57199502562); Zhang, Di (57131596000); Zhang, Mingyang (56177299900); Mao, Wengang (36084909000)","57199502562; 57131596000; 56177299900; 36084909000","Data-driven ship energy efficiency analysis and optimization model for route planning in ice-covered Arctic waters","2019","Ocean Engineering","186","","106071","","","","10.1016/j.oceaneng.2019.05.053","55","https://www.scopus.com/inward/record.uri?eid=2-s2.0-85067263440&doi=10.1016%2fj.oceaneng.2019.05.053&partnerID=40&md5=a02cf7611b7c903caeb653d05f77f485","As increasing numbers of merchant ships navigate in the Arctic waters, more energy efficient navigation in the Arctic is needed for both economic and environmental purposes. This paper aims to provide a comprehensive analysis of energy efficiency of ice-going ships. Firstly, a data-driven model based on neural network theory is developed to predict the energy efficiency of ships in the Arctic. Then, a route with optimum energy efficiency is presented, intended to cut costs and be as environmentally friendly as possible. Finally, a case study is carried out to analyze the performance of a case study ship sailing at various environmental conditions. The results indicate that when planning the route for such an Arctic ship, it would be shortsighted only to focus on distance rather than energy efficiency. Moreover, the model shows good agreement between the simulation and real-life navigation. It is expected that the construction of this multi-angle, energy efficiency optimization model could help to improve Arctic navigation. © 2019 Elsevier Ltd","Arctic Ocean; Navigation; Optimization; Ships; Comprehensive analysis; Data-driven model; Energy efficiency analysis; Energy efficiency optimizations; Energy efficient; Environmental conditions; Optimization modeling; Route planning; artificial neural network; energy efficiency; merchant ship; model; navigation; optimization; transportation planning; Energy efficiency","Arctic navigation; Optimization model; Route planning; Ship energy efficiency","Article","Final","All Open Access; Green Open Access","Scopus","2-s2.0-85067263440"
"Segal R.A.; Scharien R.K.; Cafarella S.; Tedstone A.","Segal, Rebecca A. (56655541400); Scharien, Randall K. (9943588200); Cafarella, Silvie (57208240667); Tedstone, Andrew (55347711100)","56655541400; 9943588200; 57208240667; 55347711100","Characterizing winter landfast sea-ice surface roughness in the Canadian Arctic Archipelago using Sentinel-1 synthetic aperture radar and the Multi-angle Imaging SpectroRadiometer","2020","Annals of Glaciology","61","83","","284","298","14","10.1017/aog.2020.48","9","https://www.scopus.com/inward/record.uri?eid=2-s2.0-85087759379&doi=10.1017%2faog.2020.48&partnerID=40&md5=0230adc914b09e5a844cc095a7754d2f","Two satellite datasets are used to characterize winter landfast first-year sea-ice (FYI), deformed FYI (DFYI) and multiyear sea-ice (MYI) roughness in the Canadian Arctic Archipelago (CAA): (1) optical Multi-angle Imaging SpectroRadiometer (MISR) and (2) synthetic aperture radar Sentinel-1. The Normalized Difference Angular Index (NDAI) roughness proxy derived from MISR, and backscatter from Sentinel-1 are intercompared. NDAI and backscatter are also compared to surface roughness derived from an airborne LiDAR track covering a subset of FYI and MYI (no DFYI). Overall, NDAI and backscatter are significantly positively correlated when all ice type samples are considered. When individual ice types are evaluated, NDAI and backscatter are only significantly correlated for DFYI. Both NDAI and backscatter are correlated with LiDAR-derived roughness (r = 0.71 and r = 0.74, respectively). The relationship between NDAI and roughness is greater for MYI than FYI, whereas for backscatter and ice roughness, the relationship is greater for FYI than MYI. Linear regression models are created for the estimation of FYI and MYI roughness from NDAI, and FYI roughness from backscatter. Results suggest that using a combination of Sentinel-1 backscatter for FYI and MISR NDAI for MYI may be optimal for mapping winter sea-ice roughness in the CAA. &copy; 2020 The Author(s). Published by Cambridge University Press. © 2020 Cambridge University Press. All rights reserved.","Canada; Canadian Arctic; radiometer; remote sensing; sea ice; Sentinel; snow; surface roughness; synthetic aperture radar; winter","Remote sensing; sea ice; snow/ice surface processes","Conference paper","Final","All Open Access; Gold Open Access","Scopus","2-s2.0-85087759379"
"Nolin A.W.; Mar E.","Nolin, Anne W. (7004377842); Mar, Eugene (56595559800)","7004377842; 56595559800","Arctic sea ice surface roughness estimated from multi-angular reflectance satellite imagery","2019","Remote Sensing","11","1","50","","","","10.3390/rs11010050","15","https://www.scopus.com/inward/record.uri?eid=2-s2.0-85059938096&doi=10.3390%2frs11010050&partnerID=40&md5=643690e9874d1f648e8fc432e02a88a1","Sea ice surface roughness affects ice-atmosphere interactions, serves as an indicator of ice age, shows patterns of ice convergence and divergence, affects the spatial extent of summer meltponds, and affects ice albedo. We have developed a method for mapping sea ice surface roughness using angular reflectance data from the Multi-angle Imaging SpectroRadiometer (MISR) and lidar-derived roughness measurements from the Airborne Topographic Mapper (ATM). Using an empirical data modeling approach, we derived estimates of Arctic sea ice roughness ranging from centimeters to decimeters within the MISR 275-m pixel size. Using independent ATM data for validation, we find that histograms of lidar and multi-angular roughness values were nearly identical for areas with a roughness < 20 cm, but for rougher regions, the MISR-estimated roughness had a narrower range of values than the ATM data. The algorithm was able to accurately identify areas that transition between smooth and rough ice. Because of its coarser spatial scale, MISR-estimated roughness data have a variance about half that of ATM roughness data. © 2019 by the authors.","","MISR; Remote sensing; Sea ice; Surface roughness","Note","Final","All Open Access; Gold Open Access; Green Open Access","Scopus","2-s2.0-85059938096"
"Duchesne R.R.; Chopping M.J.; Tape K.D.; Wang Z.; Schaaf C.L.B.","Duchesne, Rocio R. (56422064100); Chopping, Mark J. (6701926018); Tape, Ken D. (12645664000); Wang, Zhuosen (14032501300); Schaaf, Crystal L.B. (7004208584)","56422064100; 6701926018; 12645664000; 14032501300; 7004208584","Changes in tall shrub abundance on the North Slope of Alaska, 2000–2010","2018","Remote Sensing of Environment","219","","","221","232","11","10.1016/j.rse.2018.10.009","7","https://www.scopus.com/inward/record.uri?eid=2-s2.0-85054806597&doi=10.1016%2fj.rse.2018.10.009&partnerID=40&md5=2d5167389617f30d4cb001819a9508b2","Mapping canopy-forming shrubs in tundra is challenging because approaches that rely on spectral information alone struggle to differentiate low and tall shrubs. We present an evaluation of changes in tall shrub (>0.5 m) fractional cover on the North Slope of Alaska between 2000 and 2010, using a new mapping approach that uses satellite imagery from the NASA Multi-angle Imaging SpectroRadiometer (MISR) sensor, ancillary topographic and geographic variables, derived Ross-Li Bidirectional Reflectance Distribution Function (BRDF) kernel (scattering function) weights, and a Boosted Regression Tree (BRT) model. After training and validating the BRT model, 10 predictor variables explained 53% of the variation in tall shrub fractional cover. The isotropic kernel weight from the BRDF model, topographic slope, nadir camera red reflectance, and latitude were the variables that contributed to the model the most as they were used more frequently to generate the regression trees. At a spatial resolution of 250 m, predicted tall shrub fractional cover on the North Slope ranged from 0.00 to 0.21 (RMSE = 0.03), with the vast majority of sites having fractional cover <0.02. High shrub fractional cover values were predicted along floodplains, creeks, and sloped terrain. Temporal comparisons of estimated tall shrub abundance indicated that shrubs expanded during the period 2000–2010. The extent of the area that experienced a change in tall shrub fractional cover >0.06 was <1% (808 km2) of the total area of the North Slope of Alaska (176,524 km2). Tall shrubs may have expanded throughout a larger area but there is insufficient precision in the MISR-based estimates to make an indisputable determination. Nevertheless, 94% of the locations that exhibited a robust change showed a positive trend toward an increase in shrub cover. The tall shrub fractional cover expansion rate varied between 0.006 yr−1 and 0.015 yr−1, with higher rates in the shrubby southwestern portion of the study area. © 2018","Alaska; North Slope; United States; Expansion; Forestry; Landforms; NASA; Photomapping; Radiometers; Reflection; Regression analysis; Rivers; Satellite imagery; Spectrometers; Arctic; Boosted regression trees; CANAPI; Fractional cover; Multiangle imaging spectroradiometer; Tall shrubs; Tundra; abundance; arctic environment; MISR; model validation; range expansion; regression analysis; satellite imagery; shrub; spectral analysis; tundra; vegetation mapping; Distribution functions","Arctic; Boosted Regression Tree (BRT); CANAPI; Fractional cover; Multi-angle Imaging SpectroRadiometer (MISR); Shrub expansion; Tall shrubs; Tundra","Article","Final","","Scopus","2-s2.0-85054806597"
"Väisänen O.; Hao L.; Virtanen A.; Romakkaniemi S.","Väisänen, Olli (56862095200); Hao, Liqing (8720897100); Virtanen, Annele (7006599647); Romakkaniemi, Sami (6507755223)","56862095200; 8720897100; 7006599647; 6507755223","Trajectory-based analysis on the source areas and transportation pathways of atmospheric particulate matter over Eastern Finland","2020","Tellus, Series B: Chemical and Physical Meteorology","72","1","","1","13","12","10.1080/16000889.2020.1799687","1","https://www.scopus.com/inward/record.uri?eid=2-s2.0-85088927621&doi=10.1080%2f16000889.2020.1799687&partnerID=40&md5=11e37354542005cc97b566c24003bf3b","In this study, we utilize aerosol mass spectrometer (AMS) and multi-angle absorption photometer (MAAP) measurements to assess the most predominant source regions of various atmospheric aerosol constituents transported to Eastern Finland. The non-refractory composition data from the AMS were measured during three intensive measurements campaigns in autumn 2012, 2014 and 2016, whereas the continuous long-term measurements on equivalent black carbon were conducted in 2012–2017. According to observations, the highest concentrations of particulate organics, sulphate, ammonium and black carbon originated from western parts of Russia and Eastern Europe, whereas Central Europe showed lesser contribution. In addition, exceptionally high concentrations of sulphate and ammonium were associated with the Timan-Pechora basin located in north-western Russia. Assumingly, this phenomenon could be linked to intensive gas flaring activities taking place in the area. We also performed positive matrix factorization analysis of organic fraction measured by the AMS. The trajectory analysis revealed increased concentration fields (CF) for low-volatility oxygenated organic aerosol (LVOOA) and hydrocarbon-like organic aerosol (HOA) in the same areas as for sulphate and ammonium. Meanwhile, the CF of semi-volatile oxygenated organic aerosol (SVOOA) suggested a local origin. To summarize, our results suggest that Western Russia and Eastern Europe are the most important source regions of several long-range transported aerosol constituents for Eastern Finland. Besides influencing the air quality and aerosol chemical composition on a local scale, these regions may also play a crucial role as the pollutants are transported further north, towards the vulnerable Arctic region. © Tellus B: 2020. © 2020 The Author(s). Published by Informa UK Limited, trading as Taylor & Francis Group.","Finland; aerosol composition; air quality; atmospheric transport; black carbon; concentration (composition); mass spectrometry; particulate matter; photometer; source apportionment; trajectory","aerosol mass spectrometry; black carbon; trajectory analysis","Article","Final","All Open Access; Gold Open Access","Scopus","2-s2.0-85088927621"
"Zhan Y.; Di Girolamo L.; Davies R.; Moroney C.","Zhan, Yizhe (57190131942); Di Girolamo, Larry (6602111828); Davies, Roger (23476370700); Moroney, Catherine (6602136577)","57190131942; 6602111828; 23476370700; 6602136577","Instantaneous top-of-atmosphere albedo comparison between CERES and MISR over the Arctic","2018","Remote Sensing","10","12","1882","","","","10.3390/rs10121882","4","https://www.scopus.com/inward/record.uri?eid=2-s2.0-85058936447&doi=10.3390%2frs10121882&partnerID=40&md5=b9d78ed6945a14d19208de0d77420814","                             The top-of-atmosphere (TOA) albedo is one of the key parameters in determining the Arctic radiation budget, with continued validation of its retrieval accuracy still required. Based on three years (2007, 2015, 2016) of summertime (May-September) observations from the Clouds and the Earth's Radiant Energy System (CERES) and the Multi-angle Imaging SpectroRadiometer (MISR), collocated instantaneous albedos for overcast ocean and snow/ice scenes were compared within the Arctic. For samples where both instruments classified the scene as overcast, the relative root-mean-square (RMS) difference between the sample albedos grew as the solar zenith angle (SZA) increased. The RMS differences that were purely due to differential Bidirectional Reflectance Factor (BRF) anisotropic corrections (σ                             ADM                             ) were estimated to be less than 4% for overcast ocean and overcast snow/ice when the SZA ≤ 70°. The significant agreement between the CERES and MISR strongly increased our confidence in using the instruments overcast cloud albedos in Arctic studies. Nevertheless, there was less agreement in the cloud albedos for larger solar zenith angles, where the RMS differences of σ                             ADM                              reached 13.5% for overcast ocean scenes when the SZA > 80°. Additionally, inconsistencies between the CERES and MISR scene identifications were examined, resulting in an overall recommendation for improvements to the MISR snow/ice mask and a rework of the MISR Albedo Cloud Designation (ACD) field by incorporating known strengths of the standard MISR cloud masks.                          © 2018 by the authors.","Budget control; Snow; Anisotropic correction; Arctic; Bi-directional reflectance factors; CERES; Clouds and the Earth's radiant energy systems; MISR; Multiangle imaging spectroradiometer; Top of atmospheres; Solar radiation","Arctic; CERES; MISR; Top-of-atmosphere albedo","Article","Final","All Open Access; Gold Open Access; Green Open Access","Scopus","2-s2.0-85058936447"
"Fitch K.E.; Garrett T.J.","Fitch, Kyle E. (57190219401); Garrett, Timothy J. (15032788000)","57190219401; 15032788000","Measurement and Analysis of the Microphysical Properties of Arctic Precipitation Showing Frequent Occurrence of Riming","2022","Journal of Geophysical Research: Atmospheres","127","7","e2021JD035980","","","","10.1029/2021JD035980","0","https://www.scopus.com/inward/record.uri?eid=2-s2.0-85128380915&doi=10.1029%2f2021JD035980&partnerID=40&md5=93e1959bb6b6e186cd19666ca93cc985","Detailed ground-based observations of snow are scarce in remote regions, such as the Arctic. Here, Multi-Angle Snowflake Camera measurements of over 55,000 solid hydrometeors—obtained during a two-year period from August 2016 to August 2018 at Oliktok Point, Alaska—are analyzed and compared to similar measurements from an earlier experiment at Alta, Utah. In general, distributions of hydrometeor fall speed, fall orientation, aspect ratio, flatness, and complexity (i.e., riming degree) were observed to be very similar between the two locations, except that Arctic hydrometeors tended to be smaller. In total, the slope parameter defining a negative exponential of the size distribution was approximately 50% steeper in the Arctic as at Alta. Sixty-six percent of particles were observed to be rimed or moderately rimed with some suggestion that riming is favored by weak boundary layer stability. On average, the fall speed of rimed particles was not notably different from aggregates. However, graupel density and fall speed increase as cloud temperatures approach the melting point. © 2022. American Geophysical Union. All Rights Reserved.","Alaska; Alta; Arctic; Oliktok Point; United States; Utah; boundary layer; hydrometeorology; melting; size distribution; snow","Arctic; graupel; riming; snow","Article","Final","","Scopus","2-s2.0-85128380915"
